,Unnamed: 0,date,title,press,reporter,content
152,152,2021.04.26 15:14,문 대통령 “백신 문제 정치화해 불안감 부추기지 말아야”,경향신문,이주영 기자 young78@kyunghyang.com,"문재인 대통령은 26일 “지금 단계에서 백신 문제를 지나치게 정치화하여 백신 수급과 접종에 대해 막연한 불안감을 부추기는 일이 없도록 해달라”고 말했다.문 대통령은 이날 청와대 수석·보좌관 회의에서 “정부 계획대로 4월 말 300만명, 상빈기 중으로 1200만명 또는 그 이상의 접종이 시행될지 여부는 조금만 더 지켜보면 알 수 있다. 계획대로 되지 않으면 (그 이후에) 충분히 문제를 제기할 수 있을 것”이라며 이같이 밝혔다. 백신 수급에 대한 일각의 과도한 문제 제기와 정쟁화를 경계한 발언이다.문 대통령은 최근 미국 제약사 화이자와 코로나19 백신 4000만회분 추가 구매 계약을 체결한 것을 언급하며 “정부는 접종 목표의 이행을 자신하고 있고, 내부적으로는 플러스 알파를 더하여 4월 말까지와 상반기 중의 접종 인원을 더 늘리고 집단 면역도 더 앞당기려는 목표를 갖고 있다”고 강조했다.이어 “혹시라도 있을지 모를 백신수급 불안 요인을 대비하고, 접종 속도를 더 높이는 것은 물론 접종대상 연령 확대와 3차 접종이 필요하게 될 경우까지 대비하여 범정부 TF를 구성하여 백신 물량을 추가 확보하는데 행정력과 외교력을 총동원하고 있다”면서 “이미 확보한 백신 외에 다른 백신에 대해서도 국제 동향과 효과 및 안전성을 면밀히 살펴보고 있다”고 말했다.백신 개발국들의 자국 우선주의에 대해서도 비판했다. 문 대통령은 “코로나와 같은 감염병의 세계적 대유행은 어느 한 나라가 자국의 문제를 해결한다고 해서 끝나는 것이 아니기 때문에 다른 어떤 문제보다도 국제적인 연대와 협력이 필요한데도 국제정치의 현실은 그렇지 않다”며 “여유가 있을 때는 모든 나라가 한 목소리로 연대와 협력을 말했지만 자국의 사정이 급해지자 연합도, 국제 공조도 모두 뒷전이 되어 국경 봉쇄와 백신 수급통제, 사재기 등으로 각자 도생에 나서고 있다”고 지적했다. 특정 국가를 거론하진 않았지만 자국민 우선을 내세우며 백신 수출을 사실상 통제하고 있는 미국 등을 우회 비판한 것으로 해석된다.이어 문 대통령은 “국제적인 연대와 협력을 추구하면서도 그와 같은 냉엄한 국제정치의 현실을 직시해야 하고, 그럴 때일수록 우리도 내부적으로 단합하여 지혜롭게 대응해나가야 한다”면서 “우리와 형편이 다른 나라와 비교할 것 없이 우리의 형편에 맞게 계획을 세우고 계획대로 차질없이 실행하는게 무엇보다 중요하다”고 강조했다.또 “전세계적인 백신 생산부족과 백신 개발국의 자국 우선주의, 강대국들의 백신 사재기 속에서 백신 물량을 확보할 수 있었던 데에는 방역모범국가라는 평가와 함께, 우리 기업들이 갖고 있는 세계 최고 수준의 백신 위탁 생산능력과 특수주사기 생산 능력 등이 큰 힘이 되었다”면서 “지금 우리 기업들은 세 종류의 백신을 위탁생산하고 있는데, 앞으로 더 늘어날 전망”이라고 덧붙였다."
162,162,2021.04.26 08:33,문 대통령 부정평가 다시 최고치 “백신 때문?”···국민의힘·민주당 격차는 줄어,경향신문,박홍두 기자 phd@kyunghyang.com,"문재인 대통령 국정 수행에 대한 부정평가가 다시 최고치를 기록했다는 여론조사 결과가 26일 나왔다. 최근 정부의 코로나19 백신 수급 차질 논란이 영향을 미친 것이라는 분석이 나온다. 국민의힘과 더불어민주당의 정당 지지율 격차는 줄었다.리얼미터가 YTN 의뢰로 지난 19~23일 2523명에게 문 대통령의 국정수행 지지 여부를 물은 결과, 긍정평가는 지난주 대비 0.9%포인트 내린 33.8%로 나타났다. 반면 부정평가는 지난주 대비 1.5%포인트 올라 63.0%였다. ‘모름·무응답’은 0.5%포인트 내린 3.3%였다.지역별로 보면 긍정 평가는 서울과 호남권에서, 부정평가는 충청권과 부산·경남권에서 상승했다.연령대별로는 30·40대에서 긍정평가가 다시 올랐고, 20·50대에서는 부정평가가 증가했따.정당 지지율은 국민의힘이 지난주 대비 0.5%포인트 내린 36.6%로 1위를 지켰다. 민주당은 0.7%포인트 오른 30.7%를 기록했다. 양당 간 격차는 5.9%포인트로 6주 연속 오차범위 밖을 유지했다.국민의힘 지지율 하락은 당대표·원내대표 선출을 앞두고 이명박·박근혜 전 대통령의 사면을 둘러싼 당내 공방이 벌어지면서 일부 부정적 영향을 끼친 것으로 분석된다.이 밖에 국민의당은 0.4%포인트 내린 7.6%, 열린민주당은 0.3%포인트 내린 5.1%, 정의당은 0.1%포인트 내린 3.9%, 시대전환은 0.4%포인트 오른 1.0%, 기본소득당은 0.1%포인트 오른 0.8%를 기록했다. 무당층은 지난주 대비 0.5%포인트 증가한 12.9%로 조사됐다.이번 조사의 표본오차는 95% 신뢰수준에서 ±1.9%포인트다. 자세한 내용은 리얼미터나 중앙선거여론조사심의위원회 홈페이지를 참조하면 된다."
188,188,2021.04.23 15:42,[경향포토]이현주 특검과 환담장 향하는 문 대통령,경향신문,강윤중 기자,문재인 대통령이 23일 청와대 본관 접견실에서 이현주 세월호참사 진상규명 특별검사에게 임명장을 수여한 뒤 환담장으로 이동하고 있다. 문 대통령은 전날 국회 세월호참사 진상규명 특검 후보추천위원회가 특검 후보자를 추천한 지 하루 만에 임명안을 재가했다. 2021.04.23.
189,189,2021.04.23 15:34,[경향포토]이현주 특검에 임명장 수여하는 문 대통령,경향신문,강윤중 기자,"문재인 대통령이 23일 청와대 본관 접견실에서 이현주 세월호참사 진상규명 특별검사에게 임명장을 수여하고 있다. 문 대통령은 전날 국회 세월호참사 진상규명 특검 후보추천위원회가 이현주, 장선근 변호사를 특검 후보자로 추천한 지 하루 만에 임명안을 재가했다. 2021.04.23."
190,190,2021.04.23 15:33,[경향포토]이현주 세월호 진상규명 특검과 환담장 이동하는 문재인 대통령,경향신문,강윤중 기자,"문재인 대통령이 23일 청와대 본관 접견실에서 이현주 세월호참사 진상규명 특별검사에게 임명장을 수여한 뒤 환담장으로 이동하고 있다. 문 대통령은 전날 국회 세월호참사 진상규명 특검 후보추천위원회가 이현주, 장선근 변호사를 특검 후보자로 추천한 지 하루 만에 임명안을 재가했다. 2021.04.23."
191,191,2021.04.23 15:32,"[경향포토]문재인 대통령, 이현주 변호사 특검에 임명",경향신문,강윤중 기자,"문재인 대통령이 23일 청와대 본관 접견실에서 이현주 세월호참사 진상규명 특별검사에게 임명장을 수여하고 있다. 문 대통령은 전날 국회 세월호참사 진상규명 특검 후보추천위원회가 이현주, 장선근 변호사를 특검 후보자로 추천한 지 하루 만에 임명안을 재가했다. 2021.04.23."
192,192,2021.04.23 15:31,"[경향포토]문 대통령, 이현주 변호사 세월호 진상규명 특검에 임명",경향신문,강윤중 기자,"문재인 대통령이 23일 청와대 본관 접견실에서 이현주 세월호참사 진상규명 특별검사에게 임명장을 수여하고 있다. 문 대통령은 전날 국회 세월호참사 진상규명 특검 후보추천위원회가 이현주, 장선근 변호사를 특검 후보자로 추천한 지 하루 만에 임명안을 재가했다. 2021.04.23."
196,196,2021.04.23 13:41,"문 대통령, ‘세월호 진상규명 특검’에 이현주 변호사 임명",경향신문,김상범 기자 ksb1231@kyunghyang.com,"문재인 대통령이 23일 ‘세월호참사 진상규명 특별검사’로 이현주 변호사를 임명했다.박경미 청와대 대변인은 “문 대통령이 오늘 오전 11시 50분경 임명안을 재가했다”라고 이날 전했다.이현주 변호사는 대전고, 서울대학교 법학과를 졸업한 뒤 조지타운대학교에서 법학 석사과정을 밟았다. 법무부 인권정책과장과 민주사회를위한변호사모임(민변) 대전충청지부장, 대전시 정무부시장을 역임했으며 현재 법무법인 ‘새날로’ 변호사다.앞서 국회 세월호참사 진상규명 특별검사 후보추천위원회는 지난 22일 이현주·장성근 변호사를 특검 후보로 문 대통령에게 추천했다."
197,197,2021.04.23 11:57,문 대통령·민주당 지지율 소폭 반등···‘부동산 정책’ 부정평가는 여전히 가장 높아,경향신문,박홍두 기자 phd@kyunghyang.com,"문재인 대통령과 더불어민주당 지지율이 소폭 반등했다는 여론조사 결과가 23일 나왔다. 다만 ‘부동산 정책’에 대한 부정평가는 여전했다.한국갤럽이 지난 20일~22일 1003명을 대상으로 문 대통령의 직무 수행 평가를 조사한 결과, 긍정평가는 31%, 부정평가는 60%를 기록했다. 10%는 ‘유보’ 의견을 보였다.긍정평가는 지난주에 비해 1% 포인트 반등한 것이다. 부정평가는 62%에서 60%로 2% 포인트 하락했다. 취임 후 긍·부정평가 최저·최고치를 기록하던 지지율 하락세가 반등세로 돌아섰다는 분석도 나왔다.연령별 긍정-부정 평가는 20대가 25%-61%, 30대 41%-52%, 40대 48%-44%, 50대 20%-69%, 60대 이상 25%-67%로 나타났다.정당별로 보면 민주당 지지층의 64%가 대통령 직무 수행에 대해 긍정적으로 평가했고, 국민의힘 지지층은 93%가 부정적이었다. 현재 지지하는 정당이 없는 무당층에서도 부정률이 앞섰다(긍정 17%, 부정 63%).긍정평가 이유로는 ‘코로나19 대처’(28%), ‘최선을 다함/열심히 한다’(8%), ‘복지 확대’, ‘전 정권보다 낫다’, ‘전반적으로 잘한다’, ‘서민 위한 노력’(이상 4%), ‘안정감/나라가 조용함’, ‘정직함/솔직함/투명함’, ‘개혁/적폐청산/개혁의지’(이상 3%) 순으로 나타났다.부정평가 이유로는 ‘부동산 정책’(28%), ‘코로나19 대처 미흡’(17%), ‘경제/민생 문제 해결 부족’(9%), ‘인사 문제’, ‘공정하지 못함/내로남불’(이상 5%), ‘전반적으로 부족하다’(4%), ‘세금인상’, ‘독단적/일방적/편파적’, ‘신뢰할 수 없음/비호감’(이상 3% 등으로 집계됐다.정당지지도는 민주당이 32%를 기록해 국민의힘(28%)을 앞섰다. 민주당 지지도는 지난주보다 1% 포인트 올랐고, 국민의힘은 2% 포인트 내렸다.무당층은 28%, 정의당 5%, 국민의당 4%, 열린민주당 2% 순으로 나타났다.연령별로 보면 민주당 지지도는 40대에서 46%, 국민의힘은 60대 이상에서 44%로 가장 높았고, 무당층 비율은 20대에서 44%로 가장 많았다.정치적 성향별로는 진보층의 56%가 민주당, 보수층의 57%가 국민의힘을 지지한다고 밝혔다. 중도층에서는 더불어민주당 32%, 국민의힘 27%로 엇비슷하며, 28%는 특정 정당을 지지하지 않았다.이번 조사의 표본오차는 95% 신뢰수준에 ±3.1%였다. 자세한 내용은 한국갤럽과 중앙선거여론조사심의위원회 홈페이지를 참조하면 된다."
205,205,2021.04.22 23:00,문 대통령 “온실가스 감축목표 연내 추가 상향”,경향신문,이주영 기자 young78@kyunghyang.com,"문재인 대통령이 22일 미국이 주최한 화상 기후정상회의에 참석해 2030년 국가 온실가스 감축목표(NDC)를 추가로 상향해 연내에 유엔에 제출하겠다고 밝혔다. 또 신규 해외 석탄화력발전소에 대한 공적 금융지원을 중단하겠다고 했다. 기후변화 대응에 적극적인 조 바이든 미 행정부와 보폭을 맞춤으로써 한·미간 공조 및 협력 의지를 보여주려는 취지로 해석된다.문 대통령은 이날 밤 개최된 ‘기후목표 증진’ 주제의 1세션 연설에서 이같은 내용을 발표했다. 바이든 대통령의 초청으로 이뤄진 이번 회의에서 한·미 정상은 처음으로 화상을 통해 얼굴을 마주했다.문 대통령은 지난해 12월 정부가 2030년까지 온실가스 배출량(NDC)을 2017년 대비 24.4% 감축하겠다는 계획을 밝힌 점을 소개한 뒤 “2050 탄소중립을 실현하기 위한 의지를 담아 NDC를 추가 상향하고자 한다”고 밝혔다. 정부 목표치가 파리협정의 목표달성 수준에 미치지 못한다는 지적에 따라 이를 추가로 끌어올리겠다는 것이다. 정부는 전력 수급, 산업계에 미칠 영향 등에 대한 분석과 사회적 합의를 거쳐 NDC 상향 수준을 결정한다는 방침이다.신규 해외 석탄발전에 대한 공적금융 중단을 선언한 것은 세계적인 석탄발전 투자 중단 흐름에 동참하겠다는 취지다. 이미 영국·미국·독일 등 11개국이 석탄발전 금융지원 중단을 선언했다. 문 대통령은 “우리 정부는 출범 후 국내 신규 석탄화력발전소 건설 허가를 전면 중단하고, 노후 석탄화력발전소 10기를 조기 폐지하여 석탄화력 발전을 과감히 감축했으며, 대신 태양광과 풍력 등 재생에너지 발전을 빠르게 늘리고 있다”면서 “다만 석탄화력발전의 의존도가 큰 개발도상국들의 어려움이 감안돼야 할 것이며, 적절한 지원 방안이 마련돼야 한다”고 덧붙였다.아울러 다음달 한국이 주최하는 P4G(녹색성장과 글로벌 목표 2030을 위한 연대) 정상회의의 성공적 개최를 위해 미국을 비롯한 국제사회의 관심과 참여를 당부했다.이번 회의는 시진핑(習近平) 중국 국가주석 등 40개국 정상이 참석한 가운데 이틀에 걸쳐 진행된다. 미·중 갈등이 격화되는 가운데 바이든 대통령 취임 이후 미·중 정상이 처음으로 화상 대면한 자리이기도 하다."
206,206,2021.04.22 22:42,"[경향포토]문재인 대통령, 기후정상회의서 기후대응 주제 연설",경향신문,강윤중 기자 yaja@kyunghyang.com,문재인 대통령이 22일 오후 청와대 상춘재에서 미국이 주최한 화상 기후정상회의에 참석해 ‘기후목표 증진’ 주제의 1세션에서 2050 탄소중립 실현을 위한 기후대응 행동을 주제로 연설하고 있다.  2021.04.22.
207,207,2021.04.22 22:42,"[경향포토]문재인 대통령, 기후정상회의에서 2050 탄소중립 실현 위한 기후대응 행동 연설",경향신문,강윤중 기자 yaja@kyunghyang.com,문재인 대통령이 22일 오후 청와대 상춘재에서 미국이 주최한 화상 기후정상회의에 참석해 ‘기후목표 증진’ 주제의 1세션에서 2050 탄소중립 실현을 위한 기후대응 행동을 주제로 연설하고 있다.  2021.04.22.
208,208,2021.04.22 22:42,[경향포토]기후정상회의에서 연설하는 문 대통령,경향신문,강윤중 기자 yaja@kyunghyang.com,문재인 대통령이 22일 오후 청와대 상춘재에서 미국이 주최한 화상 기후정상회의에 참석해 ‘기후목표 증진’ 주제의 1세션에서 2050 탄소중립 실현을 위한 기후대응 행동을 주제로 연설하고 있다.  2021.04.22.
209,209,2021.04.22 22:42,[경향포토]기후정상회의에서 연설하는 문재인 대통령,경향신문,강윤중 기자 yaja@kyunghyang.com,문재인 대통령이 22일 오후 청와대 상춘재에서 미국이 주최한 화상 기후정상회의에 참석해 ‘기후목표 증진’ 주제의 1세션에서 2050 탄소중립 실현을 위한 기후대응 행동을 주제로 연설하고 있다.  2021.04.22.
212,212,2021.04.22 21:49,[경향포토]기후정상회의 참석한 문재인 대통령,경향신문,강윤중 기자 yaja@kyunghyang.com,문재인 대통령이 22일 오후 청와대 상춘재에서 미국이 주최한 화상 기후정상회의에 참석해 조 바이든 미국 대통령의 발언을 듣고 있다.  2021.04.22.
213,213,2021.04.22 21:48,[경향포토]기후정상회의 참석한 문 대통령과 각 국 정상들,경향신문,강윤중 기자 yaja@kyunghyang.com,"문재인 대통령이 22일 오후 청와대 상춘재에서 미국이 주최한 화상 기후정상회의에 참석해 조 바이든 미국 대통령의 발언을 듣고 있다. 시진핑 중국 국가 주석, 스가 일본 총리 등 각 국 정상들이 화상을 통해 참석하고 있다. 2021.04.22."
214,214,2021.04.22 21:46,[경향포토]기후정상회의에서 바이든 발언 듣는 문재인 대통령,경향신문,강윤중 기자 yaja@kyunghyang.com,문재인 대통령이 22일 오후 청와대 상춘재에서 미국이 주최한 화상 기후정상회의에 참석해 조 바이든 미국 대통령의 발언을 듣고 있다.  2021.04.22 강윤중 기자
229,229,2021.04.22 11:32,"문 대통령, ‘폐플라스틱 넥타이’ 매고 기후정상회의 참석…바이든과 첫 대면회의",경향신문,이주영 기자 young78@kyunghyang.com,"문재인 대통령이 22일 오후 미국이 주최하는 화상 기후정상회의에 참석한다. 조 바이든 미국 대통령의 초청으로 이뤄진 것으로, 문 대통령과 바이든 대통령은 첫 화상 대면회의를 하게 된다. 특히 이번 회의에는 시진핑(習近平) 중국 국가주석도 참석하겠다고 밝혀, 미·중 갈등 국면에서 문 대통령이 미·중 두 정상과 얼굴을 마주하게 된다는 점에서 주목된다.문 대통령은 이날 밤 9시부터 11시까지 개최되는 ‘기후목표 증진’ 주제의 1세션에 참석해 2050 탄소중립 실현을 위한 기후대응 행동을 주제로 연설할 예정이다.문 대통령은 2030 국가 온실가스 감축목표(NDC)와 관련한 추가 상향 노력을 발표하고, 전세계적인 탈석탄 노력에 적극 동참하겠다는 의지를 밝힐 예정이다. 이와 함께 다음달 한국이 주최하는 P4G(녹색성장과 글로벌 목표 2030을 위한 연대) 서울 정상회의의 성공적 개최를 위해 미국을 비롯한 국제사회의 관심과 참여를 당부할 예정이다.임세은 청와대 부대변인은 서면브리핑에서 “한·미간 기후변화 대응 협력을 강화해 다각적 차원의 한·미동맹 확대에 기여할 수 있을 것”이라고 의미를 부여했다.청와대 상춘재에 마련된 화상회의장은 디지털기술과 전통을 융합한 한국형 서재 스타일로 꾸며졌다고 청와대는 전했다. 문 대통령은 폐플라스틱을 활용한 재생 원단으로 제작된 국내 중소기업의 친환경 넥타이를 착용할 예정이다. 또 LG와 SK의 파우치형 전기 배터리, 삼성의 차량용 배터리 모형을 배치해 각국 정상에 한국의 차세대 배터리를 홍보할 예정이다."
234,234,2021.04.21 21:11,"문 대통령 “북한 도쿄 올림픽 참가, 아직 물 건너간 것 아니다”",경향신문,이주영 기자 young78@kyunghyang.com,"오세훈·박형준 시장과 오찬…MB·박근혜 사면론엔 “국민 공감대 우선”문재인 대통령은 21일 북한의 도쿄 올림픽 불참 결정과 관련 “북한이 막판에 참가할 수도 있기 때문에 아직 물 건너간 형태는 아니다”라며 북한의 최종 선택을 지켜봐야 한다는 입장을 밝혔다. 문 대통령은 청와대에서 오세훈 서울시장, 박형준 부산시장과 오찬간담회를 하면서 2032년 서울·평양 올림픽 공동 개최 추진에 대한 오 시장의 언급에 “아직 포기하기는 이르다”며 이같이 말했다.북한은 지난 6일 코로나19 사태를 이유로 도쿄 올림픽 불참을 선언한 바 있다. 2032년 하계올림픽은 박원순 전 서울시장 시절 서울시가 평양과 공동 유치를 추진했지만, 국제올림픽위원회(IOC)는 호주 브리즈번을 우선 협상자로 선정했다.문 대통령은 “바흐 IOC 위원장은 북한이 (도쿄 올림픽에) 불참한다고 했지만 그간의 경험에 비춰보면 막판까지 좀 더 기다려봐야 한다”면서 “북한과의 대화 테이블이 (다음달) 한·미 정상회담을 계기로 만들어질 수 있으니 올림픽을 공동 유치하는 문제도 가능성이 있는 것이다. 그때까지는 포기하지 않고 있다”고 말했다. 청와대 고위관계자는 “북한이 최종 불참하게 되면 사실상 (올림픽 공동 유치가) 어려운 거라 봐야겠지만 아직은 북한의 최종 선택을 봐야 한다”며 “북한이 도쿄 올림픽에 참가하면 서울·평양 올림픽 공동 개최도 여지가 남아 있다”고 설명했다.전직 대통령 이명박·박근혜씨 사면론과 관련해 문 대통령은 “국민 공감대를 생각하지 않을 수 없고, 국민통합에 도움이 되도록 작용돼야 한다. 이 두 가지를 함께 고려할 수밖에 없다”며 현시점에선 적절치 않다는 입장을 재확인했다.문 대통령은 코로나19 백신 문제에 대해 “지금은 질병관리청이 명단을 정해 지자체에 통보하는 방식인데, 이제는 지자체가 자율성을 갖고 (명단을) 선정하고 방역당국은 물량을 공급하는 식으로 바꿀 생각”이라며 “수급에 대한 불안보다 백신을 즉시 속도감 있게 접종하지 못하는 게 더 문제다. 두 시장님도 협조해달라”고 말했다."
