,date,title,reporter,content,press
251,2021.04.21,"‘백신 사지마비’ 청원에… 文 “안타까운 상황, 지원방안 검토”",오경묵 기자,"문재인 대통령은 최근 아스트라제네카 코로나 바이러스 감염증 백신을 접종한 후 사지마비 증세가 나타나 입원한 40대 간호조무사에 대한 지원 방안을 검토하라고 21일 지시했다.
박경미 청와대 대변인은 이날 서면브리핑을 통해 문 대통령이 간호조무사 가족에게 위로를 전하고 당국에 이런 지시를 내렸다고 밝혔다.
문 대통령은 “간호조무사의 안타까운 상황에 따뜻한 위로가 필요하다”며 “관계 당국에서 직접 찾아가 상황을 살피고 어려움을 덜어달라”고 했다.
이어 “의학적 인과관계 규명에는 시간이 걸리겠지만, 그와 별도로 치료비 지원 등 정부의 지원제도에 따라 할 수 있는 조치들이 신속하게 이뤄지도록 세심하게 살펴야 한다”고 했다.
문 대통령은 “(간호조무사는) 평소에 건강했다고 한다”며 “원인 규명에 최선을 다해 달라”고 했다.
이 간호조무사의 남편 이모(37)씨는 20일 청와대 국민청원 게시판에 ‘AZ(아스트라제네카) 접종 후 사지 마비가 온 간호조무사의 남편입니다’라는 글을 올렸다. 그는 “아내는 우선접종 대상자라 백신 접종을 거부할 수도, 백신을 선택할 권리도 없었다”고 했다.
이어 “지금 와서 보니 입원 3~4일 전부터 전조증상이 있었지만 정부의 안내 부족으로 알아채지 못했다”며 “정부의 말만 믿고 괜찮아지리라고 생각하며 진통제를 먹으며 일했지만 결국 접종 19일 만에 사지가 마비돼 입원했다”고 썼다.
간호조무사는 급성 파종성 뇌척수염 진단을 받았다. 치료비와 간병비가 일주일에 400만원씩 나왔다고 한다. 이씨는 “질병청에 문의 전화를 하면 고양시청 민원실로 전화를 돌리고, 시청 민원실은 다시 구청 보건소로 ‘핑퐁’하는 일을 일주일 정도 겪었더니 너무 화가 나더라”고 했다.
이씨 아내의 사연이 알려지자 질병청은 “(간호조무사와) 비슷한 해외 사례가 있지만, 아직은 인과성은 인정되지 않는다”고 했다. 이씨는 “국가를 믿고 백신을 맞았는데 돌아온 것은 감당하기에 너무나 큰 고통”이라고 했다.",조선일보
342,2021.04.10,WHO “5월 전 대북 코로나 백신 공급 어려워”,노석조 기자,"북한에 코로나 백신 공급이 예정보다 늦어질 전망이다.
백신 공동구매 국제 프로젝트인 ‘코백스 퍼실리티’가 북한에 제공할 신종 코로나바이러스 감염증(코로나19) 백신 공급이 예정보다 지연될 전망이다.
에드윈 살바도르 세계보건기구(WHO) 평양사무소장은 “코백스 협의체를 주도하는 세계백신면역연합(GAVI)이 지난달 25일 북한 당국에 백신 공급이 지연될 것이라고 통보했다”며 “5월 이전에는 북한에 백신이 공급되지 않을 것으로 보인다”고 밝혔다고 미국의소리(VOA) 방송이 10일 보도했다. 코백스 협의체는 백신 공동구매 국제 프로젝트를 총괄하고 있다.
다만, 살바도르 소장은 이와 같은 공급 지연은 북한에 국한된 것이 아니라 코백스로부터 백신을 받는 모든 국가에 적용되는 것이라고 했다.
살바도르 소장은 앞서 북한이 작성해 제출한 백신 보급·접종 계획에 일선 의료인과 노인 등에 대한 접종 우선순위가 명시돼 있었다고 말했다.
앞서 코백스는 북한에 인도 혈청연구소(SII)가 생산한 아스트라제네카 코로나19 백신 199만2000 회분을 배정하고 이 가운데 170만4000 회분을 5월까지 전달하겠다고 밝혔다.",조선일보
365,2021.04.19,"[이동훈의 촉]백신 필요없다던 기모란, 文 정권의 방역 수장 되다",이동훈 논설위원,"백신거지, 희망 고문.
국민의힘 박대출 의원이 지금 상황을 이렇게 묘사했습니다. 오늘 코로나 신규확진자는 532명. 엿새만의 500명대이긴 합니다만 휴일 검사건수가 대폭 감소한 데 따른 겁니다. 그러나 확산세가 꺾였다고 보기 어렵습니다.4차 유행 조짐에 대한 걱정이 많습니다.
이걸 한방에 해결할 백신은 부족합니다. 부족해도 이만저만 부족한 게 아닙니다.11월 집단면역을 형성하겠다는 게 정부 목표입니다. 헛말이 될 공산이 큽니다. 전문가들은 지난해부터 백신이 ‘게임 체인저’라고 했습니다. 코로나 이후 경제 판도를 좌우할 것으로 전망했습니다. 이제 그 백신에 의한 ‘경제 디바이드’가 성큼 다가왔습니다. 백신 여권이 곧 등장합니다. 백신 접종이 잘 된 나라끼리만 인적·물적 교류를 하는 백신 장벽이 생길 수도 있습니다. 문 정부는 세계 최고 방역에 안주했습니다. 때론 정치적 이용까지 즐겼습니다.
3조8000억 원이면 되는 백신 구매 적기를 놓쳤습니다. 그런데 52조 원 재난지원금은 뿌렸습니다. 지금도 백신 부족을 숨긴 채 거리두기·영업제한만 죄었다 풀었다 합니다. 국민에게 방역 책임을 떠넘깁니다. 일상을 고단하게 만들고 고통을 줍니다. 그러면서 되레 경제 회복이 빠르고 강하다며 자화자찬합니다. 그러나 숨기는데는 한계가 있습니다. 한국은 백신이 부족해 올해 집단면역이 글렀다는 진실은 곧 드러날수밖에 없습니다.
지금이라도 국가 전체가 총력을 다해 백신 확보에 나서야 하는데 수급 상황은 꼬여만 갑니다. 백신 선진국들은 3차 접종 ‘부스터 샷’을 하겠다고 합니다. 백신 효과를 더 높이기 위해 2차 접종까지 끝낸 사람들에게 일정 시간이 지난 뒤 추가 접종을 하는 것을 뜻합니다. 백신 가뭄은 더 심화할 게 뻔합니다.그나마 우리나라가 확보한 주력백신 아스트라제네카는 혈전 부작용 논란이 벌어졌습니다. 불안합니다.
한때 ‘K주사기’로 찬사를 받았던 최소잔여형 주사기, 여기에서는 이물질이 발견돼 회수되는 일까지 벌어졌습니다.
지방자치단체들은 제각각 방역대책을 내놓고 있습니다. 오세훈 서울시장은 일률적 제한이 아니라 업종별 특성에 따라 영업시간을 탄력적으로 적용하는 ‘서울형 상생방역’을 하겠다고 했습니다.
박형준 부산시장은 점심시간에 5인 이상 모임을 허용하는 ‘부산형 방역’카드를 꺼냈습니다. 이재명 경기지사는 백신을 독자적으로 도입하겠답니다. 오늘 조선일보 뉴욕특파원의 백신 접종기가 실렸습니다.백신을 접종했답니다. 마지막 대목이 인상적입니다. “지난해 6월 뉴욕으로 떠날 때 가족과 회사 동료들은 매주 약국에서 사 모은 마스크를 10장, 20장씩 건네며 ‘위험한 곳에서 이거 쓰고 버티라’고 했다. 한국에서 이 집요한 바이러스의 유일한 방패는 아직 마스크뿐인데, 미국에서 ‘백신 동아줄’을 먼저 잡은 것 같아 기분이 묘했다.”
방역은 위기, 백신은 난망… 이런 상황에서 문재인 대통령은 청와대에 코로나 방역 정책 등을 전담하는 방역기획관을 신설했습니다. 기모란 국립암센터 교수를 발탁했습니다.
이 인사를 두고 비판과 우려의 목소리가 큽니다. 기 교수는 코로나 사태 초기부터 친정부 편향 발언을 하고 정부의 방역 실패를 옹호해온 인물입니다. 기 교수는 김어준씨의 tbs라디오 ‘뉴스공장’에 54 차례 출연했습니다.
코로나 초기 ‘중국인 입국 금지가 필요하다’ 이런 지적이 거셀 때 기 교수는 반대 논리를 제공합니다. “지금까지 발생한 환자를 보면 중국에서 온 한국인에 의해 2차, 3차 감염이 일어났다” 이러면서 정부 입장을 두둔했습니다.
작년 2차대유행때는 이렇게 말했습니다. 김어준씨가 수도권 확진자 증가가 “(보수 단체 집회의) 8·15발이 맞죠?”라고 묻자 기 기획관은 “그렇다”고 동의했습니다.
이런 기 교수는 백신 확보와 관련해선 “백신 수급을 서두를 필요가 없다”는 주장을 되풀이했습니다. “한국은 환자 발생 수준으로 보았을 때 (백신 구입이) 급하지 않다” “(다른 나라가) 예방 접종을 먼저 해 위험을 알려주는 것은 우리가 고마운 것”이라고 했습니다. 백신 확보가 늦은 정부 논리와 똑같습니다. 정부를 두둔하는 논리의 단골 제공자였습니다.
이런 사람을 이 시기에 왜 방역기획관으로 앉힌 걸까요? 백신이 급한 상황에서 방역 정책을 담당하는 방역기획관을 왜 신설한걸까요?
‘코로나 사령탑’ 정은경 질병관리청장의 힘을 빼는 인사, ‘옥상옥 인사’라는 분석이 나옵니다. 조선일보는 기교수의 방역기획관 임명이 정은경 청장에 대한 청와대의 불만 표시라는 말이 있다면서 익명을 요구한 한 전문가의 말을 인용했습니다. “청와대가 질병청에 대한 정치적·행정적 통제를 더 강화하겠다는 것으로 보인다”
작년 9월이었습니다. 문재인 대통령은 질병관리본부를 질병관리청으로 승격시키면서 충북 오송을 직접 찾아 정은경 청장에게 임명장을 줍니다. 그 자리서 ‘K방역의 영웅’이라고 호칭합니다. 그런데 몇 달새 상황이 달라집니다. K방역만 자랑하다가 백신을 놓쳤습니다. 방역에서 원칙적이고 보수적인 정은경 청장에 대해 여권에선 불만이 많다는 얘기는 꽤 나왔습니다. 그렇다고 문재인 대통령이 ‘K방역의 영웅’이라고 명명한 정 청장을 바꿀 수도 없습니다. 그래서 기 기획관을 임명해 사실상 대체한 것 아니냐, 이런 분석이 나옵니다. 사실상 토사구팽인가요?
중앙일보 고정애 논설위원은 익명을 요청한 한 교수의 말을 전합니다. “백신 접종 진행이 잘 안되고 보급도 잘 안된다. 11월 집단면역 달성이 어려우니 여권으로부터 ‘그래도 방역을 완화할 대안이 뭔지 내달라’는 시달림을 받고 있다. 그때까지 해결 못 하면 대선도 물 건너가니까.” 새로운 형태의 방역 정책으로 백신 없는 난국을 돌파하기 위한 정권의 노림수가 있다. 뭐 이런 얘기 같습니다. 이해못할 방역기획관의 임명, 총체적 코로나 위기를 과학과 원칙이 아니라 정치와 꼼수로 다시한번 돌파하겠다는 계산이 깔린 건 아닌지 정말 우려스럽습니다.
",조선일보
395,2021.04.19,"“백신 안 급하다”던 기모란 임명... 靑, 방역마저 ‘코드 인사’ 했나",김아진 기자,"문재인 대통령이 새로 임명한 기모란 청와대 방역기획관은 그동안 정부의 코로나 방역 정책을 홍보하거나 비판적 지적을 방어하는 역할을 해왔다. 기 기획관은 정부의 백신 확보 지연 논란 당시 “우리나라는 환자 발생 수준으로 봤을 때 백신이 급하지 않다” “화이자·모더나는 가격도 비싸다”는 주장을 쏟아냈다. 의료계에서는 기 기획관 임명을 놓고 “여전히 정부와 방역 당국이 친정부 성향이 뚜렷한 일부 전문가 얘기만 듣고 비판적인 목소리는 듣지 않겠다는 것 아니겠냐”고 하고 있다. 청와대는 “기 기획관은 백신이 아닌 방역을 담당한다”며 백신 관련 발언이 문제없다고 했다. 그러나 방역과 백신을 분리해 보는 청와대의 인식을 두고도 비판이 커지고 있다.
기 기획관은 코로나 발생 초기 김어준씨의 TBS 라디오 방송인 ‘뉴스공장’에 출연하면서 이름을 알렸다. 작년 2월부터 지난 4월 13일까지 54차례 나왔다. 김씨의 개인 유튜브 채널인 ‘다스뵈이다’에도 10여 차례 출연했다. 김씨는 작년 3월 기 기획관에게 “설명이 너무 귀에 쏙쏙 들어온다”고 칭찬한 뒤 거의 매주 기 기획관을 출연시켰다. 이 기간 기 기획관은 현실과 다르거나 상황을 왜곡하는 발언을 해왔다. “국민의 코로나 이해에 기여했다”는 청와대 설명과 달리 코로나 이해를 방해했다는 말까지 나온다.
기 기획관은 작년 2월 정부가 운영하는 대한민국정책브리핑 사이트에 기고문을 실으며 “이번 코로나19는 메르스와 달리 환자들의 증상이 심하지 않아서 참 다행”이라고 했다. 같은 달 CBS 라디오에선 “지금까지 발생한 환자를 보면 중국에서 온 한국인에 의해 2차, 3차 감염이 일어났지, 중국에서 온 중국인에 의해 2차, 3차 감염이 일어나지 않았다”며 중국발 외국인 입국 금지를 반대했다. 당시 대다수 방역 전문가의 입장과는 달랐다. 비슷한 시기 기 기획관은 정부가 코로나 위기 단계를 상향하지 않는 것을 옹호했다. 오마이뉴스 인터뷰에서는 “코로나에 걸려서 죽을 수도 있다는 주장은 (사실이) 아닌 것 같다”고도 했다. 김어준씨가 라디오에서 수도권 확진자 증가세와 관련해 “(보수 단체 집회의) 8·15발이 맞죠?”라고 묻자 기 기획관은 “그렇다”고 동의하기도 했다.
특히 기 기획관은 “백신 수급을 서두를 필요가 없다”고 여러 차례 주장했다. 지난해 11월 20일 뉴스공장에 출연해 “한국은 환자 발생 수준이 전 세계적으로 봤을 때 그렇게 급하지 않다”고 했다. 12월 10일에도 “다른 나라가 예방접종을 먼저 해 위험을 알려주는 것은 우리가 고마운 것”이라고 했다. 이 밖에 “백신 확보 문제는 정부가 잘못한 부분이 아니다” “화이자 백신을 계약해놨는데, 더 좋은 게 나오면 물릴 수도 있다” “가격도 화이자와 모더나가 가장 비싼 축에 들어가는데, 아스트라제네카는 4달러 정도밖에 안 한다”는 등의 말도 했다. 김어준씨는 “화이자의 마케팅에 우리가 넘어갈 이유는 없다”며 맞장구쳤다. 기 기획관은 “백신을 먼저 접종했다고 집단 면역이 빠르게 도달한다고 볼 수 없다”는 황당한 발언도 했다.
기 기획관의 발언은 여당에 의해 활용됐다. 김태년 민주당 원내대표는 페이스북에 기 기획관 주장을 싣고 “우리 국민이 맞아야 할 백신은 무엇보다 안전해야 한다”고 했다. 친문 성향 지지자들은 “교수님은 대한민국의 보물”이라고 극찬했다.
의료계는 “코로나 상황도 정확히 파악하지 못한 인사를 코로나 컨트롤타워로 쓰다니 이해가 가질 않는다”고 비판했다. 마상혁 대한백신학회 부회장은 “기 기획관은 일관되게 정부의 방역 실패를 합리화하거나 정부를 일방적으로 옹호하는 입장을 취했다”며 “정책 실패를 지적하고 교정할 전문가가 절실하다”고 했다. 다른 전문가들도 “정치 방역 성공을 자축하는 인사” “의학의 정치화에 앞장선 분”이라는 반응을 보였다. 최대집 대한의사협회 회장은 “기 기획관 임명은 향후 방역 실패 요인으로 작용할 것”이라고 말했다.
일각에선 코로나 사령탑인 정은경 질병관리청장에 대한 청와대의 불만 표시라는 말도 나왔다. 익명을 요구한 한 전문가는 “청와대가 질병청에 대한 정치적·행정적 통제를 더 강화하겠다는 것으로 보인다”고 했다. 야당은 기 기획관의 과거 발언을 문제 삼고 “기 기획관의 청와대행은 남편이 총선에서 낙선한 것에 대한 일종의 보상이 아니냐”며 임명 철회를 요구하고 있다.",조선일보
407,2021.04.23,홍남기 “백신도입 지연 없다… 일부 제약사 추가공급 협의 매우 진전”,,"홍남기 국무총리 직무대행 겸 경제부총리는 23일 “백신 접종이 차질없이 진행 중”이라며 “4월 23일 현재 백신 도입 예정 물량이 지연된 사례는 단 한 건도 없다”고 말했다.
홍 총리대행은 이날 정부서울청사에서 주재한 ‘코로나 백신·치료제’ 상황점검회의에서 “일각에서 정확하지 않은 정보를 토대로 백신 대란, 도입 지연, 접종 차질 등을 지적하며 국민에게 과도한 불안감을 초래하고 있는바, 절대 자제해달라”며 이같이 말했다.
홍 대행은 “백신 접종 57일 만에 200만명을 돌파했다. 4월말까지 300만명, 6월말까지 1200만명 접종 목표를 현재까지 차질없이 진행 중”이라며 “정부는 이미 계약한 백신물량에 대한 차질없는 도입과 계약물량 이외 추가 구매계약 등 투 트랙(Track)으로 총력을 기울여오고 있다”고 했다.
그는 “도입이 계획된 물량은 상반기 2080만회분, 하반기 1억3120만회분”이라며 “상반기 도입분 2080만회분은 4월까지 412만회분, 5월에 376만회, 6월 1292만회 도입해 접종을 추진하게 된다”고 했다.
그러면서 “접종 속도를 기하급수적으로 빠르게 할 것”이라며 “11월 집단면역 추진이라는 목표를 이룰 수 있을 것”이라고 했다.
또 “특히 일부 제약사와는 상당한 물량의 추가 공급에 대한 협의가 매우 진전됐다”면서 “정부의 백신 추가 도입 노력은 기존 계약의 차질 때문이 아니라 추가 소요 가능성 등을 감안한 것”이라고 했다.
홍 대행은 백신 부작용 우려에 관해선 “백신 접종과 인과 관계가 있는 피해가 발생하면 예방접종피해 국가보상에 따라 보상이 이뤄진다”고 했다.",조선일보
409,2021.03.22,"文, 아스트라 접종 하루 전날 “백신 가짜뉴스 경계심 가져달라”",김아진 기자,"문재인 대통령이 22일 아스트라제네카 코로나 백신 안정성 문제와 관련해 “백신 불안감을 부추기는 가짜뉴스는 아예 발붙이지 못하도록 국민들께서 특별한 경계심을 가져달라”고 말했다.
문 대통령은 이날 청와대 수석·보좌관 회의에서 이같이 말하며 “저와 제 아내도 오는 6월G7(주요 7개국) 정상회의에 참석하기 위해 내일 아스트라제네카 백신을 맞는다”면서 “정상회의 수행원들도 수행이 확정된 인원들은 내일 함께 접종을 하고 그 밖에 인원들도 수행이 결정되는대로 접종받게 될 것”이라고 했다. 대통령과 김정숙 여사는 23일 아스트라제네카 백신을 접종한다. 문 대통령은 “국민들께도 백신의 안전성에 조금도 의심을 품지 마시고 접종 순서가 되는대로 접종에 응해주시기 바란다”고 했다. 이어 “2분기에는 접종대상을 대폭 늘려 상반기 중에 1200만명 이상을 접종할 계획”이라며 “정부는 백신 접종과 집단 면역의 속도를 당초 계획보다 높여 나가겠다”고 했다.
문 대통령은 최근 최악의 성적을 내고 있는 고용 지표와 관련해서도 “이 추세대로 라면 3월부터는 작년 수준 또는 그 이상으로 고용이 회복될 수 있을 것”이라고 했다. 그러면서 “올 한해 동안 예상했던 것보다 빠르고 강하게 경제 반등에 성공할 것으로 전망이 된다”고 했다. 문 대통령은 “정부는 고용안정과 일자리 창출을 경제회복의 최우선 목표로 삼고 정책적 노력을 집중하겠다”며 “각 부처는 이번 추경에 포함된 일자리 예산이 국회 통과 즉시 집행될 수 있도록 만전을 기해주기 바란다”고 했다.
한편 이번 한국토지주택공사(LH) 직원들의 신도시 땅투기 의혹과 관련해 “정부로서는 매우 면목 없는 일이 되었지만 우리 사회가 부동산 불법 투기 근절을 위해 힘을 모아야 할 때”라고 강조했다. 그러면서 “개발과 성장의 그늘에서 자라온 부동산 부패의 고리를 끊어낼수 있는 쉽지 않은 기회”라며 “오랫동안 누적된 관행과 부를 축적하는 방식을 근본적으로 청산하고 개혁하는 일인만큼 쉽지 않은 일이다. 문제를 근원적으로 해결하지 않으면 안 된다”고 했다. 문 대통령은 “서민들을 위한 2,4 공급대책은 어떠한 경우에도 차질이 없어야한다는 것을 거듭거듭 강조한다”고 덧붙였다.",조선일보
466,2021.04.25,"안철수 “기모란, 백신 작년말 출시 말했더니 ‘허세'라 했던 분”",김승재 기자,"안철수 국민의당 대표가 25일 기모란 청와대 방역기획관을 겨냥해 “작년 5월에 제가 ‘빠르면 연말에 백신이 나올 테니 대비해야 한다’고 했는데, 그때 ‘정치인의 블러핑(bluffing, 허세·엄포)’이라고 말씀하신 분이 청와대에 가 있다”고 했다.
안 대표는 이날 대한의사협회 정기대의원총회 축사에서 이같이 밝히며 “이런 문제들이 앞으로 더 많이 생길 것이 너무 두렵다”고 했다.
안 대표가 언급한 기 기획관의 발언은 지난해 5월 20일 TBS라디오 ‘김어준의 뉴스공장’에서 나왔다. 김씨가 ‘현실적으로 연말까지 백신이 나올 수 있느냐”고 묻자 기모란 당시 국립암센터 교수는 “그건 어려울 것 같다”고 했다. 이어 “정치인의 블러핑처럼 보이느냐”는 질문에 “그렇다”고 답했다.
이날 안 대표는 “(코로나) 4차 대규모 확산 초기에 와있다”며 “그리고 4차 대규모 확산은 변이 바이러스에 의한 부분들이 굉장히 많을 것 같은데, 문제는 남아공 변의 바이러스의 경우 아스트라제네카를 맞아도 효능이 10%밖에 되지 않아서, 만약 남아공 변이 바이러스나 다른 새로운 변이 바이러스가 퍼진다면 우리가 지금 맡고 있는 백신이 아무런 소용이 없게 될 수가 있다”고 했다.
이어 “과연 이 문제에 대해서도 우리가 지금 어떤 조치들이 필요한 것인지, 이제는 정부에서 우리 의사들을 포함해서 전문가들은 이미 알고 있는 사실들을 받아들여야 한다고 생각한다”고 했다.",조선일보
