,Unnamed: 0,date,title,press,reporter,content
278,278,2021.04.20 15:24,"정의용 ""미국과 '백신 스와프' 진지하게 협의 중""",경향신문,김유진 기자 yjkim@kyunghyang.com,"정의용 외교부 장관은 20일 미국으로부터 백신을 확보하기 위해 ‘백신 스와프’ 방안에 대해 협의 중이라고 밝혔다.정 장관은 이날 국회 외교통일위원회 긴급현안질의에서 박진 국민의힘 의원이 한·미 파트너십에 기반한 백신 스와프를 검토한 적이 있냐고 묻자 “(검토한 적이) 있을 뿐만 아니라 미국 측과 협의도 했다”며 “지금 미국 측과 상당히 진지하게 협의하고 있다”고 답했다. 이어“ 한·미 간의 백신 협력은 다양한 단계에서 중층적으로 이루어지고 있다”고 말했다. 그는 지난 17~18일 방한한 존 케리 미국 대통령 기후특사와도 백신 문제를 집중 논의했다고 덧붙였다.‘백신 스와프’는 금융위기 등 비상 상황에서 긴급한 외화 조달을 위해 체결하는 ‘통화 스와프’를 본딴 개념으로, 백신 공급이 충분한 나라와 계약을 맺어 백신을 확보한다는 취지의 구상이다. 정부가 공식적으로 백신 스와프 추진 계획을 인정한 것은 처음이다. 앞서 질병관리청은 지난해 12월 국민의힘이 미국, 영국 등 백신 공급이 충분한 나라들로부터 백신을 차용하는 ‘백신 스와프’ 체결을 주장한 데 대해 “정부 차원의 계획은 없다”고 밝힌 바 있다.정 장관은 박 의원이 ‘한국이 쿼드에 참여하지 않고 미국과 백신 협력이 가능한가’라는 취지로 묻자 “백신 분야 협력이 동맹 관계에서 우선적으로 고려돼야 한다”면서도 “미중 갈등이나 쿼드 참여와 (백신은) 직접 연관이 없다고 본다”고 말했다. 정 장관은 그러면서 “미국이나 유럽연합(EU)도 ”백신 문제는 정치·외교적 사안과는 디커플링(decoupling·탈동조화) 하는 것을 원칙으로 하고 있다”고 말했다.정 장관은 백신 물량 확보를 위한 특사 파견을 검토하느냐는 이상민 더불어민주당 의원의 질의에는 “특사 파견 문제는 실질적으로 성과가 있었야 하기 때문에 내부적으로 검토를 하고 있다”고 말했다."
329,329,2021.04.18 10:43,'백신 급하지 않다' 발언… 기모란 방역기획관 임명 논란,경향신문,박용하 기자 yong14h@kyunghyang.com,"지난 16일 개각에서 청와대 방역기획관에 임명된 기모란 국립암센터 교수를 두고 ‘보은인사’라는 야당의 비판이 이어지고 있다. 기 기획관의 남편이 더불어민주당 후보로 지난 총선에 출마한 바 있고, 본인 역시 ‘코로나19 백신 도입을 서두를 필요가 없다’고 하는 등 정부 방침을 옹호하는 발언을 해온 ‘친여 인사’라는 주장이다.배준영 국민의힘 대변인은 18일 논평에서 “정부의 올 11월 집단면역은 요원하고 무려 6년이나 걸릴 것이라는 전망까지 나온다”라며 “이 와중에 청와대는 중국인 입국금지를 반대하고, 백신을 조속 접종할 필요가 없다는 등 정치방역 여론을 주도한 기 교수를 방역기획관에 기용했다”고 비판했다.국민의힘은 기 기획관의 남편이 지난 총선에서 민주당 후보로 경남 양산갑에 출마했다 떨어진 전력을 거론하며, 사실상의 ‘보은인사’라 주장하고 있다. 기 기획관이 그간 보인 입장들도 정부를 옹호하는 것이 많았다는 지적이다. 기 기획관은 백신 구입과 관련해서는 지난해 한 라디오 방송에서 “그렇게 급하지 않다”는 취지의 발언을 내놔 논란을 일으킨 바 있다.배 대변인은 “왜 방역을 교란했던 인사를 오히려 방역의 핵심에 세우나”라며 “정은경 질병청장 힘빼고, 대놓고 ‘정치방역’하겠다는 선언인지 의료계의 우려가 크다”고 지적했다.같은 당 윤희숙 의원도 사회관계망서비스(SNS)에서 기 기획관 임명을 비난했다. 윤 의원은 “이 분은 백신 확보가 중요하지 않다는 발언을 여러번 함으로써 백신확보 전쟁이 한창일 때 국민을 혹세무민했고, 바로 그 백신 문제 때문에 전문가들로부터 ‘자기 분야 학문을 배신하면서까지 정권을 대변한다’는 비판을 받았다”라며 “(청와대가) 국민들의 울화를 가라앉히고 신뢰를 회복하는 것보다 그간 정권에 봉사하며 욕먹었던 분들에 대한 보은이 더 중요하다 판단했다고밖에는 안 보인다”라고 지적했다."
330,330,2021.04.18 10:21,"'백신사태·LH' 두고 떠난 정세균·변창흠…야당 ""전례없는 무책임""",경향신문,박용하 기자 yong14h@kyunghyang.com,"오는 19일 시작되는 국회 대정부질문이 정세균 전 국무총리와 변창흠 전 국토부장관의 불참으로 인해 ‘반쪽짜리’로 전락하게 되면서 야당의 거센 비판이 이어지고 있다.황규환 국민의힘 상근부대변인은 이날 논평에서 “후임자가 인사청문회를 통과해 임명될 때까지 맡은 바 소임을 다하는 것이 공직자의 당연한 도리임에도, 지난 16일 정 전 총리와 변 전 장관이 속전속결로 비공개 퇴임식까지 해버렸다”며 “국민에 대한 전례 없는 무책임이요, 입법부 무시”라고 비판했다.앞서 백신 수급 등 방역 현안을 주도해 온 정 전 총리는 개각이 발표된 지난 16일 즉각 퇴임했으며, LH(한국토지주택공사) 사태의 책임론이 거론된 변 전 장관도 같은 날 이임식을 가졌다. 이에 신임 총리와 장관들이 들어서기까지는 행정공백이 예상되는 상황이다.황 부대변인은 “아무리 대행체제로 유지한다지만 행정공백은 불 보듯 뻔하고 그 피해는 오롯이 국민들의 몫”이라며 “당장 내일부터 시작되는 대정부질문 직전 사표 수리로 인해 국회가 제출한 출석요구서를 무력화 시켰으니, 대정부질문에 대한 사실상의 방해 행위”라고 지적했다.청와대를 향해서도 화살을 돌렸다. 황 부대변인은 “대통령은 두 사람을 질타하지는 못할망정 오히려 사표를 수리해주고 덕담을 건네니 이 또한 국민은 안중에도 없는 무책임”이라며 “자신의 직에 대한 최소한의 책임조차 다하지 않고 국회를 무시한 문 정권의 성마른 인사 조치는 최악의 선례로 남을 것”이라고 강조했다.국민의힘은 청와대의 개각이 있던 지난 16일에도 정 전 총리 등의 행태를 비판한 바 있다. 최형두 원내대변인은 “백신 공급, 부동산 대책 등 총리가 답해야 할 국정 현안이 산적해 있는데, (정 전 총리는) 대권행보를 한다며 총리로서의 대정부질문 답변 임무부터 걷어차 버렸다”라며 “바쁜 대권 발걸음에는 헌법의 준엄한 명령도 걸림돌이란 말인가”라고 반문했다."
596,596,2021.04.05 16:02,문 대통령 “생산국 수출 제한으로 백신 수급 불안 확대…어떤 경우에도 차질없도록 할 것”,경향신문,이주영 기자 young78@kyunghyang.com,"문재인 대통령은 5일 코로나19 예방 백신 수급 문제와 관련, “생산국들이 수출 제한을 강화해 수급의 불안정성이 확대되고 있다”며 “상반기 1200만명 접종, 11월 집단 면역의 목표를 달성하는 데 총력을 다할 것”이라고 말했다.문 대통령은 이날 청와대 수석·보좌관회의에서 “어떤 경우에도 수급에 차질이 없도록 범정부적으로 역량을 모아 전방위적 노력을 기울일 것”이라며 이같이 밝혔다.앞서 방역당국은 각국이 백신 수출 제한을 강화하면서 백신 수급 상황이 불안정해지고 국내 확진자 증가세가 다시 높아지자 접종간격을 늘려 1차 접종자를 최대한 확대하기로 하는 등 백신 2분기 시행계획을 보완한 바 있다.문 대통령은 “이미 확보된 물량은 최대한 효율적으로 활용해 계획보다 빠른 속도로 접종할 것”이라며 “1차 접종만으로 예방효과가 큰 것으로 확인됐다. 1차 접종자 수를 최대한 확대할 것”이라고 설명했다. 또 “계약된 물량의 조기 도입과 추가물량 확보에 노력하겠다. 국민도 안전성을 믿고 접종에 적극 참여해달라”고 당부했다.문 대통령은 “유럽이 봉쇄조치를 다시 취하고 있고 우리나라도 연일 500명대의 확진자 발생이 계속돼 걱정이 크다. 경각심을 크게 높여야 할 상황”이라면서 “정부는 방역 방해 행위와 방역수칙 위반에 대해 무관용의 원칙을 엄격히 적용하지 않을 수 없다. 코로나 이전으로 얼마나 빨리 돌아갈 수 있을지는 방역과 백신 접종에 달려있다”고 강조했다.이틀 앞으로 다가온 4·6 재보궐선거에 대해선 “빠짐없이 투표에 참여하면서도 선거 방역을 위해 당국과 선관위의 방역조치에 철저히 따라달라”고 말했다.경제 상황과 관련, 문 대통령은 “각종 지표가 확실한 회복의 길로 들어서고 있음을 보여주고 있다”며 “지표가 좋아졌다고 국민의 삶이 당장 나아지는 것은 아니지만 반등의 흐름이 만들어져 매우 다행”이라고 평가했다.그러면서 “정부의 비상한 정책적 대응과 함께 국민과 기업들이 합심한 결과”라며 “지표로 나타나는 경제 회복의 흐름을 국민들께서 실제 생활 속에서 체감할 수 있도록 최선을 다하겠다. 일자리 회복에 최우선을 두고 포용적 회복에 역량을 집중할 것”이라고 강조했다. 특히 “기업과 소통·협력을 강화할 것”이라며 “각 부처는 기업활동 지원과 규제 혁신에 속도를 내달라”고 주문했다."
681,681,2021.04.01 09:45,정세균 총리 “백신여권 도입 필요…이달 중 ‘인증앱’ 개통”,경향신문,박은경 기자 yama@kyunghyang.com,"정세균 국무총리는 1일 코로나19 백신 접종 기록을 담은 ‘백신여권’ 도입 필요성을 강조하면서 이번 달에 ‘인증 애플리케이션’을 공식 개통한다고 밝혔다.정 총리는 이날 정부서울청사에서 주재한 중앙재난안전대책본부 회의에서 “백신 접종 이후, 많은 사람들이 일상 회복을 체감하려면 소위 ‘백신여권’ 또는 ‘그린카드’의 도입이 필요하다”면서 “정부는 올해 초부터 준비를 시작해, 스마트폰에서 손쉽게 예방접종 사실을 증명할 수 있는 시스템 개발을 이미 완료했다”고 밝혔다.이어 “다른 국가에서도 접종 여부 확인이 가능하도록 하되 개인정보는 일절 보관되지 않도록 했다. 블록체인 기술을 활용해 위변조 가능성을 원천 차단했다”며 “이달 안에 인증 애플리케이션을 공식 개통할 것”이라고 설명했다.정 총리는 방역당국과 관계부처를 향해 “국제적인 백신 여권 도입 논의에도 적극 참여해 국민들이 보다 편리하게 국내·외를 오갈 수 있도록 미리 대비하라”고 지시했다.또 정 총리는 이날부터 75세 이상에 대한 화이자 백신 접종이 시작되는 것과 관련해 “이번 접종을 연로한 부모님께 드리는 ‘백신효도’라고 생각해달라”며 참여를 당부했다."
851,851,2021.03.24 19:20,"문 대통령 “백신, 제가 맞아보니 안심해도 돼…안전성 논란 끝내달라”",경향신문,이주영 기자 young78@kyunghyang.com,"문재인 대통령은 24일 코로나19 백신을 접종한 것과 관련해 “제가 맞아보니 안심해도 된다”고 말했다.지난 23일 오전 아스트라제네카(AZ) 백신을 접종한 문 대통령은 이날 오후 소셜네트워크(SNS)에 남긴 글에서 “주의를 기울여야 하는 시간이 더 남아있긴 하지만, 만 하루 7시간이 지난 지금까지 별 탈이 없다”며 이같이 밝혔다.문 대통령은 “어제 밤늦게 미열이 있었다”면서도 “머리가 아프거나 불편한 정도는 아니었지만, 대비 차원에서 해열 진통제를 먹고 잤더니 아침에는 개운해졌다”고 전했다.이어 “평소 고혈압인데, 혈압에도 아무 영향이 없는 듯하다”며 “아내는 독감 접종에도 부작용을 좀 겪는 편인데, 이번에는 저처럼 밤에 미열이 있는 정도였고 오히려 독감 접종보다 더 가벼웠다고 한다”고 덧붙였다.문 대통령은 “함께 접종받은 11명 모두 아무 이상이 없거나 미열, 뻐근함 정도가 있었다는 것이 전부”라며 “사람에 따라 증상이 심한 분들도 있지만 면역이 형성되는 과정이라고 하니 너무 걱정하지 않아도 될 것”이라고 했다.그러면서 “백신의 안전성은 전 세계가 공인하고 있다. 아무에게도 도움이 되지 않는 안전성 논란을 이제 끝내달라”며 “더 많은 사람이 백신을 접종받도록 적극적으로 협조해달라”고 당부했다."
870,870,2021.03.23 21:11,"문 대통령, 보건소서 AZ 백신 맞아…“접종 속도 높여야”",경향신문,이주영 기자 young78@kyunghyang.com,"6월 G7 회의 출국 앞두고 수행원들과…접종 후 업무 복귀문재인 대통령과 부인 김정숙 여사가 23일 서울 종로구보건소에서 아스트라제네카(AZ)의 코로나19 백신을 접종받았다. 이날은 만 65세 이상을 대상으로 아스트라제네카 백신 접종이 실시된 첫 날로, 문 대통령은 만 68세, 김 여사는 만 66세다.문 대통령의 백신 접종은 오는 6월11~13일 영국에서 열리는 주요 7개국(G7) 정상회의 참석을 위해 이뤄졌다. 질병관리청은 공무 출장 등 필수목적 출국 시 백신을 우선 맞을 수 있도록 하고 있다.아스트라제네카 백신의 안전성을 둘러싼 논란을 조기에 불식시키려는 목적도 있어 보인다.문 대통령은 백신 접종을 마친 뒤 “전혀 문제가 없다”며 “간호사가 주사를 잘 놓아서 전혀 아프지 않았다”고 말했다. 이어 “지금까지 백신 접종이 차질 없이 진행되고 있으나 일상으로의 복귀를 앞당기기 위해 접종 속도를 더 높일 필요가 있다”고 말했다. 강민석 청와대 대변인은 브리핑에서 “문 대통령은 백신 접종 뒤 매뉴얼에 따라 30분 대기 후 청와대로 복귀해 참모 회의를 주재하는 등 평소대로 업무를 수행했다”며 “대통령은 편안하시다”고 전했다.서훈 국가안보실장과 유연상 대통령 경호처장, 김형진 안보실 2차장, 탁현민 의전비서관, 신지연 제1부속·최상영 제2부속비서관, 강 대변인, 제1부속실 행정관 및 경호처 직원 등 G7 정상회의에 함께하는 필수 수행원 9명도 이날 함께 백신을 맞았다. 대통령 건강을 전담하는 의료기관은 국군서울지구병원이지만, 다른 대표단 구성원과 함께 예방접종을 받겠다는 문 대통령의 뜻에 따라 G7 출국 대표단 예방접종기관으로 지정된 종로구보건소에서 접종이 이뤄졌다.문 대통령 내외를 포함해 11명이 함께 백신을 맞은 것은 접종 현장에서 폐기량 발생을 최소화하기 위해 잔량도 활용하라는 지침에 따라 종로구보건소에서 1바이알(병)당 11도즈(회) 접종이 가능한 것으로 확인됐기 때문이라고 청와대는 밝혔다. 문 대통령은 5월 중순쯤 2차 접종을 할 예정이다."
886,886,2021.03.23 09:57,"문 대통령 부부, 종로구보건소에서 AZ백신 접종",경향신문,이주영 기자 young78@kyunghyang.com,"문재인 대통령과 부인 김정숙 여사가 23일 오전 서울 종로구 보건소에서 아스트라제네카(AZ) 백신을 접종했다.이날은 만 65세 이상을 대상으로 아스트라제네카 백신 접종이 이뤄지는 첫 날이다. 문 대통령은 만 68세, 김 여사는 만 66세다.문 대통령의 백신 접종은 오는 6월 11∼13일 영국에서 열리는 G7(주요 7개국) 정상회의 참석을 위한 것으로, 지난 17일되고 시행되고 있는 ‘필수목적 출국을 위한 예방접종 절차’에 따라 이뤄졌다. 질병관리청은 공무 출장 등 필수목적 출국 시 백신을 우선 접종할 수 있도록 하고 있다.문 대통령은 먼저 백신 접종을 마친 뒤 “전혀 문제가 없는데”라고 했고, 김 여사가 주사맞는 모습을 지켜보며 “주사 놓는 솜씨가 아주 좋다. 똑같이 맞네”라고 말하기도 했다.서훈 국가안보실장과 유연상 대통령 경호처장, 김형진 안보실 2차장, 탁현민 의전비서관, 신지연 제1부속·최상영 제2부속비서관, 강민석 대변인, 제1부속실 행정관 및 경호처 직원 등 G7 정상회의에 함께하는 필수 수행원 9명도 이날 함께 접종했다.대통령 전담병원은 국군서울지구병원이지만 문 대통령 부부는 다른 대표단 구성원들과 함께 접종을 희망해, 질병관리청이 G7 출국 대표단 예방접종 실시기관으로 지정한 종로구 보건소에서 접종을 받게 됐다.문 대통령 부부를 포함해 11명이 함께 접종을 받은 것은, 접종 현장에서 폐기량 발생을 최소화하기 위해 잔량도 활용하라는 지침에 따라 종로구 보건소에서 1바이알(병)당 11도즈(회) 접종이 가능하다고 확인됐기 때문이라고 청와대는 설명했다."
901,901,2021.03.22 15:04,문 대통령 “내일 AZ백신 맞는다…안전성 조금도 의심 말아달라”,경향신문,이주영 기자 young78@kyunghyang.com,"문재인 대통령은 22일 “저와 제 아내는 오는 6월 G7(주요 7개국) 정상회의 참석을 위해 내일 아스트라제네카(AZ) 백신을 맞는다”며 “국민들께도 백신의 안전성에 조금도 의심을 품지 마시고 접종 순서가 되는대로 접종에 응해주시기 바란다”고 밝혔다.문 대통령은 이날 청와대 수석·보좌관회의에서 “아스트라제네카 백신의 안전성과 효과가 국제적으로 재확인됐다. 대다수 유럽 국가도 접종을 재개했고, 질병관리청도 65세 이상까지 접종 대상을 확대했다”며 이같이 말했다.올해 만 68세인 문 대통령과 만 66세인 김정숙 여사는 ‘65세 이상 아스트라제네카 백신 접종’ 첫 날인 23일 백신 접종을 한다. 문 대통령 내외와 함께 서훈 국가안보실장, 유연상 경호처장, 김형진 안보실 2차장 등 G7 정상회의에 함께하는 수행원 9명도 접종할 예정이다. 문 대통령은 백신 접종 후 바로 청와대로 복귀해 업무를 수행할 예정이라고 청와대는 밝혔다.이는 아스트라제네카 백신의 안전성과 효과를 둘러싼 논란을 불식시키기 위한 것이기도 하다.문 대통령은 “백신 접종은 자신의 안전을 지키며 집단면역으로 우리 사회 전체의 안전을 지키는 길”이라면서, “백신 불안감을 부추기는 가짜뉴스는 아예 발붙이지 못하도록 국민께서 특별한 경계심을 가져달라”고 강조했다.이어 “백신 접종은 지금까지 계획대로 순조롭게 진행되고 있다”며 “철저한 사전 준비와 체계적인 접종시스템이 가동되며 다른 나라들에 비해 초기 접종 속도가 빠른 편”이라고 설명했다.문 대통령은 “백신 수급도 원활히 진행돼 2분기에는 접종 대상을 대폭 늘려 상반기 중 1200만명 이상을 접종할 계획”이라며 “정부는 백신 접종과 집단면역 속도를 당초 계획보다 높일 것”이라고 했다."
937,937,2021.03.19 11:37,정세균 “AZ 백신 안전성 충분히 검토·평가”,경향신문,윤승민 기자 mean@kyunghyang.com,"정세균 국무총리는 19일 코로나19 백신인 아스트라제네카(AZ) 백신에 대한 안전성 논란을 두고 “질병관리청과 식품의약품안전처는 안전성에 대해 충분히 검토하고 평가해주길 바란다”고 밝혔다.정 총리는 이날 이런 내용의 긴급지시를 질병관리청과 식약처에 전달했다. 정 총리는 “정부는 세계보건기구(WHO), 유럽의약품청(EMA)의 검증결과와 현재까지 확인된 이상반응 사례를 살펴보면 지금 국내에서 진행중인 아스트라제네카 백신 접종을 중단할 이유가 없다고 판단한다”면서도 “다만 계속해서 해당 백신 접종을 확대하는 상황을 고려할 때, 국민들이 백신의 안전성에 조금이라도 의문을 갖거나 불안감을 느껴서는 안된다”고 밝혔다.정 총리는 “질병관리청은 예방접종전문위원회를 신속히 소집해서 최근 WHO·EMA 등 평가자료와 국내 이상반응 사례를 전문가들과 충분히 검토해 명확하게 입장을 정리해주길 바란다”며 “의약품의 안전성에 대한 감독기능을 담당하는 식품의약품안전처는 아스트라제네카 백신의 혈전 유발 가능성에 대해 전문적이고 과학적인 평가를 수행하고 그 결과를 투명하게 공개해주길 바란다”고도 밝혔다.지난 18일 국내에서 20대 남성이 아스트라제네카 백신 접종 후 혈전증에 걸렸다는 신고사례가 접수되면서, 아스트라제네카 백신이 혈전증을 유발할 수 있다는 안전성 논란이 제기된 바 있다. WHO와 EMA는 이에 대해 “아스트라제네카와 혈전증 사이에 연관성이 없다”는 결론을 내렸고, 방역당국은 이를 바탕으로 아스트라제네카 백신 접종을 진행한다는 입장을 밝혔다."
