,date,title,reporter,content,press
7,2021.04.22,與 “野·언론이 백신 가짜뉴스 유포”… 진짜 진원지 추적해보니,안준용 기자,"윤호중 더불어민주당 비상대책위원장은 21일 코로나 백신 부족 사태와 관련, “가짜 뉴스가 국민 불안을 부추기고 있다”고 했다. 여권에선 “야당과 언론이 백신 가짜 뉴스를 퍼뜨린다”고 주장하지만, 실제 백신과 관련해 근거 없는 주장이나 낙관론을 거듭해온 정부·청와대가 진원 아니냐는 지적이 나온다.
박능후 전 보건복지부 장관은 작년 11월 화이자·모더나 백신 도입 지연과 관련, “두 회사에서 오히려 우리에게 빨리 계약하자고 재촉하는 상황”이라며 “백신 확보에서 불리하지 않은 여건”이라고 했었다. 이에 김어준씨의 ‘딴지일보’에선 화이자·모더나가 우리 정부 바짓가랑이를 붙잡고 사정하는 만평까지 등장해 인기를 끌었다. 그러나 5개월 만인 지난 20일 홍익표 민주당 정책위의장은 “화이자 등 다국적 제약사들의 요구가 매우 무리했고, 지금도 그렇다”면서 정반대 얘기를 했다. 정부는 작년 9월 “백신 안전성·유효성이 완전히 확보되지 않았기 때문에 서둘러 선구매 계약을 하면 우를 범할 수 있다”고 했지만, 11월엔 “선입금을 포기하는 한이 있더라도 충분하고 되도록 많은 양을 확보·구매하겠다”고 했다.
문재인 대통령도 그동안 방역·백신 낙관론을 펴왔다. 작년 12월 9일 “정부가 확보한 백신 4400만명분은 우리 국민 집단면역에 충분한 양”이라며 “드디어 긴 터널의 끝이 보인다”고 했다. 올해 신년 기자회견에선 “백신은 충분히 빨리 도입되고 있고, 충분한 물량이 확보됐다”면서 “접종 시기, 집단면역 형성 시기 면에서 다른 나라들보다 결코 늦지 않고 오히려 더 빠를 것”이라고 했다. 그러나 문 대통령은 작년 12월 청와대 내부회의 등에선 “그간 백신 확보에 적극적으로 나서라는 지시를 몇 번이나 했는데, 여태 진척이 없다가 이런 상황까지 만들었느냐”는 취지로 참모들을 질책한 것으로 알려졌다. 기모란 청와대 방역기획관은 청와대 입성 전인 작년 말 ‘김어준의 뉴스공장’에서 백신과 관련, “한국은 지금 그렇게 급하지 않다”거나 “아스트라제네카가 있다면 화이자·모더나 쓸 나라는 없을 것” 등의 발언을 했다. 김어준씨도 “화이자의 마케팅에 우리가 넘어갈 이유는 없다”고 했다.",조선일보
8,2021.04.05,"이낙연 “백신, 우리가 세계의 모델 될 것...불안 퍼뜨리는 언론 개탄”",김은경 기자,"이낙연 더불어민주당 공동상임선대위원장이 5일 “백신 불안을 퍼뜨리고 증폭시키는 일부 언론이 몹시 개탄스럽다”고 했다.
이 위원장은 이날 서울 성동구청에 있는 코로나 백신 예방접종센터를 방문한 뒤 페이스북을 통해 이같이 밝혔다.
그는 “(센터에서) 접종 받으신 1500여분 가운데 불편을 호소한 분은 한 분도 계시지 않았다”며 “접종 후 대기하시던 할머니는 ‘행복해요’라고 말씀하셨다”고 했다. 이어 “어르신 여러분은 안심하고 접종받으시기 바란다”고 했다.
이 위원장은 “접종 코스는 완벽하다”며 “접종센터를 방문, 순서에 따라 몇 가지 절차를 거쳐 접종받고 접종 후 이상이 있는지 확인하기 위해 30분간 대기한 뒤 귀가(하는) 모든 과정이 빈틈없고 편리하게 준비됐다”고 했다.
이 위원장은 현장 방문에서는 “시간 낭비나 혼선 없이 잘 이뤄지는 것 같다”며 “접종 방식, 절차에 이르기까지 한국의 대응이 세계의 모델이 될 것 같은 생각이 든다”고 말했다. 그러면서 “저는 언제쯤이나 순서가 돌아옵니까”라고 했다.
지난 1일부터 전국 49개 지역 예방접종센터에서는 75세 이상 고령자와 노인 시설 입소자 및 종사자를 대상으로 화이자 백신 접종을 실시하고 있다. 질병관리청 예방접종대응추진단은 “우선순위는 코로나 고위험군과 방역체계·사회필수체계 유지를 위한 대상군 등으로, 정해진 원칙에 따라 접종을 하고 있다”며 “예방접종률 향상, 국민 불안감 해소와 신뢰도 제고 등을 위해 필요한 경우 대상을 정해 시행하고 그 결과를 예방접종전문위원회에 보고한다”고 밝혔다.",조선일보
30,2021.04.23,[강인선·배성규의 모닝라이브] 美에 구걸하고 러 백신까지 손대는 한심한 ‘방역 일등국’,강인선 부국장,"조선일보의 데일리 팟캐스트 ‘강인선·배성규의 모닝라이브’는 23일 미국에 ‘백신 스와프’를 간청하고 러시아 백신 도입까지 검토해야 하는 한심한 K방역의 실태, ‘방역 일등국’을 자랑하다 졸지에 ‘백신 거지국’으로 전락한 대한민국 상황에 대해 얘기나눴습니다.
정의용 외교부 장관은 미국과 백신 스와프에 대해 진지하게 논의하고 있다고 했지만, 복지부는 물론이고 외교부 내에서도 “구체적인 논의나 성과는 없다”고 했습니다. 넉달 전 야당이 백신 스와프를 주장할 땐 어렵다며 손 놓고 있다가 뒤늦게 면피성 발언을 한 것 아니냐는 지적이 나옵니다. 비록 바이든 미국 대통령이 주변국과 백신을 나눌 용의가 있다고는 했지만 한국은 한참 순위가 밀릴 것이란 전망입니다. 백신을 나누더라도 화이자나 모더나 등 국민들이 선호하는 백신이 아니라 사용승인이 안 난 노바벡스나 혈전 부작용 논란이 있는 아스트라제네카, 얀센 백신일 가능성이 큽니다.
문재인 대통령은 최근 러시아의 ‘스푸트니크 V’ 백신의 안전성을 검토하라는 지시를 내렸고, 정부도 뒤늦게 러시아 백신 도입을 검토하고 있습니다. 하지만 러시아 백신의 안전성에 대해선 구체적 임상 자료나 검증된 통계가 없다고 합니다. 미국은 물론이고 유럽에서도 ‘스푸트니크 V’에 대한 사용승인을 할 가능성이 적습니다. 우리 정부가 효능이나 안전성 근거없이 러시아 백신을 도입할 수 있겠느냐는 평가가 많습니다.
결국 문재인 대통령이 오는 5월 한미 정상회담에서 바이든 대통령과 백신 도입 문제를 담판지어야 한다는 목소리가 커지고 있습니다. 하지만 쿼드나 인도태평양 구상, 첨단 기술·공급 네트워크 등에 대한 미국의 요구를 계속 외면해 왔던 우리 정부에 대해 바이든 대통령이 얼마나 성의를 보일 지는 미지수입니다.
🎧 유튜브와 팟빵, 애플팟캐스트에서도 들으실 수 있습니다.",조선일보
33,2021.04.18,"김웅, 고민정 현수막 올리고 “4400만명 백신 어딨나요”",남지현 기자,"국민의힘이 18일 코로나 백신 수급 불안과 관련해 “물량 확보는 용두사미 쇼”라고 했다.
배준영 대변인은 이날 논평에서 “문재인 대통령은 지난해 모더나 최고경영자(CEO)와의 화상 통화로 국민을 안심시켰다. 그것이 쇼였나 의심하는 사람마저 생겼다”고 했다.
문 대통령은 지난해 12월 말 스테판 반셀 모더나 CEO와 통화했고, 이후 모더나 공급 시기를 2분기로 앞당겼다. 그러나 4000만명 분으로 늘려 계약한 모더나 백신의 초도 물량이 정확히 어느 정도인지, 도착 시점은 언제인지 정해진 게 없다는 것이다.
배 대변인은 “백신 접종률은 3%가 안 돼 경제협력개발기구(OECD) 최하위 수준”이라며 “정부는 도대체 뭘 하고 있느냐”고 말했다.
같은 당 박대출 의원은 소셜미디어(SNS)에서 “화상 통화 쇼를 벌이더니 감감무소식이다. 용두사미 쇼”라며 “‘백신 거지' 된 것도 분한데, 희망고문까지 한다”고 했다.
김웅 의원은 페이스북에 더불어민주당 고민정 의원이 과거 자신의 지역구인 서울 광진을에 ‘코로나19 백신 4400만명 접종 물량 확보!’라고 내건 현수막을 공유하며 “이 물량은 어디에 있습니까? 민주당이 또 민주당 한 것입니까”라고 적었다.
조 바이든 미국 대통령과 접촉해 물량을 확보해야 한다는 주장도 제기됐다.
박대출 의원은 “문 대통령은 그 잘하던 화상 통화를 왜 바이든 대통령과는 안 하느냐”며 한미 정상 간 핫라인을 가동해 남은 백신을 나눠달라고 요청하고, 특사 파견도 검토하라고 했다.
김근식 전 비전전략실장은 “대통령이 직접 바이든을 만나 외교 담판을 통해 백신을 구해야 한다”며 “상상할 수 있는 창의적 수단까지 총동원하라”고 말했다.",조선일보
115,2021.04.12,"文 “백신수급 불확실성, 현저히 낮추고 있다고 자신”",김은중 기자,"문재인 대통령이 12일 “대다수 나라들이 백신 수급에 어려움을 겪고 있지만 우리나라는 다방면의 노력과 대비책으로 백신수급의 불확실성을 현저하게 낮추고 있다고 자신있게 말씀드린다”라고 했다.
문 대통령은 이날 오후 청와대에서 코로나19 대응 특별방역점검회의를 주재했다. 이날 회의는 백신도입과 함께 접종상황을 집중 점검하고 범정부적인 대응 수준을 높이기 위해 마련됐다. 한국의 백신도입과 접종이 여타 선진국에 비해 더디다는 일각의 지적도 의식한 행보로 풀이된다. 홍남기 경제부총리를 비롯해 권덕철 보건복지부 장관, 정은경 질병관리청장 등이 참석했다.
문 대통령은 “우리 국내에 백신 생산 기반을 확보한 것이 백신 수급의 불확실성을 타개하는 데 큰 도움이 되고 있다”고 강조했다. 이어 “이달부터 노바백스 백신의 국내 생산이 시작되고 상반기 백신 생산에 필요한 원부자재도 확보했다”며 “이에 따라 우리 기업이 생산하는 백신을 안정적으로 공급받을 기반이 마련됐다”고 했다. 그러면서 “6월부터 완제품이 출시되고, 3분기까지 2000만회분이 우리 국민을 위해 공급될 예정”이라고 덧붙였다.
문 대통령은 “백신 접종은 신속성과 안정성을 함께 확보해야 한다”라며 “정부는 빈틈없는 방역과 차질없는 백신 접종으로 국민과 함께 힘을 모아 이룩한 K-방역의 성공을 이어나가겠다”고 했다. 혈전 발생 논란으로 접종이 보류·연기됐다가 이날부터 접종이 재개된 아스트라제네카 백신에 대해서도 “안전성에 대한 논란이 일단락됐다”고 했다. 그러면서 “국민의 안전을 최우선에 두고 과학적 사실에 근거한 전문가들의 의견을 존중해 아스트라제네카 접종 방침이 결정됐다”며 “국민께서는 과학적인 판단을 믿고 정부의 방침에 따라 접종에 적극적으로 임해주실 것을 당부드린다”고 했다.
문 대통령은 “우리나라도 한동안 400명대를 유지하던 1일 확진자수가 600명대로 늘어나며 4차 대유행이 현실화되는 건 아닌지 우려가 커지고 있다”며 “코로나 확산세를 막는 것이 당장의 급선무가 됐다”고 했다. “여기서 밀리면 민생, 경제에 부담이 생기더라도 거리두기 단계 상향조치를 취하지 않을 수가 없을 것”이라며 “주변에 광범위하게 퍼져있는 것으로 보이는 숨은 감염자들을 찾아내는 일”이라고 했다.
문 대통령은 “우리가 갖고 있는 하루 50만 건의 검사 역량을 충분히 활용해 지자체들과 함께 검사 대상을 최대한 확대하고 선제 검사를 적극시행해달라”고 했다. 또 국민을 향해선 “과학적인 판단을 믿고 정부 방침에 따라 접종에 적극적으로 임해주실 것을 당부드린다. 집단면역 형성까지는 갈길이 멀다”고 했다.",조선일보
123,2021.04.17,"정부, 美·英등 10개국 공관장에 “백신 신속 도입 노력하라”",안준용 기자,"외교부는 17일 미국·영국·러시아 등 코로나 백신 생산국에 주재하는 공관장들과 화상으로 상황점검회의를 열고 “신속한 백신 도입을 위해 보다 현실적·실질적 역할, 노력을 해달라”고 했다.
전 세계적으로 백신 부족 현상이 가시화되는 가운데 문재인 대통령이 지난 12일 코로나 대응 특별방역점검회의에서 “백신 물량 추가 확보와 신속한 도입에 행정적·외교적 역량을 총동원하라”고 지시한 데 따른 후속 조치다. 최종문 외교부 2차관(범정부백신도입TF 국제협력지원반장) 주재로 16일 열린 이번 회의에선 국내에 필요한 물량의 백신을 신속히 도입하기 위한 방안이 논의됐다.
회의에는 이수혁 주미대사와 박은하 주영대사, 이석배 주러대사 외에도 윤순구 주벨기에대사 겸 EU대사, 정연두 주네덜란드대사, 신봉길 주인도대사, 백지아 주제네바대사, 장경룡 주캐나다대사, 조현옥 주독대사, 강창일 주일대사 등 10개국 공관장이 참석했다. 국내에선 범정부백신도입TF 사무국, 질병관리청, 식약처 관계자들이 참석했다.
외교부는 회의 후 “국내 백신 수급 현황을 공관장들과 공유하고, 필요한 지원 사항을 공관장들에게 직접 설명했다”며 “국내외에서 정부가 백신 수급 지원 노력을 보다 효과적으로 추진하는 계기가 됐다”고 했다.
앞서 지난 15일 서훈 청와대 국가안보실장 주재로 열린 청와대 NSC(국가안전보장회의) 상임위원회 회의에서 참석자들은 “국내외 백신 수급 상황을 점검하고, 백신 추가 확보를 위해 모든 외교적 노력을 강화해나가겠다”고 밝혔다.
이어 16일엔 청와대 관계자가 “코로나 백신 확보에 관해선 정부 전 부처가 총력 대응해서 협력체제를 운영한다는 입장”이라며 “행정적․외교적 역량을 총동원해서 당초 백신 도입 계획이 차질없이 이행되고, 또 추가 백신 물량이 확보될 수 있도록 지원하겠다”고 했다.",조선일보
135,2021.03.22,오늘 아스트라 접종 文대통령 “백신 안전성 의심 품지마시라”,김아진 기자,"문재인 대통령은 22일 아스트라제네카(AZ) 코로나 백신 안전성 문제와 관련해 “백신 불안감을 부추기는 가짜 뉴스는 아예 발붙이지 못하도록 국민들께서 특별한 경계심을 가져 주시기 바란다”고 했다. 문 대통령과 김정숙 여사는 오는 6월 영국에서 열리는 G7(주요 7국) 정상회의 참석을 앞두고 23일 AZ 백신을 공개 접종한다.
문 대통령은 이날 청와대 수석·보좌관 회의에서 “저와 제 아내도 아스트라제네카 백신을 맞는다. 정상회의 수행원들도 내일 함께 접종을 한다”며 “국민들께서도 백신의 안전성에 조금도 의심을 품지 마시고 접종 순서가 되는 대로 접종에 응해달라”고 했다. 문 대통령은 “백신 접종은 자신의 안전을 지키면서 집단면역으로 우리 사회 전체의 안전을 지키는 길”이라면서 “다른 나라들에 비해 초기 접종 속도도 빠른 편으로 상반기 중에 1200만 명 이상 접종할 계획”이라고 했다.
한편 문 대통령은 경제와 부동산에 낙관적 전망을 했다. 문 대통령은 “올해 예상보다 빠르고 강하게 경제 반등에 성공할 것”이라며 “국제기구들도 올해 한국의 경제성장률을 3% 중반대로 상향 전망하는 등 우리나라는 코로나 이전 수준의 경제를 가장 빨리 회복하는 선두 국가 그룹에 서게 될 것”이라고 했다. 그러면서 고용 상황에 대해서도 “이 추세대로라면 3월부터는 작년 수준 또는 그 이상으로 고용이 회복될 수 있을 것으로 기대된다”고 했다. 집값 문제에 대해서도 “최근 주택 가격 상승세가 꺾이며 부동산 시장이 서서히 안정세로 접어들고 있는 만큼 그 추세를 이어가고 있다”고 했다.
LH 직원들의 땅 투기 의혹과 관련해, 문 대통령은 이날도 “정부로서는 매우 면목 없는 일”이라면서도 재차 과거 정부의 적폐 청산을 강조했다. 문 대통령은 “개발과 성장의 그늘에서 자라온 부동산 부패의 고리를 끊어낼 수 있는, 쉽지 않은 기회”라며 “정면으로 부딪쳐 문제를 근원적으로 해결하지 않으면 안 된다”고 했다.",조선일보
166,2021.04.12,"김근식 “대통령님, 철지난 K방역 아닌 K백신 말할 때”",김동하 기자,"김근식 경남대 교수는 12일 문재인 대통령이 ‘백신수급의 불확실성을 현저하게 낮추고 있다’고 한 것에 대해 “백신 현실은 불확실 투성이인데, 대통령만 나홀로 달나라 인식에 유체이탈 화법”이라고 했다.
국민의힘 비전전략실장을 지낸 김 교수는 이날 페이스북에 “대통령님, 철 지난 ‘K 방역’ 우려먹을 때가 아니라 제대로 된 ‘K 백신’을 말하십시오”라며 이같이 밝혔다.
김 교수는 “지난해 부동산 폭등하는데 집값이 확실히 안정되고 있다던 달나라 화법, 시즌 2”라며 “도대체 무슨 근거로 백신수급이 안정적이라고 자랑하나”라고 했다. 이어 “그저 백신 접종을 ‘시작했다’는 표현이 정확한 현실”이라며 “지금까지 대통령이 호언장담한 대로 금년 백신수급이 제대로 진행된 적이 있나”라고 했다.
그는 “언제일지도 모를 백신접종만 부지하세월 기다리다 모두 지쳐간다”며 “더이상 희망고문하지 마십시오”라고 했다.
문 대통령은 이날 오후 청와대에서 코로나19 대응 특별방역점검회의를 주재하며 “대다수 나라들이 백신 수급에 어려움을 겪고 있지만 우리나라는 다방면의 노력과 대비책으로 백신수급의 불확실성을 현저하게 낮추고 있다고 자신 있게 말씀드린다”고 했다. 또 “우리 국내에 백신 생산 기반을 확보한 것이 백신 수급의 불확실성을 타개하는 데 큰 도움이 되고 있다”고 했다.",조선일보
