,date,title,reporter,content,press
812,2021.04.26,"백신 스와프 주장했던 野박진, 이번엔 “이스라엘서 남는 AZ 가져오자”",김승현 기자,"국민의힘 박진 의원이 최근 주한 이스라엘 대사에게 한국 정부와의 ‘백신 스와프’ 가능성을 타진하고 정의용 외교부 장관에게 이스라엘과 교섭에 나서달라고 요청했다고 25일 밝혔다. 현재 이스라엘은 전 세계 백신 접종률 1위 국가로 인구 대비 최소 1회 이상 접종률이 60%에 이른다. 그런 상황에서 백신이 1000만회분이 남아 있는 만큼 한국 정부가 이스라엘과 백신 스와프를 맺어 이를 도입하자는 제안이다.
박 의원은 이날 본지 통화에서 ”최근 주한 이스라엘 대사를 통해 백신 스와프 가능 여부를 물어보니 ‘아스트라제네카(AZ) 백신 1000만회분은 스와프가 가능하다’는 취지의 답을 얻었다”고 말했다. 박 의원은 “외교부에서 아직 현지(이스라엘 주재 한국 대사관) 보고를 받지 못한 것 같다”며 “정의용 장관에게도 이스라엘과의 백신 스와프를 진행해달라는 뜻을 전달했다”고 말했다. 백신 스와프는 다른 나라에서 백신을 우선 지원받고 나중에 한국 제약업체들이 백신을 생산해 되갚는 개념이다.
박 의원이 위원장으로 있는 국민의힘 외교안보특위도 이날 성명을 내고 “정부는 미국·이스라엘과 백신 스와프를 진행하고 국내 생산을 확대하라”고 제안했다. 미국 외에 ‘백신 모범국’으로 꼽히는 이스라엘과도 백신 스와프를 추진해 백신 확보 통로를 넓히라는 것이다. 특위는 “정부는 화이자 백신 2000만명분 추가 도입 계약을 체결했다고 밝혔는데 뒤늦게나마 백신 확보 외교에 팔을 걷어붙이고 나선 것은 다행이지만 국민의 불안감은 줄지 않고 있다”며 이같이 말했다.",조선일보
821,2021.04.27,[이동훈의 촉]백신확보 늑장부리다 이젠 미국 탓..반일 이어 반미 시동?,,"문재인 대통령은 어제 청와대 회의에서 이렇게 말했습니다. “코로나19와 같은 감염병의 세계적 유행은 국제적 연대와 협력이 필요한데도 국제정치의 현실은 그렇지 않다” “여유가 있을 때는 모든 나라가 한목소리로 연대와 협력을 말했지만 자국의 사정이 급해지자 연합도, 국제 공조도 모두 뒷전이 돼 국경 봉쇄와 백신 수출 통제, 사재기 등으로 각자도생에 나서고 있다” 문 대통령은 ‘각자도생’에 나서는 국가가 어디인지는 특정하지 않았습니다. 하지만 문 대통령은 “백신 개발국의 자국 우선주의, 강대국들의 백신 사재기”를 언급했습니다.미국은 코로나 주요 5대 백신 중 아스트라제네카를 제외한 4개 백신, 화이자 모더나 얀센 노바백스의 개발국 입니다.문 대통령이 국제연대는 외면한 채 자기들이 개발한 백신을 독점하고 있다고 비판한 나라는 미국입니다.
문 대통령이 말한 ‘미국의 자국우선주의’, 시청자 여러분은 어떻게 생각하십니까. 여러가지 생각이 듭니다. 우선 5월말 문 대통령은 조 바이든 대통령과의 첫 한미 정상회담을 앞두고 있습니다. 그런데 최근 잇따라 미국을 자극, 비판하는 발언을 합니다. 우려가 많습니다. 문 대통령은 지난주 미 뉴욕 타임스와의 인터뷰에서  바이든 대통령에게 이런 주문을 합니다. “트럼프 정부가 거둔 성과 위에서 미·북 협상을 더욱 진전시켜 나가야 한다” “싱가포르 미·북 합의를 폐기하는 것은 실수가 될 것”이다.
전 세계 어느 정부도 직전 정권의 정책을 그대로 이어가는 것을 달가워하지 않습니다. 더구나 트럼프 전 대통령과 바이든의 관계 아시지 않습니까. 트럼프는 바이든의 선거 승리를 끝까지 인정하지 않았습니다. 바이든은 그런 트럼프의 정책을 계승하라는 한국 대통령을 어떻게 생각할까요. 문 대통령은 뉴욕타임스 인터뷰에서 미·중 협력도 촉구했습니다. 중국 견제, 중국 압박에 국가 총력을 기울이는 바이든 정부의 대외 정책과 엇박자입니다.
문 대통령이 이번에는 백신을 걸어 미국을 비판했습니다. 그런 문 대통령의 중국의 백신정책에 대해선 이렇게 말한 바 있습니다.  “백신 기부와 같은 다양한 코로나 지원 활동을 펼치는 중국 정부의 노력을 높이 평가한다.” 미국은 비판하고 중국은 칭찬했습니다.
잇따른 문 대통령의 미국 비판, 바이든 대통령이 어떻게 받아들일까요. 조선일보 김대중 전 고문은 오늘 칼럼에서 이렇게 말합니다. “외교를 국가 간의 거래로 보는 시각에서 보더라도 미국이 요구하는 인도·태평양 안보 기구인 쿼드 참여는 거절하면서 북한 이익을 대변하는 요구를 나열하는 것은 기브 앤드 테이크에도 어긋난다.”
사실 자국민을 위한 충분한 백신 물량을 먼저 확보하기 위해 미국이 외국 지원에 소극적인 것을 ‘자국 우선주의’라고 비판을 할 수 있을지도 의문입니다. 문 대통령의 미국 비판은 백신 부족 사태에 대한 책임을 외국에 떠넘기려는 의도 아니겠냐, 국내 정치용 아니겠냐는 지적도 나옵니다.
정부는 최근 화이자와 2천만 명분의 코로나 백신 추가 공급 계약을 맺었다고 발표했습니다. 홍남기 총리대행은 9,900만 명분의 백신 물량을 확보했다고 했습니다. 구체적 공급 일정은 제시되지 못했지만 어쨌든 반가운 소식입니다. 그러나 그렇다고 해서 우리 국민 불안이 해소된 것은 아닙니다. 도대체 언제 오느냐는 불신 여전합니다. 그런데 정부는 ‘이제 백신 수급과 관련된 소모적 논쟁을 멈춰야 한다’는 식으로 말합니다. 백신 지연을 비판하면 정쟁이라는 식으로 몰아가려 합니다. 도둑이 매를 드는 적반하장입니다. 국민은 그동안 기다릴 만큼 기다렸습니다. 그런데 예정대로 백신이 안 들어왔습니다. 아스트라제네카 백신은 부작용 우려가 큽니다. 계약은 했다지만 언제 맞을지 모릅니다. 이런 상황에서 국민의 불안과 불신이 잘못된 건가요?
지금 우리나라 현재 상태, 접종률 4%대 세계 100위권 백신 후진국이 분명합니다. 왜 이렇게 된 겁니까. 중앙일보 고현곤 논설주간은 백신과 관련해 세 가지 의문점을 제시합니다. 나중에 백서를 만들든 청문회를 하든 두고두고 의문들을 풀어야 한다고 했습니다.
첫째, 문 대통령 발언이 현실과 동떨어진 이유가 뭐였는지 밝혀져야 한다고 했습니다. 대통령은 줄곧 “충분한 백신을 확보했다”고 자신했습니다. 그런데 지난주엔 러시아 백신을 검토하라고 지시했습니다. “가진 백신의 접종 속도를 못 내는 게 문제”라고도 했습니다. 백신은 있는데, 현장에서 접종이 원활치 않다는 얘기였습니다. 그런가요?  백신을 못 구해 접종을 못한겁니다. 대통령이 상황을 모른건가요. 알면서 일부러 그런건가요? 이 의문을 두고두고 풀어야 한다고 했습니다.
둘째, 지난해 백신을 놓친 과정을 추궁해야 한다고 했습니다. 박능후 전 복지부 장관은 작년 가을 “화이자와 모더나가 빨리 계약하자고 재촉하는 상황”이라고 말했습니다. 백신은 있었는데, 우리가 적극 달려들지 않았다는 얘기가 됩니다. K방역을 과신했고, 백신을 비싸게 샀다가 문제될까 봐 주저했다고 합니다.
셋째, 백신 아닌 치료제에 매달린 점도 미스터리입니다. 치료제는 증상을 완화할 뿐 확산을 막지 못합니다. 애초에 게임 체인저가 될 수 없었습니다. 그런데도 치료제에 지나친 기대를 했고 백신 후진국이 된 한 이유가 됐습니다. 이 의문들, 두고 두고 풀어야 할 것 같습니다.
상반기 ‘백신 보릿고개’ 상황은 여전히 달라지지 않았습니다. 이 모든 상황…정권 책임입니다. 지금 설익은 애드벌룬을 띄워놓고 적당히 덮고 갈 상황은 아닙니다. 강대국들의 자국우선주의니 하며 남탓하고 있을 상황도 아닙니다.
",조선일보
847,2021.04.13,文 “많은 나라가 백신 어려움… 우린 수급 불확실성 현저히 낮춰”,김아진 기자,"문재인 대통령이 12일 “우리나라는 다방면의 노력과 대비책으로 백신 수급의 불확실성을 현저하게 낮추고 있다고 자신 있게 말씀드릴 수 있다”고 말했다.
문 대통령은 이날 청와대에서 특별 방역점검 회의를 열고 “전 세계적 백신 생산 부족과 백신 생산국의 자국 우선주의로 백신 수급의 불확실성이 확대되면서 대다수 나라가 백신 수급에 어려움을 겪고 있다”면서 이같이 말했다. 정부가 초기 물량을 확보하지 못한 데다 아스트라제네카 백신 안전성 논란 등으로 연내 집단면역이 불투명한데도 백신 수급에 자신감을 내비친 것이다. 한국은 지난 2월 26일 백신 접종을 시작한 뒤 현재 접종률 2%대에 머물고 있다. 야권에서는 대통령에게 초기 백신 확보 지연에 대한 사과를 요구하며, 이와 관련한 국정조사를 제안한 상황이다.
하지만 문 대통령은 이날도 K방역 성과를 여러 차례 강조했다. 문 대통령은 “아스트라제네카 백신의 안전성에 대한 논란이 일단락됐다. 백신은 과학이다. K방역에 대한 높은 평가도 과학의 원칙을 철저하게 견지함으로써 얻어진 것”이라고 했다. 최근 전 세계 코로나 확산세를 강조하면서는 “작년 말의 3차 유행 때와는 뚜렷하게 차이가 나는 긍정적 양상으로, 이 역시 K방역의 성과라고 할 수 있다”고 했다.
문 대통령은 “특히 국내에 백신 생산 기반을 확보한 것이 백신 수급의 불확실성을 타개해 나가는 데 큰 도움이 되고 있다”며 “이달부터 노바백스 백신의 국내 생산이 시작되고 상반기 백신 생산에 필요한 원·부자재도 확보했다. 6월부터 완제품이 출시되고, 3분기까지 2000만회분이 우리 국민을 위해 공급될 예정”이라고 했다.
문 대통령은 그러면서도 “자칫 방심하다가는 폭발적 대유행으로 번질 수도 있는 아슬아슬한 국면”이라며 “여기서 밀리면, 민생과 경제에 부담이 생기더라도, 거리 두기 단계 상향 조치를 취하지 않을 수가 없을 것”이라고 했다. 이어 “11월 집단면역이라는 당초 목표 달성은 물론, 달성 시기를 목표보다 앞당기는 데 총력을 기울이고, 변이 바이러스용 개량 백신과 내년도 이후의 백신 확보도 서둘러야 할 것”이라고 했다. 또 “그래도 여전히 남아 있는 불확실성을 해소하고, 나아가 더 빠른 접종을 위해 백신 물량 추가 확보와 신속한 도입에 행정적·외교적 역량을 총동원해주기 바란다”며 “기존에 도입하는 백신 외에 면역 효과와 안전성이 확인되는 다른 종류의 백신 도입도 적극적으로 검토해달라”고 했다.",조선일보
922,2021.04.23,한미정상회담 연기설 솔솔… 협상 테이블에 백신 못 올려놓나,김아진 기자,"한미는 문재인 대통령과 조 바이든 대통령의 첫 정상회담을 5월 하순에 개최한다고 밝혔지만, 아직 구체적 일정과 의제를 공개하지 않고 있다. 워싱턴에서는 한국이 요구하는 백신 확보에 미국이 난색을 표하면서 회담이 연기될 수 있다는 관측도 나오고 있다. 청와대는 회담 연기설에 대해 “금시초문”이라는 입장이다.
문 대통령은 지난 19일 청와대 수석·보좌관 회의에서 “5월에 한미 정상회담이 계획돼 있다”며 “경제 협력과 코로나 대응, 백신 협력 등 양국 간 현안에 긴밀한 공조를 하겠다”고 했다. 기존의 북핵 문제 외에 백신도 회담 의제로 삼겠다는 것이다. 정의용 외교부 장관도 최근 한미 간 백신 스와프를 미국 측과 진지하게 협의 중이라고 밝혔다.
그러나 조 바이든 미국 대통령이 “백신을 다른 나라에 줄 여력이 없다”고 하면서 정부 고심이 깊어졌다. 우리가 백신을 확보하려면 미국의 요구에 부응해야 하는 상황이다. 일각에선 우리가 원하는 백신과 미국이 원하는 반도체 투자를 맞교환하자는 의견도 나오고 있다. 미국은 글로벌 반도체 대란 속에서 이 문제를 경제를 넘어 안보 문제로까지 다루고 있다. 그러나 이 경우 한미 정상회담에 삼성전자 등 우리 기업인들을 대거 동행시켜야 하는데 코로나 때문에 여의치 않은 상황이라고 한다. 여권 관계자는 “이재용 삼성전자 부회장 사면론까지 나오는 상황이지만, 미국이 우리의 정부 수행 인원까지 최소화를 요구해서 CEO까지 데려갈 수가 없다”고 했다.
미국이 반중(反中) 전선의 성격을 띠는 쿼드(4국 안보 협의체) 참여 등을 요구할 경우에도 우리 정부로선 매우 난감하다. 문 대통령은 21일 공개된 미국 뉴욕타임스 인터뷰에서도 “미국이 북한 및 기후변화를 포함한 기타 세계적인 관심 현안에 대해 중국과 협력해야 한다”고 했고, 20일 중국에서 열린 보아오포럼에 나와 중국을 배제하는 미국의 ‘자국 우선주의’를 우회적으로 비판했다. 대만 문제까지 공동성명에 넣으면서 미국과 코드를 맞춘 일본과 대조적이다. 외교가에선 “문 대통령이 미국의 코드를 어떻게든 맞춰서 백신을 가져와야 하는데 첩첩산중”이라는 말이 나오고 있다.",조선일보
937,2021.04.22,"태영호 “한국, 미·중 줄타기하다 백신 요청 땐 친구? 어불성설”",오경묵 기자,"태영호 국민의힘 의원은 최근 한·미간 코로나 백신 스와프(swap)를 거론한 정의용 외교부 장관을 향해 “‘친구는 옛 친구가 좋고 옷은 새 옷이 좋다'라는 말을 명심해야 한다”고 했다. 정 장관은 최근 백신 스와프와 관련해 “작년에 우리가 보여준 연대 정신에 입각해 현재 우리가 겪는 백신의 어려움을 (미국이) 도와주기를 희망한다”고 했었다.
태 의원은 22일 페이스북에서 “정 장관이 ‘어려울 때 친구가 진정한 친구’라며 (백신 문제와 관련해) 미국의 도움을 요청했다”며 “지난해 코로나 유행 초기에 우리가 미국에 진단 키트와 마스크를 직접 공급해준 사례를 거론하며 한미간 백신 스와프 현실성에 대해 이 같은 발언을 한 것”이라고 썼다.
이어 “정 장관의 말은 지당하다. 어려울 때 돕는 친구가 진정한 친구”라면서도 “우리가 미국에 진단 키트 몇 개와 마스크 몇 장을 공급해준 것을 가지고 이런 이야기를 할 수 있는지 의아스럽다”고 했다.
태 의원은 “우리가 진정 어려울 때 미국은 어떠했는가? 그들은 목숨을 내걸었다”며 6·25 전쟁을 언급했다. 6·25 전쟁에서 미군은 3만6000여명이 전사했고, 4000여명이 실종됐다. 태 의원은 “과거의 역사에 대해서는 정 장관도, 미국도 너무 잘 알고 있을 것”이라고 했다.
그는 “국익을 위한다는 명분으로 ‘안보는 미국, 경제는 중국’이라며 둘 사이에서 줄타기 외교를 했지만, 문재인 정권 4년을 거치며 결과적으로 남북·한미·한중·한일 그 어느 하나 잘된 것이 없었다”며 “그런데 ‘어려울 때 돕는 친구가 진정한 친구’라 며 미국에 백신 공급 협조를 바란다는 것은 어불성설”이라고 비판했다. 최대한 요청하고 노력해야 하는 것은 맞지만, 비유가 틀렸다는 것이다.
한편 미국 국무부 네드 프라이스 대변인은 21일 언론 브리핑에서 한국의 ‘백신 스와프' 제안에 대한 질문을 받고 “우리는 현 단계에서 무엇보다 미국 내 백신 접종에 집중하고 있다”며 사실상 부정적인 입장을 밝혔다.",조선일보
940,2021.04.20,"홍남기, 백신 차질 질문에 “잘못된 뉴스” 언성 높여",노석조 기자,"정부와 야당은 19일 국회 대정부 질문에서 코로나 백신 수급 차질 문제를 놓고 공방전을 벌였다. 야당 의원들이 ‘코로나 백신 수급 차질 논란’을 제기하자, 홍남기 국무총리 직무대행 겸 경제부총리는 “잘못된 뉴스”라며 “목표대로 올 11월 집단 면역을 이뤄낼 수 있다”고 반박했다.
홍 부총리는 국민의힘 정진석 의원이 ‘국민은 백신과 관련해 정부를 믿지 못한다’고 하자 “믿어줘야 한다”면서 백신 수급이 계획대로 진행되고 있다고 주장했다. 이에 정 의원은 “믿으라고 강요하지 마라. 희망고문 하지 말라”며 “국민은 세계 10위권의 경제 대국인 한국이 왜 접종률 100위권 밖으로 벗어난 백신 빈곤국·후진국으로 전락했는지 의아해한다”고 했다. 이어 “접종률은 아프리카 르완다나 방글라데시보다도 못하다”며 “현재 접종 속도라면 집단면역을 달성하는 데 6년 4개월이 걸린다는 평가도 있다”고 했다.
그러자 홍 부총리는 “잘못된 뉴스를 강조하면 국민이 불안해한다”면서 “지금까지 정부가 구매 계약을 맺은 것은 1억5200만회분이고 사람으로 치면 7900만명분”이라고 했다. 그러면서 “정부는 상반기 중으로 1200만명에 대해 백신 접종을 할 것이고 올 11월 집단면역이 이뤄지게 할 것”이라고 했다. 그는 답변 도중 “충분히 설명할 기회를 달라”며 언성을 높이기도 했다.
정의당 심상정 의원도 정부의 11월 집단면역 계획에 의구심을 제기했다. 심 의원은 “1200만명 접종하려면 지금 접종 센터뿐 아니라 동네 의원에도 백신이 공급됐어야 한다”면서 “왜 안동에서 생산하는 아스트라제네카도 확보를 못 하나, 이건 정부 무능”이라고 했다. 그러자 홍 부총리는 “정부가 감추거나 포장하려는 것 아니다”면서 “9월 등 더 일찍 하면 좋지만 백신 스케줄상 11월 집단면역이라고 하는 것”이라고 했다. 심 의원은 “자꾸 답답한 소리만 한다”며 “이미 다 백신이 공급돼야 하는데, 자꾸만 헛된 약속만 하니까 불신하는 것”이라고 했다.
홍 부총리는 이날 중앙선거관리위원회의 편향성 문제를 국민의힘 허은아 의원이 제기하자 “그렇게 편향적으로 일하지 않았을 것”이라고 했다. 허 의원이 TBS의 ‘일(1)합시다’ 등 선관위 관련 각종 논란을 지적하고 퇴장한 직후 더불어민주당 소속 김상희 국회부의장은 마이크가 켜진 상태에서 혼잣말로 “신났네, 신났어”라고 말해 논란이 되기도 했다.",조선일보
960,2021.04.24,심각한 ‘백신 가뭄’… 제약사·美 탓하는 여권,배준용 기자,"코로나 백신 수급 차질 등 방역 행정 난맥상이 드러나자, 여권(與圈)에서 백신 제조사와 미국에 책임을 돌리는 발언이 나오고 있다. 정부가 제때 백신을 확보하지 못해 여론이 악화하자 미국과 해외 제약사를 탓한다는 지적이다.
정세균 전 국무총리는 23일 라디오에서 미국의 코로나 백신 수출 금지 가능성을 묻는 질문에 “우리가 미국한테 원조를 받는 것도 아니고, 공짜로 달라는 것도 아니고, 우리가 사오는 것으로 제약회사들과 계약이 다 돼 있다”며 “만약 미국이 금수 조치를 취한다면 그걸 가로채는 거나 마찬가지 아닌가. 이건 깡패들이나 하는 일”이라고 했다.
우리 정부가 이미 백신 판권을 쥔 미국 다국적 기업들과 계약을 맺었기 때문에 미 정부가 이를 중간에서 막을 수 없다는 주장이다. 이는 미국이 백신 수출을 금지한다는 가정에 대한 질문에 답을 한 것이지만, 전직 총리가 백신 협력의 키를 쥔 미국에 ‘깡패’라는 용어를 사용한 것을 두고 외교적으로 문제가 될 수 있다는 지적이 나온다.
여권에선 백신 제조사의 ‘갑질’과 ‘불공정 계약’을 비난하는 주장도 나왔다. 민주당 당 대표 후보인 홍영표 의원은 전날 “(우리 정부가) 백신을 충분히 확보했지만, 미국이나 유럽에서 백신 이기주의가 많이 생기다 보니 제때 공급이 안 되는 것”이라고 했다. 정 전 총리는 “우리 정부가 (해외 제약사에) 선금까지 줬다. 사실 그 계약이 상당히 불평등하고 불공정한 것이었다”며 “그럼에도 불구하고 백신 계약을 제때제때 했다”고 했다. 민주당 홍익표 정책위의장도 지난 20일 “화이자 등 다국적 제약회사들의 요구가 매우 무리하다”며 “공개한다면 ‘그렇게 하면서까지 협상을 해야 했느냐’고 야당과 언론의 공격이 만만치 않았을 것”이라고 했다. 민주당 정책위 관계자는 “해외 제약사들이 협상 때 백신 부작용이나 납기일이 늦어지는 것에 책임지지 않는 조항 등 납득할 수 없는 요구 조건을 내세운 것으로 안다”고 했다.
하지만 방역 당국은 이날 브리핑에서 “전 세계적으로 코로나 백신의 제조사가 한정돼 일반적인 백신 계약과 다르게 제조사에 유리한 조항들이 공통적으로 있는 것으로 안다”고 했다. 백신 제조사들이 한국에만 불공정한 조건을 제시한 건 아니라는 것이다.
현재 정부와 모더나는 오는 5~6월 5만여명분을 공급을 협의 중인 것으로 알려졌다. 모더나 물량 대부분은 하반기에 들어올 예정으로, 5월부터 물량을 공급하기로 한 계약 조항을 위반하지 않으려는 조치로 풀이된다.
전문가와 야당은 정부가 제때 백신 도입을 못 해 놓고 이제 와서 미 정부와 제조사 탓으로 책임을 미룬다고 비판했다. 작년 11월만 해도 박능후 전 보건복지부 장관은 “화이자와 모더나가 먼저 계약하자고 재촉하는 상황”이라고 했다. 마상혁 대한백신학회 부회장은 “백신 계약을 제때 하지 못해 상반기 수급난을 부른 것에 대해 사과도 하지 않고 되레 미국과 제약사에 책임을 떠넘긴 것”이라며 “정 전 총리가 대권을 의식해 무책임한 발언을 했다”고 했다. 국민의힘 관계자는 “정부가 유리한 조건에서 계약할 시기를 놓치고서는 지금 와서 불공정한 계약을 맺었다고 한 것은 스스로 실책을 인정한 것 아니냐”고 했다. 정의당 이동영 수석대변인도 논평에서 “백신 수급의 골든 타임을 놓친 것은 정부의 명백한 실책”이라고 했다.
",조선일보
991,2021.04.21,백신 공급 우려에… 與 윤호중 “가짜뉴스가 불안 부추겨”,주형식 기자,"더불어민주당 윤호중 비상대책위원장은 21일 코로나 백신 국내 수급 불안 상황과 관련해 “최근 백신 수급 관련 가짜뉴스가 불안을 부추기고 있다”고 했다.
윤 위원장은 이날 오전 국회에서 열린 비대위 회의에서 이같이 말하며 “코로나19 확산으로 많은 국민이 힘든 시기인데, 이런 시기일수록 정치권은 책임감 있게 객관적인 자료에 기반해 건전한 비판을 해야 할 것”이라고 했다.
그는 “많은 국민들이 백신 수급 상황에 대해 우려를 표하고 있다”며 “4월20일 현재 약 170만회분, 164만명이 접종을 완료했고 4월 말까지 140만명의 추가 접종을 통해 300만명 이상이 접종을 완료할 예정이다. 또한 정부는 미국과 백신 스와프 등으로 추가 수급 방안을 논의 중에 있다”고 설명했다.
윤 위원장은 정부를 향해선 “오늘 대정부 질문에서도 백신 수급 상황에 대해 정확하고 투명하게 국민에게 밝혀달라”라고 주문했다.
이어 전날 코로나 백신 수급 긴급 원내 점검단을 설치한 것을 언급하며 “백신 수급 상황을 면밀히 점검해 진행 상황을 소상하게 설명하겠다”며 “상반기 내 국민 1200만명 백신 접종 계획이 차질없이 이뤄지고 11월 집단면역이 이뤄지도록 최선을 다하겠다”고 강조했다.",조선일보
