,date,title,reporter,content,press
184,2021.04.19,“백신 서두를 필요없다”던 그가 靑방역기획관,김아진 기자,"청와대는 지난 16일 방역을 전담하는 방역기획관에 기모란 국립암센터 교수를 임명하면서 “국민의 코로나 이해에 크게 기여했다”고 임명 이유를 밝혔다. 그러나 기 방역기획관은 그동안 김어준씨 라디오에 50여 차례 출연해 “백신 구입은 서두를 필요가 없다” “우리가 방역 세계 1등” 같은 발언을 해왔다. 전문가들과 야권은 “방역을 교란했던 인사를 방역 핵심에 세운 것”이라며 이번 인사를 ‘코드 인사'로 규정하고 임명 철회를 요구했다. 전문성을 중시해야 할 인사조차 친정부·코드 인사로 채웠다는 것이다. 코로나 백신 접종이 지연되면서 국민 불안이 커지는 상황에서 정권을 대변하고 현실과 동떨어진 발언을 한 인사를 방역 컨트럴타워로 임명했다는 지적이다.
국민의힘은 18일 논평에서 “방역을 교란했던 인사를 방역의 핵심에 세운 것”이라며 “정은경 질병관리청장의 힘을 빼고 대놓고 ‘정치 방역’ 하겠다는 선언이라는 의료계 우려가 크다. 즉각 임명 철회하라”고 했다. 현재 우리나라 코로나 백신 접종률은 3%대로 세계 최하위 수준이다. 하지만 기 방역기획관은 작년부터 “이번 코로나19는 메르스와 달리 환자들의 증상이 심하지 않아서 참 다행” “화이자·모더나는 가격도 비싸기 때문에 구매를 서두를 필요가 없다”는 등의 말을 해왔다.
이에 대해 의료계에선 “청와대가 기 교수를 발탁한 건 결국 방역 실패와 백신 확보 실패를 합리화하는 데 골몰하겠다는 것”이라는 비판이 나온다. 기 기획관이 전문적 지식을 기반으로 하는 방역보다는 정부 방역에 대한 비판을 정치적으로 막는 역할을 할 수 있다는 우려다. 야당은 기 교수의 남편 이재영 전 대외경제정책연구원장이 작년 4월 총선 당시 문 대통령 사저가 있는 경남의 양산갑에서 민주당 공천을 받고 출마했던 것을 들어 “또 하나의 친정부 보은·코드인사”라고도 비판했다. 청와대 관계자는 “기 교수는 백신이 아니라 방역을 담당할 비서관”이라며 “1년 전 발언들은 그 당시 기 교수뿐 아니라 많은 전문가도 그런 판단들을 했기 때문에 결격 사유로 보기 어렵다”고 했다.
문재인 대통령이 새로 임명한 기모란 청와대 방역기획관은 그동안 정부의 코로나 방역 정책을 홍보하거나 비판적 지적을 방어하는 역할을 해왔다. 기 기획관은 정부의 백신 확보 지연 논란 당시 “우리나라는 환자 발생 수준으로 봤을 때 백신이 급하지 않다” “화이자·모더나는 가격도 비싸다”는 주장을 쏟아냈다. 의료계에서는 기 기획관 임명을 놓고 “여전히 정부와 방역 당국이 친정부 성향이 뚜렷한 일부 전문가 얘기만 듣고 비판적인 목소리는 듣지 않겠다는 것 아니겠냐”고 하고 있다. 청와대는 “기 기획관은 백신이 아닌 방역을 담당한다”며 백신 관련 발언이 문제없다고 했다. 그러나 방역과 백신을 분리해 보는 청와대의 인식을 두고도 비판이 커지고 있다.
기 기획관은 코로나 발생 초기 김어준씨의 TBS 라디오 방송인 ‘뉴스공장’에 출연하면서 이름을 알렸다. 작년 2월부터 지난 4월 13일까지 54차례 나왔다. 김씨의 개인 유튜브 채널인 ‘다스뵈이다’에도 10여 차례 출연했다. 김씨는 작년 3월 기 기획관에게 “설명이 너무 귀에 쏙쏙 들어온다”고 칭찬한 뒤 거의 매주 기 기획관을 출연시켰다. 이 기간 기 기획관은 현실과 다르거나 상황을 왜곡하는 발언을 해왔다. “국민의 코로나 이해에 기여했다”는 청와대 설명과 달리 코로나 이해를 방해했다는 말까지 나온다.
기 기획관은 작년 2월 정부가 운영하는 대한민국정책브리핑 사이트에 기고문을 실으며 “이번 코로나19는 메르스와 달리 환자들의 증상이 심하지 않아서 참 다행”이라고 했다. 같은 달 CBS 라디오에선 “지금까지 발생한 환자를 보면 중국에서 온 한국인에 의해 2차, 3차 감염이 일어났지, 중국에서 온 중국인에 의해 2차, 3차 감염이 일어나지 않았다”며 중국발 외국인 입국 금지를 반대했다. 당시 대다수 방역 전문가의 입장과는 달랐다. 비슷한 시기 기 기획관은 정부가 코로나 위기 단계를 상향하지 않는 것을 옹호했다. 오마이뉴스 인터뷰에서는 “코로나에 걸려서 죽을 수도 있다는 주장은 (사실이) 아닌 것 같다”고도 했다. 김어준씨가 라디오에서 수도권 확진자 증가세와 관련해 “(보수 단체 집회의) 8·15발이 맞죠?”라고 묻자 기 기획관은 “그렇다”고 동의하기도 했다.
특히 기 기획관은 “백신 수급을 서두를 필요가 없다”고 여러 차례 주장했다. 지난해 11월 20일 뉴스공장에 출연해 “한국은 환자 발생 수준이 전 세계적으로 봤을 때 그렇게 급하지 않다”고 했다. 12월 10일에도 “다른 나라가 예방접종을 먼저 해 위험을 알려주는 것은 우리가 고마운 것”이라고 했다. 이 밖에 “백신 확보 문제는 정부가 잘못한 부분이 아니다” “화이자 백신을 계약해놨는데, 더 좋은 게 나오면 물릴 수도 있다” “가격도 화이자와 모더나가 가장 비싼 축에 들어가는데, 아스트라제네카는 4달러 정도밖에 안 한다”는 등의 말도 했다. 김어준씨는 “화이자의 마케팅에 우리가 넘어갈 이유는 없다”며 맞장구쳤다. 기 기획관은 “백신을 먼저 접종했다고 집단 면역이 빠르게 도달한다고 볼 수 없다”는 황당한 발언도 했다.
기 기획관의 발언은 여당에 의해 활용됐다. 김태년 민주당 원내대표는 페이스북에 기 기획관 주장을 싣고 “우리 국민이 맞아야 할 백신은 무엇보다 안전해야 한다”고 했다. 친문 성향 지지자들은 “교수님은 대한민국의 보물”이라고 극찬했다.
의료계는 “코로나 상황도 정확히 파악하지 못한 인사를 코로나 컨트롤타워로 쓰다니 이해가 가질 않는다”고 비판했다. 마상혁 대한백신학회 부회장은 “기 기획관은 일관되게 정부의 방역 실패를 합리화하거나 정부를 일방적으로 옹호하는 입장을 취했다”며 “정책 실패를 지적하고 교정할 전문가가 절실하다”고 했다. 다른 전문가들도 “정치 방역 성공을 자축하는 인사” “의학의 정치화에 앞장선 분”이라는 반응을 보였다. 최대집 대한의사협회 회장은 “기 기획관 임명은 향후 방역 실패 요인으로 작용할 것”이라고 말했다.
일각에선 코로나 사령탑인 정은경 질병관리청장에 대한 청와대의 불만 표시라는 말도 나왔다. 익명을 요구한 한 전문가는 “청와대가 질병청에 대한 정치적·행정적 통제를 더 강화하겠다는 것으로 보인다”고 했다. 야당은 기 기획관의 과거 발언을 문제 삼고 “기 기획관의 청와대행은 남편이 총선에서 낙선한 것에 대한 일종의 보상이 아니냐”며 임명 철회를 요구하고 있다.",조선일보
191,2021.04.23,"바이든의 백신 지원, 한국은 뒤로 밀렸다",뉴욕=정시행 특파원,"조 바이든 미국 대통령은 21일(현지 시각) 코로나 백신의 해외 지원과 관련, “해외로 그것(백신)을 보내는 걸 확신할 만큼 충분히 갖고 있진 않지만, (앞으로) 할 수 있을 것으로 기대한다”고 했다. 이어 캐나다 총리와의 통화 사실을 공개하며 “중미 등 우리가 도울 수 있다고 확신하는 다른 나라들도 있다”고 했다. 네드 프라이스 미 국무부 대변인은 “미국은 공중 보건 분야에서 리더십 역할을 수행해 왔다”며 “캐나다·멕시코를 비롯해 (중국 견제용 4국 연합체인) 쿼드와 수급 관련 협의를 했다”고 말했다.
이를 종합하면 미국은 현재 국내 접종에 주력하고 있으며, 해외에 백신 지원을 하더라도 캐나다·멕시코 등 인접국→쿼드 참여국인 일본·호주·인도→나머지 동맹 및 개발도상국의 순서로 진행하겠다는 얘기다. 바이든 정부의 ‘백신 아메리카나 구상’에서 70년 혈맹인 한국이 ‘2류 동맹’ 취급을 받으며 후순위로 밀릴 가능성이 커진 것이다.
앞서 정의용 외교부 장관은 지난 20일 국회 외교통일위원회에서 외교적 관례를 깨고 미국과의 ‘백신 스와프’ 논의 사실을 일방적으로 공개했다. 이튿날 관훈클럽 토론회에선 코로나 유행 초기 미국에 진단 키트와 마스크를 지원한 것을 언급하며 “어려울 때 친구가 진정한 친구”라고 했다. 백신 지원에 소극적인 미국을 압박하기 위한 ‘장외 여론전’으로 해석됐다. 문재인 대통령도 다음 달 하순 예정된 한미 정상회담을 두고 “백신 협력을 논의하겠다”고 했다.
하지만 프라이스 대변인은 한국과 ‘백신 스와프’를 고려하느냐는 질문에 “비공개 외교적 대화에 대해 언급하지 않겠다”며 “현 단계에서 우리는 국내 백신 접종에 초점을 맞추고 있다”고 했다. 그러면서 우선 협력 대상으로 쿼드를 거론한 것이다. 백악관 국가안보회의(NSC)도 쿼드 차원의 백신 지원 계획을 발표했다.
쿼드는 미국이 중국 견제를 위해 일본·인도·호주와 함께 결성한 연합체다. 한국은 트럼프 행정부 시절부터 이어진 미국의 쿼드 참여 요청에 난색을 보이며 중국을 옹호하는 듯한 태도를 취하고 있다. 지난 20일에도 문재인 대통령은 중국에서 열린 보아오 포럼의 화상 연설에서 “중국 정부의 노력을 높이 평가한다”고 했다. 이 포럼에서 시진핑 중국 국가주석은 “걸핏하면 내정에 간섭한다”며 미국을 비난했다.
세계 각국의 코로나 백신 확보전이 갈수록 치열해지는 가운데, ‘백신 대국’ 미국이 풍부한 백신 물량과 원천 기술을 무기로 전 세계 국가들을 상대로 줄 세우기에 나섰다. 미국 국익이나 글로벌 전략에 따라 나라별로 백신을 지원하는 우선순위와 물량을 조절하겠다는 뜻을 분명히 하고 나선 것이다. 백신 접종이 빠르게 진행되고 있는 미국은 조만간 백신이 수요보다 공급이 더 많아질 것이란 전망이 나오고 있다.
조 바이든 미 대통령은 21일(현지 시각) 백악관에서 기자회견을 열고 “미국 내 백신 접종이 2억회분을 돌파했다”며 “우리가 사용하지 않는 백신 중 일부를 어떻게 활용할지 살펴보고 있다”고 말했다. 그러면서 “세계 각국에 도움이 될 수 있기를 바란다”고 했다. 바이든은 이날 ‘남는 백신을 외국과 공유할 것이냐’는 질문에 대해 “지금은 해외로 백신 보내는 것을 확신할 만큼 충분히 가지고 있지 않다”면서도 “앞으로 (해외에 백신을 제공)할 수 있을 것으로 기대한다”고 답했다. 지금 당장은 아니지만, 국내 백신 상황에 따라 앞으로 다른 나라에 백신을 제공할 수 있다는 뜻으로 풀이된다.
미국이 해외에 백신을 지원할 경우, 가장 먼저 받을 것으로 예상되는 국가는 북미와 중미 등 인접국이다. 바이든 대통령은 이날 회견에서 캐나다 쥐스탱 트뤼도 총리와 전화 회담을 가진 사실을 공개하며 “우린 캐나다에 (이미) 도움을 줬고 좀 더 도우려 노력 중이다”라고 말했다. 이어 “우리가 도울 수 있을 것이라고 내가 확신하는 국가들이 있는데, 중미도 그에 포함된다”고 말했다. 미국의 최대 시장이자, 이민 정책 등에 직결되는 가장 중요한 이웃인 캐나다와 멕시코 등 중미를 백신 지원 대상 일순위로 꼽은 것이다.
최근 정상 간 화상회의 등을 열면서 강하게 결속하고 있는 쿼드(Quad, 미국·일본·인도·호주로 구성된 안보 협의체) 국가들도 백신 지원 리스트 상단에 자리할 전망이다. 쿼드는 중국 포위 전략을 펼치는 미국의 안보 정책에서 핵심축 역할을 하고 있기 때문이다. 실제로 미 국가안전보장회의(NSC)는 이날 트위터 공지를 통해 “미국은 20일 쿼드 백신 전문가 회의를 주재했다”면서 “2022년 말까지 전 세계에서 최소 10억회분의 코로나 백신을 생산하기 위한 노력을 지원하고 인도·태평양 지역의 백신 접종을 강화하는 계획에 대해 논의했다”고 말했다. 쿼드 4국은 지난달 열린 온라인 회의에서도 이 문제를 논의했는데, 구체적인 방안에 대한 논의가 착착 진전되고 있음을 확인한 것이다.
미국은 백신 생산 측면에서 ‘초강대국’의 면모를 보이고 있다. 화이자·모더나·노바백스·얀센·아스트라제네카(AZ) 등 5종류의 주요 백신 중 AZ만 영국 백신이고 화이자 등 4종은 미국 백신이다. 특히, 혈전 등의 문제가 발생하지 않아 안전성과 효능이 뛰어나 ‘명품’으로 꼽히는 화이자와 모더나의 생산과 공급이 미국 손아귀에 있다.
미국의 백신 수급 상황은 한마디로 ‘풍요로움’이다. 이날 현재 2억회분의 접종이 이뤄졌는데, 인구로는 1억3340만명에 달한다. 성인의 51.5%가 백신을 맞았다. 최근 백신 물량이 엄청나게 풀리면서 접종 증가율도 점점 둔화되고 있다. 미국 언론들은 미국 내 백신 공급이 수요를 뛰어넘을 것이라는 전망을 내놓고 있다. 오는 6월쯤이면 3억회분의 접종 물량이 남아돌 것이란 말도 나온다.
미국이 어떤 백신을 해외에 제공할 수 있을지는 아직 알려지지 않았다. 다만, 전문가들은 미국 내 접종이 대부분 화이자와 모더나 중심으로 이뤄지고 있는 점을 감안할 때 AZ 백신이 될 가능성이 높은 것으로 보고 있다. 바이든 정부는 우선 국내 접종률 끌어올리기에 집중한 뒤, 여름부터 시작될 16세 이하 청소년 접종, 가을부터 3차 접종(부스터 샷) 돌입 등 미국 내 수요를 감안해 잉여분 활용 방안을 판단할 전망이다.
이날 네드 프라이스 국무부 대변인도 브리핑에서 “한국이 제안한 ‘백신 스와프(swap·미국 백신을 우선 지원받고 나중에 한국 제약업체들이 미국 기술로 백신을 생산해 되갚는 개념)’를 얼마나 진지하게 고려하고 있느냐”는 질문에, “한국 또는 다른 외국과의 비공개 외교적 대화에 대해 언급하지 않겠다”면서도 “지금 우리의 초점은 미국 내에서의 백신 접종 노력”이라고 답했다.",조선일보
205,2021.04.05,"文, 백신품귀에 “1차 접종자 최대한 확대… 11월 집단 면역”",안준용 기자,"문재인 대통령은 5일 청와대 수석·보좌관 회의에서 “정부는 국가적 위기 속에서 방역과 경제의 두 마리 토끼를 잡기 위해 최선을 다해왔다”며 “경제에서는 각종 지표들이 확실한 회복의 길로 들어서고 있음을 보여주고 있다”고 했다.
그러면서 “지표가 좋아졌다고 해서 국민의 삶이 당장 나아지는 것은 아니지만, 경제 반등 흐름이 곳곳에서 만들어지고 있어 매우 다행”이라고 했다. 경제 회복 비결로는 ‘정부의 비상한 정책 대응’과 ‘국민·기업의 노력’을 꼽았다.
문 대통령은 이날 “2월 산업생산은 8개월 만에 최대 증가 폭을 보이며 코로나 이전 수준을 회복한 것은 물론 어려웠던 서비스업 생산도 증가세를 보였다”고 했다. 이어 “수출 역시 3월 수출로는 역대 최고치를 기록하며 5개월 연속 증가했고, 품목별로도 15대 주력품목 중 14개 품목이 증가해 코로나의 어려움을 떨쳐냈다”고 했다.
문 대통령은 “세계 1위 조선 강국의 위상을 압도적으로 되찾은 것은 물론 혁신벤처와 신산업이 경제반등의 든든한 밑거름이 되면서 우리 경제의 역동성과 미래 경쟁력을 보여주고 있는 것도 매우 큰 성과”라고 했다. 그러면서 “경제심리도 코로나 이전 수준을 넘어서며 지속적인 반등의 청신호가 되고 있다”고 했다.
이와 관련, “이 같은 경제의 빠른 회복은 정부의 비상한 정책적 대응과 함께 우리 국민과 기업들이 합심해 위기를 극복해낸 결과”라고 했다.
문 대통령은 이날 방역과 백신 접종도 강조했다. 문 대통령은 “우리가 코로나 이전으로 얼마나 빨리 돌아갈 수 있는지 여부는 오로지 방역과 백신 접종에 달렸다”면서 “우리나라도 연일 500명대의 확진자 발생이 계속되고 있어 걱정이 크다. 다른 나라에 비해 확진자 수가 매우 적은 편이지만, 우리가 관리해온 수준을 기준으로 보면 경각심을 크게 높여야 할 상황”이라고 했다.
이어 “정부는 방역 관리를 더욱 철저히 하는 한편 방역 방해 행위와 방역수칙 위반에 대해 무관용의 원칙을 엄격히 적용하지 않을 수 없다”며 “특히 선거 방역을 위해 빠짐없이 투표에 참여하면서도 방역당국과 선관위의 방역 조치에 철저히 따라달라”고 했다.
문 대통령은 “세계 각국이 안고 있는 또 다른 걱정은 백신 생산에 속도를 내지 못하고 생산국들이 수출제한을 강화하면서 백신 수급 상황에 불안정성이 확대되고 있는 점”이라며 “그런 가운데서도 정부는 차질 없는 백신 도입으로 상반기 1200만명 접종, 11월 집단 면역의 목표를 달성하는 것은 물론 더 나아가 그 목표를 더 빠르게 달성하기 위해 총력을 다할 것”이라고 했다.
그러면서 “1차 접종만으로도 감염예방 효과가 큰 것으로 확인되고 있기 때문에 정부는 1차 접종자 수를 최대한 확대하고 시기도 앞당기기로 했다”며 “모든 가능성에 대비해 이미 계약된 물량의 조기 도입은 물론, 추가 물량도 확보해 나가겠다. 국민들도 백신의 안전성을 믿고 백신접종에 적극적으로 참여해달라”고 했다.",조선일보
241,2021.04.28,충무공까지 꺼낸 홍남기 “연말엔 국산 백신… 임진왜란처럼 이겨내자”,,"홍남기 국무총리 직무대행은 28일 “코로나 백신 수급 문제의 근본적인 해법 중 하나가 백신 자주권 확보, 즉 국내 백신 개발”이라며 “정부는 올해 말이나 늦어도 내년 초 국산 백신이 개발될 수 있도록 전임상·임상·생산 전 주기에 걸쳐 총력 지원하고, 올해 예산 687억원을 집중 지원 중”이라고 말했다.
홍 총리대행은 이날 오전 정부서울청사에서 주재한 코로나 중앙재난안전대책본부(중대본) 회의 모두발언에서 “현재 국내 백신은 5개 기업에서 임상시험을 진행 중으로, 이 중 2개 백신이 임상 2상을 개시해 하반기 3상 진입이 예상된다”면서 이같이 말했다.
그는 또 코로나 백신 접종 상황과 관련, “어제(27일)까지 259만명이 1차 접종을 받았다”며 “앞으로 3일간 백신 접종을 착실히 진행해 4월 300만명 접종 약속부터 꼭 지키도록 하겠다”고 밝혔다.
그러면서 하루 30만명 신규 코로나 확진자가 발생하는 인도 내 교민의 국내 입국과 관련해선 “일각에서 한국과 인도 간 항공편 운항이 중단돼 인도 거주 교민의 국내 입국 길이 막혔다는 보도가 있었으나 이는 사실이 아니다”라며 “내국인 이송목적의 운항은 허용되고 있으며 추가 부정기편 신청 시 신속하게 허가할 방침”이라고 했다.
홍 총리대행은 이날 “오늘 4월 28일은 충무공 이순신 장군의 탄신일”이라며 “난중일기에 따르면 임진왜란 당시 심각한 역병으로 많은 수군이 고생했고, 이순신 장군께서도 18일간 앓으면서 위기의 고비를 맞은 적도 있었다고 한다”고 했다.
그러면서 “우리 선조들이 역병 재난 속에서도 이를 극복하고 외침으로부터 나라를 굳건히 지켰던 것처럼 지금 국민 한분 한분과 정부가 힘을 모아 코로나 위기를 극복하고 우리의 소중한 일상을 되찾으며 나아가 국가 경제 회복과 반등도 이루어내리라 저는 확신한다”고 했다.",조선일보
249,2021.03.24,"文대통령의 백신 후기 “제가 맞아보니, 안심해도 됩니다”",오경묵 기자,"문재인 대통령이 아스트라제네카(AZ) 코로나 백신을 맞은 지 하루 지나 후기를 올렸다. 문 대통령은 큰 문제가 없었다며 “백신의 안전성에 대한 논란은 끝내주시기 바란다”고 했다.
문 대통령은 24일 오후 페이스북에 “백신 접종, 제가 맞아보니 안심해도 된다”는 글을 올렸다. 문 대통령은 “주의를 기울여야 하는 시간이 더 남아있긴 하다. 하지만 만 하루와 7시간이 지난 지금까지 별 탈이 없었다”고 했다. 문 대통령은 전날인 23일 서울 종로구 보건소에서 코로나 백신을 접종받았다.
문 대통령은 “어제(23일) 밤 늦게 미열이 있었는데, 머리가 아프거나 불편한 정도는 아니었지만 대비 차원에서 해열진통제를 먹고 잤더니 아침에는 개운해졌다”며 “평소 고혈압인데, 혈압에도 아무 영향이 없는 듯 하다”고 했다.
그러면서 “아내(영부인 김정숙 여사)는 독감 접종에도 부작용을 좀 겪는 편인데, 이번에는 저처럼 밤에 미열이 있는 정도였고 오히려 독감 접종보다 더 가벼웠다고 한다”며 “함께 접종받은 11명 모두 아무 이상이 없거나 가벼운 미열이나 뻐근함 정도가 있었다는 것이 전부”라고 했다.
문 대통령은 “사람에 따라서 증상이 심한 분들도 있습니다만, 면역이 형성되는 과정이라고 하니 너무 걱정하지 않으셔도 될 것”이라고 썼다. 그러면서 “이제 백신의 안전성에 대한 논란은 끝내주시기 바란다”며 “전 세계가 공인하는 백신의 안전성을 (가지고) 논란하는 것은 아무에게도 도움이 되지 않는다. 오히려 더 많은 사람이 백신을 접종받을 수 있도록 국민들께서 적극 협조해 주시기 바란다”고 했다.
문 대통령의 백신 접종을 놓고 일각에서 ‘백신 바꿔치기’ 의혹이 일고 있는 가운데 이런 의혹을 불식시키기 위해 문 대통령이 직접 나섰다는 관측이 나온다.
녹화 방송으로 공개된 문 대통령의 백신 접종 장면을 보면 간호사가 주사기를 들고 AZ 백신에서 접종할 백신을 추출(분주)한 뒤 백신과 뚜껑을 뺀 주사기를 들고 파티션(가림막) 뒤로 갔다가 다시 나와 대통령에게 접종했다. 대통령에게 접종하기 직전 주사기를 보면 뚜껑이 씌워져 있어 ‘리캡’ 논란이 일었다. 주사기 캡을 열고 백신을 추출했는데, 굳이 뚜껑을 씌울 필요가 있었느냐는 지적과 함께 “주사기를 바꿔친 것 아니냐”는 주장도 나온다.
아스트라제네카 백신을 아예 추출하지 않았다는 의혹도 제기됐다. 한 유튜버는 “백신 접종 장면을 보면 병에서 백신을 추출한 뒤 파티션 뒤로 가져가는 순간 캡이 씌워져 있는 것을 확인할 수 있다”며 관련 캡처 영상을 올렸다.
이와 관련해 질병관리청은 “접종 준비 시간동안 주사기 바늘이 오염되는 것을 방지하기 위한 것”이라고 해명했다. 접종 장면을 공개하기 위한 촬영이 이뤄지면서 접종에 시간이 걸리자 주삿바늘이 오염되는 것을 막기 위해 캡을 씌웠다는 것이다.
질병관리청은 이 같은 주장을 담은 인터넷 게시글에 대해 불안과 혼란을 야기할 수 있다고 보고 경찰청에 수사를 의뢰했다. 대구지방경찰청은 이와 관련한 내사(內査)에 착수했다. 내사는 수사의 이전 단계로, 내사 과정에서 범죄 혐의가 드러나면 수사로 전환된다.",조선일보
