,date,title,reporter,content,press
711,2021-03-24,"‘오세훈 역전극’ 다음날, 광주 간 김종인 “5·18 정신 계승하겠다”",오연서 기자 loveletter@hani.co.kr,"김종인 국민의힘 비상대책위원장이 24일 광주 국립 5·18민주묘지를 찾아 “광주 민주화 운동의 정신을 계승하겠다”고 밝혔다. 김 위원장이 5·18 묘지를 찾은 것은 지난해 8월 보수 정당 대표로는 처음으로 무릎을 꿇고 참배한 이후 두 번째다. 김 위원장은 추모탑 앞에서 헌화하고 묵념했다. 방명록에는 “5·18 정신으로, 무너진 민주주의를 바로 세우겠습니다”라고 적었다. 
김 위원장은 이날 오전 참배 뒤 기자들과 만나 “국민의힘에서 내 임무를 마쳐가는 과정에 있다”며 “4월7일 선거가 끝나기 전에 다녀가야겠다고 생각했다”며 방문 이유를 밝혔다. 그는 전날 국민의힘 오세훈 후보로 야권 단일화가 이뤄지자 “내 할 일의 90%를 다 했다”고 말한 바 있다. 그는 이날도 보궐선거 이후 당내에서 ‘김종인 역할론’이 제기되는 것과 관련해 “어제 분명히 얘기를 했기 때문에 다른 사람이 뭐라고 하는가는 내 결심과는 상관없다”며 비대위원장직을 내려놓을 것을 분명히 했다.



김 위원장의 이번 호남 방문은 줄곧 강조해왔던 ‘탈이념 광폭 행보’로 임기를 마무리하려는 뜻이 담겨 있다. 김 위원장은 “국민은 더는 이념에 반응하지 않는다”(지난해 5월27일 당 전국 조직위원장 비공개 특강)고 말하는 등 취임 초기부터 극우 성향이 짙어진 당의 체질을 바꾸려고 노력해 왔다. 
김 위원장은 망월동 방문에 이어 5·18민주유공자유족회 등 관련 단체와 간담회에도 참석했다. 이 자리에서 김 위원장은 “우리가 민주주의 사회에서 자유를 누리고 지낼 수 있는 게 광주 시민의 숭고한 희생 덕분이라고 생각하고 있다”고 밝혔다. 5·18 민주화 운동을 폄훼하는 세력에 대해서는 “5·18 민주화 운동은 역사적으로나 법적으로나 누구도 부정할 수 없는 사실로 확정돼 있는 사항”이라고 말했다. 그러면서 “과연 오늘날 우리나라 민주주의가 당시 광주의 민주화 운동의 함성에 맞게 제대로 발전하고 있는가에 대해 매우 회의적인 상황”이라며 “저는 광주 민주화 운동의 정신을 다시 살려서 훼손돼가는 우리나라 민주주의가 다시 정상적 상황으로 발전되길 바란다”고 말했다. 지난 여름 광주 방문의 메시지가 “통렬한 반성”이었다면 이번엔 ‘광주 정신’을 기준선 삼아 문재인 정부를 비판하는 데까지 나아간 것이다. 



한편 이날 광주전남대학생진보연합(대진연)도 5·18민주묘지를 찾아 김 위원장의 방문에 항의했다. 대진연 회원들은 김 위원장이 참배를 위해 차에서 내리자 ‘광주시민 기만하는 국민의힘 규탄한다!' 등이 적힌 손팻말을 들고 김 위원장의 앞을 가로막았다.",hankyoreh
759,2021-04-07,엇갈린 20대 표심…‘남성은 오세훈’ ‘여성은 박영선 ’지지,이지혜 기자 godot@hani.co.kr,"지상파 방송 3사의 4·7 서울시장 보궐선거 출구 예측조사 결과, 오세훈 국민의힘 서울시장 후보의 압도적 우세 속에서 ‘20대 이하 여성’ 그룹은 박영선 더불어민주당 후보 지지 응답이 더 높은 것으로 나타났다. 
7일 <한국방송>(KBS) <문화방송>(MBC) <에스비에스>(SBS) 방송 3사가 참여한 공동예측조사위원회(KEP)의 공동 출구 예측조사를 보면, 18·19살과 20대 여성 유권자들의 박 후보 지지율은 44%, 오세훈 후보는 40.9%를 기록했다. ‘20대 이하 여성’은 민주당의 핵심 지지층인 ‘40대 남성’과 함께 박 후보를 오 후보보다 더 많이 지지했다. 반면 20대 이하 남성 유권자는 72.5%가 오 후보를 지지했다고 답했고 박 후보는 22.2%에 그쳤다. 3배 이상 차이다. 이는 60대 이상 유권자의 표심과 비슷한 수치다.
20대 이하 여성의 소수정당·무소속 ‘기타 후보’를 향한 15.1% 지지도 도드라졌다. 이번 보궐선거가 전임 시장의 성추행으로 인해 치러진 만큼 ‘젠더 이슈’에 대한 태도가 지지 후보 결정에 큰 영향을 미친 것으로 보인다. 전체 유권자 가운데 ‘기타 후보’에 10% 이상의 지지를 보낸 성별·세대는 20대 이하 여성이 유일했다. 


이번 서울시장 보궐선거에는 기호 6번 신지혜(기본소득당), 8번 오태양(미래당), 11번 김진아(여성의당), 12번 송명숙(진보당), 15번 신지예(무소속·팀서울) 후보 등 성평등을 공약 전면에 내세운 페미니스트 후보가 다수 출마했다.
이번 출구조사는 입소스주식회사·코리아리서치인터내셔널·한국리서치 등 3개 조사기관이 참여해 아침 6시부터 저녁 7시까지 서울 50개, 부산 30개 투표소에서 1만5753명 유권자를 대상으로 실시됐다.",hankyoreh
764,2021-03-17,"안철수 “오세훈, 합당 해본 적 없어…제가 가르쳐 드리겠다”",김미나 기자 mina@hani.co.kr,"“오세훈 후보는 합당을 해본 적이 한 번도 없어 실무적으로 어떻게 되는지 전혀 모를 것이다. 저는 어떻게 하면 성공하는지 알고 있다. 제가 가르쳐 드리겠다.”
안철수 국민의당 서울시장 후보가 17일 자신의 ‘시장 당선 뒤 합당’ 구상을 비판한 오세훈 국민의힘 후보를 향해 “저는 전혀 (합당 실패를) 걱정하지 않는다”며 자신감을 내비쳤다. 안 후보는 이날 오후 서울 양천구 한국방송회관에서 열린 서울시장 후보자 초청토론회에서 “어떤 분은 제가 처음부터 2번(국민의힘)으로 시작했으면 쉽게 단일후보가 됐을 것이라고 하는데, 이런 정치구조에서 1번(민주당), 2번 대결을 하면 백전백패”라며 이렇게 말했다. 안 후보는 또 ""야권이 이기기 위해서는 제1야당 힘만으로 부족하다. 그래서 제1야당뿐만 아니라 국민의당, 민주당에 반대하지만 제1야당까지는 선택 못 하는 분들까지도 모두 다 모아야 해서 4번으로 출마한 것”이라고 했다. 
오세훈 후보는 전날 안 후보가 “서울시장이 되면 국민의힘과 합당하겠다”고 기자회견을 하자 “막판에 다급하니까 내놓은 입장표명”이라고 발끈한 바 있다. 안 후보는 이에 대해 “3단계 (합당을) 말했다. 서울시장에 당선되면 (국민의힘-국민의당의) 합당은 물론이고, 바깥에 있는 윤석열 전 검찰총장을 포함, 더불어민주당에 반대하는 정의로운 분들까지 모두 다함께, 시민단체와 함께 정권교체가 가능한 그런 정당을 만들겠다”고 밝혔다. 
이날 토론회에서는 안 후보의 아내 김미경 서울대 교수의 정치적 영향력과 관련된 질문도 나왔다. 안 후보는 “정치인의 가족을 공격하는 게 가장 위기에 몰렸을 때 마지막으로 꺼내는 카드”라며 “(국민의힘이) 참 마음이 급했구나. 많이 몰리고 있다고 생각한다”고 응수했다. 전날 안 후보가 단일화 협상이 삐걱대는 이유로 김종인 국민의힘 비상대책위원장을 겨냥하며 “오 후보의 뒤에 상왕이 있는 것 아닌가”라고 지적하자, 국민의힘 쪽에선 안 후보의 아내를 직격하며 “본인을 돕는 여자 상황제가 있단 말은 들었느냐”라고 공세를 편 바 있다. 안 후보는 이어 “김 위원장님의 사모님이 제 아내와 이름이 같다. 그리고 또 정치적인 영향력에 대한 이야기도 여의도에 많이 퍼져 있어 혹시 그분과 착각해서 그런 거 아닌가. 저는 그런 해석밖에는 할 수가 없다”고 맞받았다.
안 후보는 토론회 마지막 발언으로 “결점 없는 후보”임을 강조하며 최근 불거진 오 후보의 처가 땅(서울 강남구 내곡동) 특혜 의혹도 은근히 부각했다. 안 후보는 “민주당 후보를 오차범위 밖에서 확실히 이길 수 있는 결점 없는 후보, 전 정권과 전 시정일로 추궁당하지 않을 수 있는 후보, 야권이 취약한 2030 중도층·무당층에서 민주당 후보를 압도할 수 있는 유일한 후보, 야권 대통합을 가장 강력하게 추진할 수 있는 후보는 안철수뿐”이라며 “말만 잘하는 해설사가 아니라 일 잘하는 해결사가 되겠다”고 말했다.",hankyoreh
788,2021-03-31,오세훈 선거를 내 선거처럼…달라진 안철수 왜?,장나래 기자 wing@hani.co.kr,"안철수 국민의당 대표가 공식 선거운동이 시작된 지난 25일부터 일주일째 하루도 빠지지 않고 지원 유세를 이어오고 있다. 안 대표가 적극적으로 국민의힘 유세에 나서는 것을 두고 향후 야권 정계 개편 행보를 고려한 것이라는 해석이 힘을 받고 있다.


“다음엔 대통령해요” “정말 멋있어요”
안 대표가 31일 오후 서울 마포구 홍대입구역에서 시민들에게 기호 2번을 외치며 인사를 건네자 응원이 이어졌다. 안 대표는 “오세훈 후보를 찍어달라” “오 후보를 잘 부탁한다”고 화답했다. 이날 오세훈 국민의힘 서울시장 후보 없이 허은아 국민의힘 의원 등과 유세차에 오른 안 대표는 “야권 일각에서 사전투표에 부정선거 가능성이 있다고 걱정하는 분들이 있다. 시민들이 훨씬 더 잘 감시하면 그런 가능성은 차단할 수 있다고 생각한다. 저도 청년들과 4월2일 사전투표하겠다”며 투표 독려에 나섰다. 정권심판론을 강조하기도 했다. 안 대표는 “불공정하고 정의가 사라진 사회를 만든 정부를 심판해야 하지 않겠나. 심판하려면 기호 2번 오세훈 후보를 찍어달라”며 “꼭 투표에 참여해야 이 정권을 심판할 수 있다”고 목소리를 높였다.
안 대표는 전날도 오 후보를 비롯해 나경원 전 의원 등과 함께 서울 영등포역 앞에서 집중 유세를 벌이기도 했다. 오 후보가 티브이(TV) 토론회 준비로 유세에 나서지 못하는 날 안 대표가 그 공백을 메우는 등 공식 선거운동이 시작된 25일부터 일주일 동안, 주말까지 하루도 빠지지 않고 지원 유세를 이어오고 있다. 선거운동 기간 유세 지원을 위해 당 최고위원회의도 열지 않고 있다. 내달 1일엔 부산시장 보궐선거전 지원으로 보폭을 넓힐 계획이다.


안 대표가 그 누구보다 열심히 국민의힘 선거를 돕는 이유를 두고 재보선 이후 야권 정계개편을 염두에 뒀다는 관측이 지배적이다. 재보선 뒤 합당을 약속했던 안 대표는 차기 대선을 앞두고 제1야당에 들어가 재기를 모색할 가능성이 높다. 단일화 시너지 효과를 기반으로 재보선 승리에 기여한다면, 야권 정계 개편 과정에서 목소리를 더 크게 낼 수도 있다고 보는 것이다. 국민의힘의 한 중진 의원은 “이번 재보선에서 정당의 중요성을 느낀 안 대표가 국민의힘의 대선 후보 자리를 노리고 있는 것으로 보인다”며 “국민의힘 후보가 돼서 조직력을 가지고 윤석열 전 검찰총장 등과 싸우는 구도를 그리고 있는 것 같다. 고 김영삼 대통령 모델을 염두해두고 있는 것으로 보인다”고 해석했다.
국민의힘 입장에서도 단일화 시너지를 극대화하기 위해 지원 유세에 나선 안 후보를 예우할 수밖에 없는 상황이다. 안 대표의 지지층을 최대한 흡수해야 하기 때문이다. 오세훈 후보 캠프 관계자는 “단일화 과정에서 언제 잡음이 있었냐는 듯이 오세훈-안철수 ‘꿀케미’를 보여주고 있다. 내 일처럼 나서주는 안 대표에게 감사한 마음”이라고 전했다.
하지만 내부에서 벌써부터 안 대표를 견제하는 목소리도 나온다. 김종인 비상대책위원장은 지난 24일 “(안 대표의) 기자회견 내용을 보니 앞으로 대선 행보를 또 한 번 해보겠다는 뉘앙스가 비쳤다. 내년 대선 후보 선출 때 본인이 또 장애요인이 될 것 같으면 결정적으로 정권교체에 지장을 초래할 텐데 그 짓을 할 수 있겠나”라고 공개적으로 안 대표를 견제하기도 했다. 서울에 지역구를 둔 한 국민의힘 의원도 <한겨레>에 “우리로서는 안 대표가 의외로 적극적인 선거 운동을 해주니 고맙다”면서도 “시민들을 개별적으로 만나는 유세 없이 마이크 잡는 유세만 하는 등 선거 승리의 흐름을 타 자기 정치만 하고 있다는 생각도 지우기가 힘들다. 재보선 이후 합당이나 입당 과정에서 지분 다툼이 심화될 수 있을 것 같다”고 우려했다.
안 대표의 ‘철수 이미지’ 변신을 염두에 둔 행보라는 분석도 나온다. 2012년 대선 과정에서 후보직을 내려놓은 뒤 선거 운동을 돕지 않고 대선 당일 미국으로 출국하는 과정에서 얻은 ‘철수 이미지’를 불식시키려는 의도라는 해석이다. 안 대표는 지난 일주일 동안 오 후보 유세차에 오를 때마다 “‘야권 단일 후보 경선에서 진 사람이 왜 여기 와 있지’ 이렇게 말하는 분들도 계실 텐데 저는 딱 하나 약속을 지키러 왔다. 누가 후보가 되는 것보다 야권이 승리하는 게 중요하다는 말씀을 드린다”며 ‘약속을 지키는 정치인’을 연일 강조해왔다.",hankyoreh
792,2021-03-30,오세훈 “측량 안 갔다. 그러나 기억 앞에 겸손”…박영선 “핵심은 거짓말”,김미나 기자 mina@hani.co.kr,"4·7 서울시장 보궐선거에 출마한 박영선 더불어민주당 후보와 오세훈 국민의힘 후보가 29일 첫 티브이(TV) 토론회에서 오 후보의 아내와 처가가 소유한 서울 내곡동 땅 ‘셀프 보상 의혹’을 놓고 치열하게 맞붙었다. <문화방송>(MBC) ‘100분 서울시장 후보 토론회’에 나선 두 후보는 선거 막바지 쟁점이 된 오 후보 처가의 내곡동 땅 의혹에 대한 진실 공방을 벌이며 팽팽한 신경전을 이어갔다. 
 박 후보가 먼저 “내곡동 땅 관련 대가로 (오 후보 처가댁이) 36억5000만원을 보상받았는데 추가로 더 받은 것이 있냐”고 포문을 열었다. 이에 오 후보가 “없다”고 했다가 “정확히 말하면 모른다. 장인, 장모가 받았는데 추가로 받은 게 있는지 어떻게 아냐”고 답하자 박 후보는 “말을 바꾼다”고 반발했다. 
 이어 “에스에이치(서울주택도시공사)에서 답변서를 오늘 받았는데 (오 후보 처가가) 단독주택용지를 특별공급으로 추가로 받았다는 답변이 왔다. 이 땅은 36억5000만원 보상에 플러스로 보금자리주택 단지 안에 단독주택용지를 특별분양해준 것”이라고 주장했다. 박 후보는 그러면서 “분명히 (추가로 받은 게) 없다고 했는데 제가 증거를 말하니 (말을 바꾼다). 지금 계속 거짓말, 말 바꾸기가 세 번째다”라고 반발했다. 
 오 후보가 “땅의 위치와 존재도 몰랐다”고 했던 내곡동 땅 측량에 직접 입회했다는 증언이 담긴 언론 보도 내용을 두고도 공방을 이어갔다. 박 후보가 “측량 현장에 갔느냐, 안 갔느냐”라고 묻자, 오 후보는 “안 갔다. 그러나 기억 앞에서는 겸손해야 한다고 생각한다”고 했다. 그러자 박 후보는 “그것도 기억이 안 나냐. 인터뷰한 사람이 두 명, 측량팀장이 한 명 있다. 이 세 명의 증언이 다 똑같다. (2005년 측량 당시) 까만 선글라스를 낀 사람이 오 후보였고 하얀 옷을 입고 생태탕을 먹었다고 했다. 추가 증거가 나오면 어떻게 하겠나”라고 물었다.  
 오 후보는 ”(증언한 사람이) 2명인 줄 알았더니 3명으로 늘었나. 삼인성호라고 3명이 말하면 호랑이가 생겨난다고 하더니”라고 받아치면서, “사건의 초점은 조상에게서 물려받은 땅이었다. 엘에이치(한국토지주택공사)처럼 보상받으려고 땅을 산 게 아니다. 본질은 어디로 가고 지금 측량하는 곳에 갔느냐로 계속 초점이 옮겨가고 있다”고 반발했다.
 토론회 중반부에는 이번 보궐선거의 책임 공방이 이어졌다. 오 후보는 “민주당이 성추행 사건이 나면(보궐선거 원인이 되면) 후보를 안 내기로 했는데, 당헌 개정에 투표했느냐”고 묻자, 박 후보는 “저는 투표를 안 했던 것으로 기억한다. 당시 중소벤처기업부 장관을 하고 있었다”고 답했다. 
 이에 오 후보는 “당적은 유지되지 않나”라고 물었고, 박 후보는 “제 기억엔 (투표) 안 했다”고 거듭 답했다. 그러자 오 후보는 “(박 후보는) 2차 가해에 동의한 것이다. 불참은 결론이 나는 대로 두고 본다는 것이지 않나”라고 주장했다. 박 후보는 “무슨 근거인가. 함부로 상대를 규정하지 마시라”고 맞받았다.
 박 후보는 2011년 오 후보가 무상급식을 막기 위한 주민투표를 강행했다가 자진 사퇴한 점을 물고 늘어졌다. 박 후보는 “무상급식 때문에 보궐선거가 있었다”고 비판하자, 오 후보는 “성추행에 의한 보궐선거와 똑같다는 것이냐. 박 후보에게는 가치가 같은가 보다. 저는 인정할 수 없다”고 거세게 반발했다. 박 후보는 “보궐선거 이유를 제공한 건 똑같다는 뜻이었다”며 “2011년 보궐선거의 원인 제공자 아니냐”고 지적했다.
 오 후보는 이에 대해 “수십 차례 사죄드렸다. 박 후보는 이번 보궐선거에 대해 사죄할 마음이 있느냐. 그렇다면 (피해 호소인이라고 주장한) 3인방을 쓰지 마셔야 했지 않냐”고 몰아붙였다. 박 후보는 “그분들은 사퇴하셨지 않나. 상처를 드린 부분은 죄송스럽게 생각한다. 진심으로 사과를 드리고 제가 더욱더 열심히 잘하겠다”고 강조했다. ",hankyoreh
