,date,title,reporter,content,press
475,2021-01-11,"김종인, 안철수-오세훈 만남에 불같이 화낸 이유는?", 장나래 기자 wing@hani.co.kr,"김종인 국민의힘 비상대책위원장은 11일 ‘단일화 회동’을 앞둔 오세훈 전 서울시장과 안철수 국민의당 대표를 향해 “상식에 맞지 않는 일을 하고 있다”고 거세게 비판했다. 김 위원장은 이날 <한겨레>와 한 통화에서 “(단일화 실패로) 3자 구도로 가더라도 국민의힘이 이긴다”고 자신감을 드러냈다. 아래는 김 위원장과 <한겨레>의 일문일답. 


 —오늘 비대위에서 단일화 회동에 대해 언급한 취지는?
“(서울시장에) 출마하는 건 자유인데, 단일화 협상을 어떻게 안철수 대표와 오세훈 전 시장, 둘이서 한다는 것인가? 말도 안 되는 짓을 하고 있다. (오 전 시장이) 당을 대표하는 사람도 아니고 단일화 협상을 둘이 한다는 게 (말이 되는가). 정치인들이 상식에 안 맞는 짓들을 하고 있다. 안철수 저 사람은 지금 우리 당 (사람들)을 상대로 여기저기서 만나면 뭐가 될 줄 아는데, 그런 식으로 아무 것도 안 된다. 단일화도 질서가 있어야 한다.”

 
거침없는 비판을 쏟아낸 김 위원장은 이날 비대위 회의에서도 안 대표를 중심으로 흘러가는 야권 단일화 협상 구도에 대해 상당한 시간을 할애해 비판을 쏟아냈다고 한다. 한 비대위원은 <한겨레>에 “이날 김 위원장은 보궐선거를 앞두고 당내에서 일어나는 일들에 화가 잔뜩 나 보였다. 화난 이유는 세 가지로 요약되는데 오 전 시장의 이상한 조건부 출마 선언과 오세훈-안철수 회동, 정진석 공관위원장의 당 대 당 통합 발언이었다”고 전했다.


 —두 사람의 회동이 국민의힘과는 무관한 일이라는 얘긴가?
“(오세훈) 본인이 조건부 출마하는 건 개인 문제지, 우리 당하고 관계가 없다.”

—오 전 시장이 조건부 출마선언을 한 뒤 만나지 않았나?
“(만나긴 했으나) 나하고는 공감대를 형성한 게 하나도 없다. (그가 안철수와 만나는 건) 당 입장과 무관하다.”

 
 김 위원장은 이날 오 전 시장과 안 대표의 ‘단일화 회동’에 대해 비공개 회의 시간의 절반 가까이를 할애하며 신랄한 비판을 쏟아냈다고 한다. 앞에 언급한 비대위원은 “김 위원장이 ‘무슨 출마를 제3자 이름을 들먹거리면서 하나. 당당하지 못하다. 안 대표를 만나겠다고 하는데, 그렇게해서 얻는 정치적 이득이 대체 뭐냐’는 취지로 오 전 시장을 비판했다”고 했다. 출마 명분 확보를 위한 개별적 단일화 논의는 당에 도움이 되지 않을 뿐더러 안 대표의 몸값만 높여준다고 판단한 것으로 풀이된다.


 —정진석 공관위원장은 ‘선통합 후단일화’ 주장했는데.
“아침에 내가 직접 (정 위원장에게) 물어봤더니 통합이란 취지는 아니었다고 설명했다. 지금 단계에 무슨 합당을 하겠나? 현 단계에서 합당할 이유는 전혀 없다. 우리는 우리가 해야 할 일을 잘 하면 된다.”

  김 위원장은 정진석 공관위원장을 포함한 당 내 중진들의 ‘선통합 후단일화론’을 언급하며 “여기가 콩가루 집안이냐”며 격노했다고 한다. 오 전 시장과 정 위원장 등이 당 지도부와의 사전 논의 없이 ‘당 대 당 통합론’을 점화한 것에 강한 불쾌감을 드러낸 것이다. 

 —단일화가 필요하다는 건 김 위원장도 얘기하지 않았나?
“단일화는 우리 당 후보가 완전히 정해진 다음에, 3월에나 가야 논의할 수 있다. 지금은 우리가 단일화에 대해 얘기할 게 없다. 공관위는 우리 당의 후보 내는 것 말고는 다른 역할이 전혀 없다. 우리 당 후보를 내는 과정에 집중해야 한다. 안철수 대표에 대해서 얘기할 필요가 없다.”

 
김 위원장이 예상하는 단일화 시간표는 명확했다. 각 당의 후보가 정해지는 3월은 되어야 단일화 논의도 현실화될 수 있다는 것이었다. 또 다른 비대위원은 “재보선을 총괄하는 김 위원장이 선거 관리 차원에서 가이드라인을 정하고, 다른 목소리는 내지 말라는 경고를 한 것이다. 우리 당의 후보가 정해지기 전에는 안철수라는 이름은 언급도 하지 말라는 것”이라고 설명했다.


 —서울시장 선거가 민주당-국민의힘-안철수 대표의 3자 구도로 치러질 가능성은 얼마나 되나?
“단일화를 하자고 하다가 자기(안철수)로 단일화 안 된다면 (충분히 가능하다.) 그 사람이 출마하면 할 수 없는 거지 어떻게 하겠나. 

—단일화는 자신이 후보가 안 되더라도 승복하는 걸 전제로 하지 않나?
“안 대표의 과거 행적으로 미뤄볼 때, 본인으로 단일화가 안 돼도 단독 출마할 가능성이 충분하다고 본다. 하지만 그러더라도 우리가 이긴다. 그러니까 우리가 지금 안 대표에게 관심을 둘 필요가 없다는 거다.”

 
 김 위원장은 지난달에도 당 비대위원들에게 1995년 3파전에서 승리한 민주당 조순 전 서울시장 사례를 언급한 바 있다. 선거 초반 무소속인 박찬종 후보가 앞섰지만 결국 제1 야당 소속인 조 후보가 당선됐다는 것이다. 김 위원장의 이런 자신감은 6주 연속 민주당을 앞선 여론조사 결과를 보며 한층 강화된 것으로 보인다. 리얼미터가 <와이티엔>(YTN) 의뢰로 지난 4~8일 전국 18살 이상 유권자 2513명을 조사한 결과(신뢰수준 95%, 오차범위 ±2.0%포인트), 국민의힘 지지율이 33.5%(지난주 대비 3.1%포인트 상승)로 29.3%를 기록한 민주당(0.4%포인트 하락)을 오차범위 밖으로 따돌렸다(자세한 내용은 리얼미터 또는 중앙선거여론조사심의위원회 누리집 참조). 
 당에서는 ‘안 대표 이야기만 나오면 격앙’되는 김 위원장에 대해, “재보선 결과에 비대위의 운명이 걸린 상황인 만큼 당연한 일”이라는 반응도 나온다. 한 의원은 “재보선 결과가 대선은 물론 비대위 성공 여부에 대한 평가와 직결될 수밖에 없는 만큼 대표는 당 후보자를 만들어내기 위해 마지막까지 최선을 다할 수밖에 없는 상황”이라고 했다. 하지만 일각에선 “두 달 안에 안철수를 이길 자체 후보자를 키워낼 수 있느냐. 안철수와의 연합은 필수다”라는 현실론도 고개를 들고 있다. 한 중진 의원은 “우리 당 후보가 될 수 있는 안 대표를 향해 ‘단일화 경선에서 져도 출마할 것’이라고 깎아내릴 필요가 있나. 현명하지 못한 발언”이라고 꼬집었다.",hankyoreh
477,2021-02-26,나경원·오세훈 ‘중도확장성’ 신경전…“도망간 장수” “보수 본색”,김미나 기자 mina@hani.co.kr,"서울시장 보궐선거에 출마하는 국민의힘 오세훈·나경원 예비후보는 26일 합동 ‘비전토론’에서도 강하게 부딪혔다. 이날 토론의 열쇳말은 중도확장성이었다. 나 후보는 자신에게 ‘강경 보수’ 꼬리표를 붙이는 오세훈 후보를 향해 “2011년에 도망간 장수가 싸우는 장수에게 나무라는 게 아닌가”라고 거세게 반발했고, 오세훈 후보는 “본인이 짜장·짬뽕 섞으면 아무 맛도 안 난다 했다. 보수 본색이라고 하지 않았느냐”고 반박했다. 
이날 오후 서울 마포구 <채널에이(A)> 스튜디오에서 열린 4인 합동토론회에서 두 후보는 한층 치열한 기싸움을 벌였다. 최종 후보를 결정지을 여론조사가 나흘 앞으로 다가온 것을 의식한 듯 두 후보는 중도층에 얼마나 소구력이 있는지, 이후 진행될 ‘제3 지대’와의 2차 단일화에서 승산이 있는지를 두고 공방을 벌였다.
나 후보는 주도권 토론 시간에 오세훈 후보를 향해 “나경원이 (당 최종 후보가) 되면 단일화가 어렵다고 말했던데 어떤 뜻이냐”라고 물었다. 오세훈 후보는 “단일화 자체가 어렵다는 게 아니라, (나 후보로) 안철수 대표를 이기기가 어렵다는 것”이라며 “본인이 짜장면·짬뽕 이야기하면서 ‘보수 본색이다’라고 말씀하셨고, 저는 중도 외연 확장을 (이야기) 했다”고 답했다. 그러자 나 후보는 “누구에게나 의견을 듣고 누구 머리라도 빌릴 자세가 돼 있다. 낡은 이분법적 (주장으로) 묶고 계시는 것, 자제해 주시길 부탁드린다”고 맞섰다. 오세훈 후보는 다시 “수도권 선거에서 이기려면 중도, 스윙보터의 마음을 잡지 않으면 힘들다. 우리 당이 어머니의 리더십으로 따듯하게 어려운 분들까지 보듬는 중도 우파가 돼야 한다는 것이 저의 신념”이라고 부각했다.
두 후보는 제3지대 후보와의 최종 단일화 방안에도 이견을 보였다. 나 후보는 오세훈 후보가 앞선 토론에서 ‘정치적 결단에 의한 단일화’를 거론한 데 대해 “잘못하면 아주 낡은 뒷거래, 정치적 담합, 그들끼리 행복한 단일화로 보일 수 있다”고 우려했다. 오세훈 후보는 이에 “마음을 합해야 단일화할 수 있고, 지지층까지 옮겨오려면 함께 서울시 정부를 운영한다는 확신이 있어야 한다는 취지였다”고 답했다. 
이날 사회자는 공통질문으로 각 후보자에게 서로에 대한 칭찬의 말을 부탁했다. 이 순서에서도 두 후보는 은근한 신경전을 벌였다. 먼저 마이크를 잡은 오세훈 후보는 나 후보를 향해 “우리 당의 보배”라고 추어올린 뒤 “4선 국회의원 하면서 고생을 했고, 작년에 ‘대여 강경투쟁’하면서 정말 고생을 했다. 든든한 동료”라고 했다. ‘강경 보수’ 이미지를 거듭 부각하는 발언으로 읽혔다.
나 후보는 오신환·조은희 후보를 칭찬하는데 주어진 시간 60초 가운데 59초를 사용했다. 본인에게 주어진 시간이 1초밖에 남지 않자 나 후보는 오세훈 후보를 향해 “아이고, 죄송하다”라며 칭찬을 하지 않고 마무리했다. 이날 1000명으로 구성된 토론평가단은 나 후보가 토론을 더 잘했다고 평가했다. ",hankyoreh
487,2021-04-07,오세훈 1번 공약 ‘스피드 주택공급’…정부 정책과 충돌 예고,김영희 김양진 기자 dora@hani.co.kr,"7일 저녁 발표된 <한국방송>(KBS) <문화방송>(MBC) <에스비에스>(SBS) 방송 3사가 참여한 공동예측조사위원회(KEP)의 출구조사 결과 오세훈 국민의힘 서울시장 후보가 박영선 더불어민주당 후보를 크게 앞선 것으로 관측되며, 그의 공약에 관심이 쏠리고 있다. 두차례 서울시장을 지낸 그가 이번 선거에서 ‘첫날부터 능숙하게’를 내걸었던만큼, 공약시행에 ‘속도전’을 벌일 가능성이 있다. 
중앙선거관리위원회 선거정보에 등록된 자료에 따르면, 오 후보의 5대 공약은 △스피드 주택공급 △스피드 교통 △균형발전 서울 △1인가구 안심특별대책본부 설치 △청춘이 밥 먹여준다! 이다. 
특히 주목되는 것은 1번 공약으로 내세운 ‘스피드 주택공급’이다. 그는 ‘1년 내 서울시 도시계획규제 혁파’를 내걸며 서울시 용적률 규제 완화와 한강변아파트 35층이하 규제 등 폐지 등을 구체적으로 제시했다. 기존 재건축 사업의 용적률·층수 제한 등 각종 규제가 풀리고, 신규 재개발·재건축 사업도 신속하게 지정될 가능성이 있다. 당장 도심권 공공개발 등 문재인 정부가 추진해온 정책과 충돌을 일으킬 수 있다. 
오 후보가 10년 만에 시장으로 돌아오면 ‘박원순 서울시’ 지우기 작업이 본격화할 것이라는 예측도 있다. 박 전 시장이 공을 들인 광화문 재구조화 사업은 물론, ‘민주주의위원회’, ‘노동사회위원회’, ‘서울혁신기획관’ 등 박 전 시장이 만든 합의제 기구와 혁신 부서의 운명 또한 가늠하기 어렵다. 다만 남은 시장 임기가 1년3개월에 불과해 속도전에 들어가도 가시적인 변화를 이끌어내긴 어려울 것이라는 전망도 있다. ",hankyoreh
493,2021-04-06,마지막날도 강북 훑은 오세훈…지도부 총출동한 신촌서 ‘청년표 몰이’,김미나 기자 mina@hani.co.kr,"오세훈 국민의힘 서울시장 후보가 6일 서울 광진구 자양사거리에서 유세를 시작했다. 선거운동 기간 내내 비강남 지역 공략에 집중한 오 후보는 이날도 과거 열세지역을 훑으며 막판 표심잡기에 나섰다. 
 오전 8시, 오 후보는 지난해 총선에서 출마했다가 낙선한 이 지역(광진을)에서 출근하는 시민들과 주먹 인사를 하며 아침을 열었다. 오 후보는 “지난해 이맘때 이곳에서 여러분을 뵙고 다 함께 광진구의 발전을 기약하고 싶었는데 뜻대로 되지 않았다. 이제 기회가 오고 있다. 광진구가 그동안 많이 정체돼 있었는데 제가 한번 해보겠다”고 지지를 호소했다. 
 오 후보는 이날도 강북권 9개 구를 돌면서 막판 세몰이에 나섰다. 중랑·노원·강북·성북·종로·은평·서대문구 등 전통적으로 민주당 지지 성향이 강한 곳이다. 오 후보는 강북구 수유사거리, 성북구 정릉 등에선 골목을 누비는 ‘순회 유세’도 했다. 
 오 후보는 선거운동 기간 전통적 지지기반이던 동남권 지역보다 비강남 지역에 더 큰 공을 들였다. 지난달 25일 첫 선거운동을 성동구 군자차량기지에서 시작한 뒤 은평·서대문·중·동대문·중랑구를 거치는 ‘브이(V)자 동선’을 그리며 ‘강남·북 격차 해소’ ‘강북 지역 개발’ 등을 강조했고, 선거운동 마지막 날에도 이 경로를 돌며 약세 지역에서 ‘산토끼’ 잡기에 힘을 쏟았다. 그가 지난 2주간 가장 자주 찾은 지역은 강북·광진·종로구(각 4회씩)였다. 김종인 비상대책위원장은 이날 강남·서초·용산구에서 별도의 유세를 하며 ‘집토끼 단속’에 주력했다. 
 국민의힘은 마지막 날 유세의 열쇳말로 ‘청년’을 택했다. 오 후보는 이날 자양사거리 유세 뒤 기자들과 만나 “현장에서 느껴지는 청년들의 지지와 성원이 시간이 흐를수록 더 강해지는 걸 느낀다. 그분들의 지지와 성원이 저에겐 두렵고 무겁게 느껴진다. 정말 일을 잘해서 보답해야겠다는 각오를 다지고 있다”고 말했다. 노원구 상계백병원사거리 유세에서는 “청년들이 눈뜨기 시작했다. 분노하기 시작했다. 결코 국민의힘을 좋아해서도 아니고 저 오세훈이 잘나서도 아니다”라며 “한번 기회를 줘보겠다는 것이다. 대한민국 심장 서울이 다시 뛸 수 있도록 열심히 뼈가 가루가 되도록 뛰겠다”고 강조했다. 
 지도부까지 나선 지원유세의 종착점으로도 젊음의 상징인 서대문구 신촌을 택했다. 이번 선거의 승패가 ‘분노하는 2030 세대가 얼마나 투표장에 나오는지’에 달려있다고 본 것이다. 신촌역 앞 마지막 유세에는 김 위원장과 나경원·유승민 전 의원, 주호영 원내대표 등 당 지도부가 총출동했다. 야권 단일화를 통해 출마를 접은 안철수 국민의당 대표도 오 후보와 함께 손을 맞잡고 힘을 보탰다. 오 후보는 “2030 청년이 지지연설하는 날이 올 수 있다는 건 상상도 못했던 일”이라며 “이 무거운 책임감으로 내일 반드시 당선돼 여러분께 보답드리겠다”고 했다.
 오 후보의 마지막 일정 장소는 밤 9시 중구 남평화상가였다. 패션 전문 도매시장인 이곳은 한때 ‘동대문 패션 메카’로 불렸지만 코로나19 직격탄을 맞아 매출이 반 토막 난 곳이다. 오 후보는 “시민이 잠들 무렵부터 하루 일과가 시작되는 현장을 찾아 시민들을 뵙는다는 의미”라며 “구석구석 민생을 살뜰히 돌보며 어렵고 힘든 분들 말씀부터 귀담아 새기는 시장이 되겠다”고 했다. ",hankyoreh
498,2021-03-16,"오세훈, ‘내곡동 투기 의혹’에 “양심선언 나오면 바로 사퇴하겠다”",김미나 기자 mina@hani.co.kr,"야권의 서울시장 후보 단일화 여론조사를 하루 앞두고 극적으로 성사된 텔레비전(TV) 토론회에서 오세훈 국민의힘 후보와 안철수 국민의당 후보는 10년 전 무상급식, 내곡동 투기 의혹, 범야권 정계 개편을 두고 맞붙었다.
안 후보는 자유토론 시간 초반 오 후보에게 제기된 내곡동 땅 투기 의혹을 집중적으로 파고들었다. 그러자 오 후보는 “제가 이 지역 보금자리지구 지정에 관여했다면 바로 후보를 사퇴하겠다”고 배수진을 쳤다. 그러면서 “보금자리지구 지정에 관여하는 지시를 받았거나 압력받은 걸 경험한 서울시 직원과 엘에이치 직원이 있다면 양심선언 해달라. 한 분이라도 제가 관심을 표하거나 압력이 있었다는 분이 있다면 바로 후보를 사퇴하겠다”고 거듭 강조했다. 안 후보가 “시세보다 낮게 매각했다고 했지만 36억원을 번 건 사실 아니냐”고 캐묻자, 오 후보는 “평당 270만원 정도 보상을 받았는데 당시 주변 시세는 평당 300만원이 넘었다. 그렇게 말씀하시면 섭섭하다”고 반발하기도 했다.
안 후보는 무상급식 주민투표 뒤 오 후보의 서울시장 사퇴 전력을 두고 공세도 폈다. 안 후보는 “커가는 아이들이 차별받는 것은 심리적으로 큰 타격을 주기 때문에 아이들에 대해서는 보편적 복지를 하는 게 원칙이라 생각한다. 아직도 무상급식을 반대하냐”고 물었다. 오 후보는 이에 대해 “무상급식 반대가 아닌 ‘부자 무상급식’ 반대였다. 큰 틀에서 모든 복지는 부자를 위한 복지보다 어려운 계층에 가야 한다는 게 제 원칙”이라고 응수했다.
상대의 리더십을 두고도 공방을 벌였다. 오 후보가 먼저 “(안 후보는) 축소지향적 리더십을 펼치고 있는 것 아니냐. 새정치민주연합, 국민의당, 바른미래당 등을 거치며 의석수가 점점 줄어드는데 어떻게 더 큰 야권을 만드는 것이 가능한가”라고 지적하자, 안 후보는 “그런 경험이 많아서 오히려 저는 사람들을 많이 모을 수 있다고 생각한다”고 답했다. 오 후보는 “과거 윤석열 검찰총장을 영입하려고 접촉했다는 것을 여러번 말했는데, 그건 도리가 아니다. ‘실패한 소개팅’ 얘기하면 (상대가) 싫어하지 않느냐”고 꼬집었다. 안 후보는 “(윤 전 총장은) 정권교체를 열망하는 많은 야권 유권자들이 마음을 모으는 댐 같은 역할을 하고 계신다”고 치켜세운 뒤 “그분 결심에 달린 것이지만 야권 정권교체에 도움이 되는 역할을 꼭 좀 해주셨으면 좋겠다. 간절함을 담아서 그렇게 말씀을 드린 것”이라고 말했다.",hankyoreh
527,2021-02-21,"“너는 강경보수, 나는 중도”…오세훈·나경원의 마지막 1주일",오연서 기자 loveletter@hani.co.kr,"다음달 4일 시작되는 국민의힘 서울시장 후보 최종 경선을 앞두고, 예비후보들 사이에 중도층 확보 경쟁이 뜨겁다. 당원투표가 아닌 일반시민 여론조사만으로 후보를 결정하는 만큼, 보수적인 전통 지지층 뿐 아니라 여야를 넘나드는 중도 성향 유권자를 누가 잡느냐가 승부의 관건이기 때문이다. 이번주 본격화될 토론회에서 후보들은 ‘중도 확장성’이 누가 높은 후보인지를 두고 공방을 벌여나갈 것으로 보인다.


가장 견제가 치열한 후보는 ‘양강’을 형성한 나경원·오세훈 후보다. 상대를 ‘강경보수’로 지목하면서 자신이야말로 중도층 지지를 얻을 최적의 후보 임을 강조한다. 오 후보는 지난 18일 <주간동아>와의 인터뷰에서 “나 후보는 강경보수를 표방한다. 그러나 국민은 강경보수의 등장을 기다리지 않는다”고 선공을 했다. 나 후보도 가만 있지 않았다. 그는 페이스북에 “오 후보는 무상급식을 반대하면서 시장직까지 걸었다. 시장직 사퇴라는 초유의 ‘강대강’ 대결 정치를 보였다”며 “이런 극단적인 선택을 보여준 오 후보야말로 전형적인 ‘강경보수'가 아닌가”라고 맞불을 놨다.
나 후보의 ‘강성 보수’ 이미지를 겨냥한 공격은 다른 후보들과의 토론회에서도 이어졌다. 오신환 후보는 나 후보에게 “(나 후보는) 정치적으로 가장 오른쪽에 있다. 그런데 이번 선거에서 중원의 싸움이 중요하다. 강경보수 깃발을 들고 승리하지 못 한다는 것을 아느냐”고 날을 세웠다. 나 후보는 “정치학회에서 조사하는 걸 보면 제가 오히려 우리 당에서 중간에 가까운 성향”이라며 응수했다. 
나 후보의 ‘강경 보수’ 이미지는 지난 2019년 국회 ‘패스트트랙 충돌 사태’ 당시 자유한국당 원내대표로 대여공세에 앞장서면서 국민들 사이에 각인된 측면이 크다. 이런 사실을 의식한 탓인지 중도층 설득에 가장 적극적인 것도 나 후보다. 그는 지난 14일 서울시장에 무소속 출마한 금태섭 전 의원을 만나 ‘자유주의 상식 연합’을 제안했다. 최근 <한국방송> 라디오 ‘최경영의 최강시사’에 출연해서는 “저는 노무현 정부 때 일한 진대제 전 정보통신부 장관을 캠프의 고문으로 영입했다. 더불어민주당 쪽에서 총리와 서울시장을 한 고건 전 총리도 제게 꼭 당선이 되라고 격려했다”고 강조하기도 했다. 나 후보 쪽은 <한겨레>와의 통화에서 “강경보수라는 공격은 충분히 예상했던 일이다. 이번주 토론회에서 후보의 철학이나 공약을 통해 충분히 반박하겠다”고 말했다. 


오세훈 후보가 최근 ‘시민 여론조사 1등’을 부쩍 강조하는 것도 중도층 공략을 위한 계산된 행보다. 실제 오 후보는 ‘당원 20%, 시민여론조사 80%’로 치러진 지난 예비경선 때 시민 여론조사에서 1위를 한 것으로 전해진다. 오 후보는 지난 10일 국회 소통관에서 사회복지 관련 공약 발표를 마친 뒤 기자들과 만나 “지난번 (예비경선 여론조사) 결과를 보면 제가 1위 아닌가. 다음(본경선)에는 당원투표가 없다”며 자신의 본경선 승리를 자신했다. 오 후보 캠프 관계자는 “지금까지 내놓은 공약들은 모두 부동산 문제, 코로나19로 인한 경제적 어려움, 경제 성장 등 시민 실생활에 초점을 맞췄다”며 처음부터 중도층을 겨냥한 확장전략에 집중해왔음을 강조했다. 
국민의힘 예비후보들의 중도 표심 확보경쟁은 선거기간 내내 치열할 것으로 보인다. 본경선에서 승리해 국민의힘 단독 후보로 출마하더라도 제3지대 후보와의 단일화 절차가 기다리고 있기 때문이다. 중도층을 넉넉하게 흡수하지 못한다면, 단일화 경선 승리를 장담하기 어렵다. 
이번주 본경선 토론회는 23일 열리는 3차 맞수토론(오신환-조은희, 나경원-오세훈)을 시작으로 세 차례 열린다. 26일과 다음달 1일에는 4인 합동토론회가 열린다. 토론회가 마무리되면 3월 2~3일 여론조사를 거쳐 4일 최종 후보를 확정 발표한다.
본경선을 1주일 앞둔 이날 나 후보는 서울 노원어린이도서관에서 학부모들을 만나 자치구별 학력격차 해소를 골자로 하는 교육 공약을 발표했다. 오세훈 후보는 서울 서대문구 이화여대 앞 ‘스타트업 거리’를 찾아 청년 창업자들을 만났다.",hankyoreh
