,date,title,reporter,content,press
1205,2021-03-24,‘내곡동땅 의혹’ 논란 자초한 오세훈의 불충분한 해명들,노현웅 기자 goloke@hani.co.kr,"국민의힘 소속 오세훈 후보가 23일 서울시장 보궐선거 야권 단일후보로 결정되면서, 더불어민주당의 ‘내곡동 투기 의혹’에 대한 공세가 더욱 거세지는 모습이다. 민주당은 단일화 컨벤션 효과로 고공행진 중인 오 후보의 지지율을 끌어내리기 위해 검증의 고삐를 단단히 죄겠다는 태세다.


‘내곡동 투기 논란’은 한명숙 전 국무총리와 오 후보가 맞붙었던 2010년 6·2 지방선거 때도 논란이 됐던 사안이다. 당시 민주당은 오 후보의 아내와 처가 쪽 친인척이 소유한 토지가 오 시장 재임 기간 중 그린벨트에서 해제돼 50억여원의 보상금을 받게 됐다고 특혜 의혹을 제기했다. 선거가 막을 내린 뒤 흐지부지 마무리됐던 의혹은 10여년 만에 다시 논란의 중심에 섰다. 
천준호 민주당 의원은 지난 9일 기자회견을 열고 서울도시주택공사(SH)로부터 받은 자료를 근거로 제시하며 “오 후보가 서울시장으로 재직했던 2009년 8월 서울시는 국토해양부에 내곡동을 보금자리주택지구로 지정해달라고 요청했고, 같은 해 10월 오 후보 가족과 처가가 소유한 약 1300평의 땅이 포함된 이 지역이 보금자리주택지구로 지정됐다”고 ‘셀프 보상’ 의혹을 제기했다. 오 후보 쪽이 2010~2011년 이 땅에 대한 보상금으로 36억5천만원을 받았다는 사실이 확인된 것이다.


논란을 키운 건 오세훈 후보의 초기 해명이었다. 오세훈 후보 쪽은 “처가가 조상 때부터 갖고 있던 땅으로 1970년에 장인이 돌아가시면서 초등학교 4학년인 부인이 공동상속을 받은 것”이라며 “강제 수용돼 주변 시세(평당 317만원)보다 낮은 평당 270만원으로 보상을 받았는데 이것이 무슨 투기냐”고 반발했다. 내부 정보를 활용해 개발 예정지 인근 땅을 매입한 뒤 차익을 노리는 전형적인 땅 투기와는 거리가 멀다는 뜻이었다. 또 공동상속 받은 땅이어서 부인의 지분은 8분의 1에 불과하다고도 밝혔다. 
그러면서 오 후보는 “내곡동 땅에 대해 전혀 알지 못한다”고 말했다. 그러나 민주당이 2000년과 2008년 국회의원과 서울시장 신분으로 등록한 오 후보의 공직자 재산신고 서류를 공개하면서 해명의 신뢰성이 흔들리기 시작했다. 당시 재산신고에 내곡동 땅이 등재돼 있어 존재를 몰랐다는 설명은 성립하지 않는다는 것이다.
이에 오 후보는 지난 16일 후보 단일화를 위한 토론회에서 “보통 처가에 어떤 땅이 어디에 있는지 기억하는 분이 많으신가. 당시에 저는 내곡동에 처가의 땅이 있었다는 사실 자체를 의식하지 못했다”고 말했다. 기계적으로 재산 등록을 했을 뿐 보금자리주택지구 지정과 보상금 등과 연관돼 생각해보지 못했다는 취지다.


내곡동 토지의 보금자리주택지구 지정이 노무현 정부 당시 이뤄졌다는 오세훈 후보의 초기 해명도 논란이 됐다. 당초 오 후보는 내곡동 땅이 2006년 3월 국민임대주택 사업부지로 지정됐고, 2009년 이명박 정부 때 보금자리주택으로 이름만 바뀌었다고 해명했다. 결과적으로 본인이 서울시장으로 취임한 시점(2006년 7월)에는 이미 지구 지정이 완료됐다는 취지다.
그러나 참여정부 당시 내곡동 일대가 택지개발 예정지로 확정됐다는 해명 역시 사실과 다르다. 보금자리주택지구 지정이 완료된 시점은 이명박 대통령이 취임한 뒤인 2009년으로 확인됐다. 민주당이 공개한 에스에이치 공문 등을 보면, 서초구와 지역 주민·환경부 등의 반대로 사업이 상당 기간 표류한 것으로 나타났다. 
이에 오 후보는 다시 한번 자신의 해명을 수정했다. 오 후보는 “공문서를 확인하지 못한 상태여서 착오가 있었다”며 내곡동 땅이 국민임대주택지구로 지정된 때가 노무현정부 시절이었다고 밝힌 것은 사실과 다르다고 시인했다. 하지만 오 후보는 처가 땅을 위한 특혜가 이뤄진 것은 아니라고 거듭 반박하며 자신은 “당시 이 땅의 존재와 위치를 알지 못했고, 지금도 위치를 모른다”고 주장했다.


현재 두 당이 첨예하게 맞붙고 있는 쟁점은 보금자리주택과 관련해 오 후보가 보고를 받은 사실이 있느냐에 쏠려있다. 오 후보가 “서울시는 요식적인 행정 절차만 밟았고, 그것도 주택국장 전결 사항이어서 시장은 알 수가 없었다. 만약 서울시장으로서 외압을 행사한 양심선언이 나오면 후보직을 사퇴하겠다”고 말하자, 또 다시 진실 공방이 벌어진 것이다.
민주당은 오 후보의 해명에 반하는 정황을 차례로 공개하고 있다. 민주당은 먼저 주택지구의 지정·변경에 지자체장의 의견을 듣도록 규정하고 있는 보금자리사업법 시행령의 규정을 근거로 오 후보가 몰랐을리 없다고 주장하고 있다. 민주당은 이날 2009년 10월16일 당시 서울시의회 회의록을 공개하기도 했다. 회의록에는 당시 서울시 주택국장이 오 시장이 “앞으로 그린벨트를 해제하는 데는 성냥갑 아파트를 배제하고, 환경친화적인 주거단지를 만들자”는 취지로 말했다고 전하는 내용이 담겨있다.


그러나 이런 간접 정황 만으로 오 후보가 당시 지구 지정과 그린벨트 해제에 직접 관여했다고 단정하기는 어려워 보인다. 오 후보 캠프는 지난 22일 성명서를 내어 “서울 내곡지구 개발제한구역을 국민임대주택 단지로 추진하기 위해 노무현 정부가 심의·의결한 문건이 입수됐다”며 노무현 정부 때인 2007년 3월 중앙도시계획위원회 제2분과위가 서울 서초구 내곡동·신원동·염곡동·원지동 일원 74만 제곱킬로미터의 개발제한 구역을 택지개발사업으로 조성하는 ‘개발제한구역내 국민임대주택단지 국책사업인정안’을 심의·의결한 자료를 공개했다. 
그는 “(중앙도시계획위원회 회의) 20일 뒤인 4월10일 예정지구 제안서가 제출돼 주민 재공람 및 관련기관 재협의, 환경부 사전환경성 검토 협의가 추진됐다”며 “다음해 국민임대주택법(국민임대주택 건설 등에 관한 특별조치법)이 보금자리주택법(보금자리주택 건설 등에 관한 특별법)으로 모법이 바뀜에 따라 변경에 따른 양식에 맞춰 당연히 밟아야 할 행정절차가 이행됐다는 것이 진실”이라고 밝혔다. 즉, 참여정부 때 임대주택지구로 확정된 것은 아니었지만 ‘사실상’ 사업지구로 정해졌고, 이후 이명박 정부 들어 국민임대주택이 보금자리주택으로 명칭이 바뀌면서 중앙정부가 사업을 이어갔다는 것이다.",hankyoreh
1208,2021-03-18,오세훈-안철수 ‘단일화 협상’ 오후에도 결렬…각자 후보 등록,장나래 기자 wing@hani.co.kr,"국민의힘과 국민의당이 18일에도 4·7 서울시장 보궐선거 단일화 협상에서 접점을 찾지 못해 후보 등록 마감일(19일)까지 단일후보를 내는데 실패했다. 오세훈 국민의힘 후보와 안철수 국민의당 후보는 따로 후보 등록을 한 뒤 투표용지 인쇄 시작일(29일) 전까지 단일화를 목표로 협상 줄다리기를 이어갈 것으로 보인다. 
국민의당 실무협상단장인 이태규 사무총장은 이날 오후 국민의힘 실무협상단장인 정양석 사무총장과 만난 뒤 기자들에게 “물리적으로 여론조사를 하기에는 촉박하다는 점과 오세훈 후보의 제안과 별개로 유선(전화조사) 포함 여부에 대한 이견이 좁혀지지 않아 시간을 더 갖고 추가 논의하기로 했다”고 밝혔다. 
두 당 실무협상단은 여론조사 업체 한 곳은 서울시장 후보 적합도를, 다른 한 곳은 여당 후보를 상대로 한 경쟁력를 각각 조사하자는 데엔 합의했다. 하지만 ‘유선전화 10% 조사’ 포함을 두고 또다시 이견을 좁히지 못했다. 안 후보 쪽은 무선전화 100% 여론조사를, 오 후보 쪽은 유선전화 10% 조사를 반영한 여론조사를 요구했다. 국민의힘은 집에 유선전화만 있는 유권자가 조사에서 배제되면 안 된다고 주장했지만, 국민의당은 무선전화를 통한 여론조사만으로 자체 경선을 치러온 국민의힘이 무리한 요구를 하고 있다며 맞섰다. 
이날 오전 협상이 결렬됐던 두 당은 안 후보가 “저는 오세훈 후보가 오늘 아침에 수정 제안한 여론조사 방식을 수용하고자 한다”는 입장문을 내고, 오 후보가 “조속히 협상을 재개해 세부방안을 마련해주기 바란다”고 밝히면서 오후 2시부터 협상을 다시 시작했다. 그러나 또다시 ‘유선전화 10% 포함’ 문제로 15분 만에 협상이 결렬됐다. 이 때문에 이틀간 여론조사(17~18일)를 거쳐 단일 후보를 19일에 확정하겠다던 후보자 간 합의 이행도 무산됐다. ",hankyoreh
1220,2021-04-08,"10년 만에 돌아온 오세훈, 도심개발로 ‘박원순표 지우기’ 예고",김미나 김양진 기자 mina@hani.co.kr,"서울은 10년 만에 다시 ‘오세훈 시장’을 선택했다. 선거전 내내 오세훈(60) 국민의힘 서울시장 후보의 ‘내곡동 땅’을 놓고 ‘거짓말’ 논란이 끊이지 않았지만, 인물보다는 ‘정권심판’의 바람이 거세게 불어닥친 결과다.
오 후보는 지난 1월 안철수 국민의당 대표의 입당을 요구하는 ‘조건부 출마’로 논란을 일으키며 선거 레이스에 뛰어들었다. 당내 경선에서 ‘중도층 지지’를 등에 업고 승리한 뒤, 안 대표와의 경선에서도 막판 역전극을 벌이며 야권 단일후보가 됐다. 본선에선 한국토지주택공사(LH) 투기 의혹 등 부동산 정책에 대한 분노로 민심이 요동치면서 승기를 잡았다. 재선 서울시장 경력을 내세우며 “첫날부터 능숙하게 해내겠다”고 강조했다.
오 후보의 ‘내곡동 셀프 보상 의혹’과 ‘거짓말 논란’은 선거운동 기간 내내 발목을 잡았다. 해명 과정에선 오 후보가 2005년 내곡동 땅 측량 현장에 입회했는지를 놓고 논란이 확대됐다. 측량을 마친 뒤 오 후보 일행이 생태탕을 먹었다는 내곡동 식당 주인의 구체적 진술까지 공개되면서 선거 막판엔 ‘생태탕 공방’이 이어졌다.
그럼에도 오 후보는 7일 저녁 발표된 출구 예측조사에서 압도적인 차이로 박영선 더불어민주당 후보를 앞섰다. 서초·강남·송파가 있는 강남동권역에서 67.2%를 차지해 박 후보(30.5%)를 2배 이상 앞설 것으로 예상됐고, 민주당 텃밭인 남서권(강서·양천·영등포·동작·구로·금천·관악)에서도 56.9%를 받아 박 후보(40%)를 16.9%포인트 차이로 따돌렸다. 연령별로 볼 때 40대를 제외한 모든 연령층에서 박 후보와 17%포인트 이상 차이를 벌렸다. 특히 20대 남성의 72.5%가 오 후보에게 전폭적 지지를 보냈다.
개표 결과는 달라질 수 있으나 20%포인트에 가까운 격차로 승리가 예상되는 모습에선 2006년 오 후보의 첫 시장 당선 때가 겹쳐진다. 2006년 4회 지방선거 당시 한나라당 후보로 출마한 오 후보는 득표율 61.05%를 기록해 강금실 열린우리당 후보(27.31%)를 33.74%포인트 차이로 압승했다.
이후 오 후보는 2010년 5회 지방선거에서 서울시장 재선에 성공했지만, 2011년 8월 무상급식 주민투표가 무산된 책임을 지고 시장직에서 스스로 물러났다. 2016년 20대 총선, 2019년 자유한국당(국민의힘 전신) 전당대회, 지난해 21대 총선에 잇따라 출마했으나 번번이 고배를 마시며 정치 생명이 끝났다는 평가도 나왔다.
하지만 10년 만의 기사회생으로 당내 입지를 공고히 한 것은 물론, 차기 또는 차차기 대선 주자로도 급부상하게 됐다. 국민의힘은 박근혜 탄핵 정국 이후 처음으로 주요 선거에서 승리하는 성과를 거두면서 대선을 1년 앞두고 정권 교체의 교두보를 마련하게 됐다. 이후 야권 재편 또한 시민들의 강력한 지지를 등에 업은 국민의힘이 주도권을 잡게 될 가능성이 크다.
오 후보가 10년 만에 시장으로 돌아오면 ‘박원순 서울시’ 지우기 작업이 본격화할 것으로 보인다. 오 시장은 규제 완화를 통한 ‘스피드 주택공급’을 1번 공약으로 내세웠다. 기존 재건축 사업의 용적률·층수 제한 등 각종 규제가 풀리고, 신규 재개발·재건축 사업도 신속하게 지정될 가능성이 있다.
박 전 시장이 공을 들인 광화문 재구조화 사업은 물론, ‘민주주의위원회’, ‘노동사회위원회’, ‘서울혁신기획관’ 등 박 전 시장이 만든 합의제 기구와 혁신 부서 또한 앞날을 가늠하기 어렵다. 
그러나 남은 시장 임기가 1년3개월에 불과해 속도전에 들어가도 가시적인 변화를 이끌어내긴 어려울 것이라는 전망도 있다. 민주당 절대 우세인 서울시의회 구성도 국민의힘 소속 시장에게 불리하다. 현재 서울시의회 109명 중 101명이 민주당 소속이다. ",hankyoreh
1225,2021-03-09,11년 전 내곡동 땅 투기 의혹에…오세훈 “곰탕 흑색선전”,서영지 기자 yj@hani.co.kr,"더불어민주당이 국민의힘 오세훈 서울시장 후보가 서울시장으로 재직하던 2009년 가족과 처가가 소유한 내곡동 땅이 보금자리주택지구로 지정되는 데 관여했다는 의혹을 9일 제기했다. 오 후보 쪽은 한국토지주택공사(LH) 직원들의 투기 의혹으로 여권이 궁지에 몰리자 10여년 전 이미 해명이 끝난 논란을 다시 꺼냈다며 비판했다. 
민주당 박영선 선거 캠프 비서실장인 천준호 의원은 이날 소통관에서 기자회견을 열고 “오 후보가 서울시장으로 재직했던 2009년 8월 서울시가 국토해양부에 내곡동을 보금자리주택지구로 지정해달라고 요청했다”며 “국토부는 관계기관 검토를 거쳐 2009년 10월 당시 오 시장의 가족과 처가가 소유한 4443㎡(약 1344평)의 땅이 대거 포함된 내곡동을 보금자리주택지구로 지정했다”고 밝혔다. 엘에이치가 제출한 자료에 따르면, 오 후보 가족과 처가는 2010~2011년 개발제한구역 땅을 넘기는 대가로 36억5천여만원을 보상금으로 받았다. 천 의원은 “내곡동이 보금자리주택지구로 지정되기전 2008년 1월에서 2009년 6월까지 인근 땅의 토지거래가는 평균 100만원 내외다. 이것을 감안할 때 오 후보 일가는 소유 땅을 전년도 대비 적게는 2배, 많게는 3개 비싸게 엘에이치에 넘긴 것”이라며 “정황상 오 후보가 당시 처분이 쉽지 않은 가족의 상속토지를 자신의 권한을 이용해 엘에이치에 넘긴 것 아닐까 하는 합리적인 의심을 해볼 수 있는 상황”이라고 말했다. 
그러자 오 후보는 이날 기자들과 만나 “10년 전 제가 재선 서울시장 당선될 시점에 나왔던 흑색선전을 똑같은 내용으로 다시 한번 우려먹는 곰탕 흑색선전”이라고 지적했다. 그는 이날 페이스북을 통해 “정책선거를 자유당 말기 흑색선거 수준으로 치르려는 박영선 후보의 행태를 보니 정말 다급해진 모양”이라며 “10년 전에 한명숙 후보가 문제를 제기했다가 망신당한 소재를 다시 꺼낼 정도로 자신이 없는가”라며 10년 전의 해명자료를 그대로 올렸다. 이 해명자료에는 “해당 토지는 시장 취임하기 전인 2006년 3월 국민임대주택예정지구에 편입됐고, 2009년 법 개정에 따라 보금자리주택지구로 편입된 것”이라며 “보금자리주택지구지정의 경우, 그린벨트 해제와 지구지정 결정권한은 서울시가 아닌 국토부에 있다”고 돼 있다. 
이를 놓고 민주당 내부에서도 우려가 나온다. 수도권 한 중진 의원은 “엘에이치 문제가 선거에 악재가 된다고 해서 이미 정리된 문제를 다시 꺼내 들면 부메랑이 돼서 돌아올 뿐이다. 지금 우리가 해야 할 일은 엘에이치 문제를 철저하게 조사하는 일에 집중하는 것”이라고 말했다. 
정부는 전날 한국토지주택공사(LH) 직원들의 3기 신도시 건설 예정지 투기 의혹과 관련해 박근혜 정부 때까지 조사를 확대하겠다고 발표하기도 했다. 이를 두고 국민의힘은 “전형적인 물타기”라고 비판했다. 류성걸 의원은 이날 국회에서 열린 원내대책회의에서 “부동산 정책 실패를 전 정권 탓으로 돌리다가, 이번 땅 투기 의혹도 전 정부의 탓으로 돌리는 듯한 상황”이라며 “정말 한 치도 예측에서 벗어나지 않는 물타기 중 물타기”라고 말했다. ",hankyoreh
1234,2021-03-23,울먹인 오세훈 “지난 10년 무거운 마음으로 살아…빚 갚겠다”,오연서 기자 loveletter@hani.co.kr,"4·7 서울시장 보궐선거 야권 단일 후보로 결정된 오세훈 국민의힘 후보는 23일 “분노와 절망 속에서도 희망을 선택해준 여러분의 맘을 겸허히 받들겠다며” 떨리는 목소리로 소감을 밝혔다. 박영선 더불어민주당 후보와의 양자 대결을 앞둔 그는 박 후보를 향해 “괴벨스식 선전선동을 멈추라”며 ‘명예로운 선거전’을 펼치자고 했다. 오 후보는 회견 도중 감정이 북받친 듯 두 차례나 울먹이는 모습을 보이기도 했다.
이날 오전 국민의힘·국민의당 야권 단일화 실무협상단이 22일 하루 동안 이뤄진 여론조사 결과 오 후보가 야권 단일후보로 선정됐다고 밝힌 직후 오 후보는 국회에서 기자회견을 열어 “스스로 담금질하면서 시민 여러분께 진 마음의 빚을 일로써 갚을 수 있는 날을 고대해왔다”고 밝혔다. 그러면서 서울시장 재임 시절인 2011년 무상급식 주민투표를 추진했다 사퇴했던 과거를 회상하며 “지난 10년을 무거운 심정으로 살았다. 가슴 한켠에 자리한 무거운 돌덩이를 이제 조금은 걷어내고 다시 뛰는 서울시로 보답할 수 있도록 마지막까지 성원해달라. 분노와 절망 속에서도 희망을 선택해준 여러분의 맘을 겸허히 받들겠다”고 말했다. 
단일화 경쟁을 함께 펼쳤던 안철수 국민의당 후보를 향해서는 정권 교체를 위한 필승 의지를 함께 다지자고 했다. 오 후보는 “안철수 후보님께 위로와 감사의 말씀을 드린다. 우리는 단일화 전투에서는 대결했지만 정권 심판의 전쟁에서는 저의 손을 꼭 잡아달라”며 “무능하고 무도한 정권을 심판하는 데 제가 앞장서겠다. 어제까지 어디에 있었는가는 깨끗이 잊기로 하자”고 말했다. 두 후보는 단일화 결과발표 직후 전화통화를 했고, 오 후보가 감사와 위로를 전하자 안 후보가 “(앞으로) 도와주겠다”며 화답했다고 한다. 이들은 이미 단일화 협상 과정에서 단일화 뒤 공동선거대책위원장을 함께 맡고, 후보 간 정책을 공유하는 등 공조를 이어가며 궁극적으로는 서울시를 공동운영자는 데 합의한 바 있다. 
‘내곡동 땅 셀프 보상 의혹’ 등 연일 공세를 이어가는 박영선 민주당 후보를 겨냥해선 “못 먹는 감 찔러나보자는 식의 괴벨스식 선전선동, 진실에는 눈감고 거짓만을 앞세우는 외눈박이 공세에 저는 절대로 굴복하지 않는다. 모든 건 박영선 후보의 선택이다. 그리고 우리도 거기에 상응하는 선거전략으로 임할 수도 있다는 점을 경고한다”고 말했다.",hankyoreh
1244,2021-04-01,"민주 “오세훈, 내곡동 땅 포함 주택계획 직접 발표했다”",서영지 기자 yj@hani.co.kr,"더불어민주당은 오세훈 국민의힘 서울시장 후보가 ‘셀프 보상’ 의혹을 받는 내곡지구를 포함한 주택종합계획을 시장 시절 직접 발표한 사실을 확인했다고 1일 밝혔다. 
김영배 민주당이 의원이 공개한 자료를 보면, 오 후보는 서울시장 시절이던 지난 2011년 6월7일 서울시청에서 기자회견을 열어 ‘2020년 주택종합계획’을 발표했다. 주택종합계획에는 오 후보의 아내와 처가가 소유했던 내곡동 110번지, 106번지 일대가 ‘보금자리 주택지구 신규지정 예정’으로 적혀 있다. 이는 국토교통부가 지난 2009년 12월3일 내곡지구를 보금자리주택지구로 지정한 이후 서울시가 발표한 주택계획이다. 
민주당은 2005년 처가 소유 내곡동 땅 측량 현장에 오 후보가 있었다는 증언이 나왔고, 이 땅이 포함된 서울시 주택종합계획을 시장 시절 직접 발표한 만큼 내곡동 땅을 “모른다”는 해명이 거짓말이라고 주장했다. 그간 오 후보는 “땅의 존재와 위치를 알지 못했고, 지금도 위치를 모른다”며 내곡동땅 ‘셀프보상’ 의혹을 부인해왔다. 또 처가 땅이 보금자리주택지구로 지정되는데 자신이 관여했다는 ‘내부 증언’이 나온다면 “후보직을 사퇴하겠다”고 말하기도 했다. 

",hankyoreh
1271,2021-04-04,"민주 “‘전시행정 표본’ 세빛섬 ‘셀프칭찬’ 오세훈, 뻔뻔함 극치”",노현웅 김미나 기자 goloke@hani.co.kr,"오세훈 국민의힘 후보가 서울시장 재직 시절 만들었던 세빛섬이 선거전 막판 쟁점으로 떠올랐다. 오 후보가 4일 서울 서초구 세빛섬 일대를 방문해 자신의 치적으로 홍보했기 때문이다. 더불어민주당은 “오 후보의 ‘셀프 칭찬’은 뻔뻔함의 극치”라며 강하게 비판했다.
박영선 캠프 대변인을 맡고 있는 박성준 민주당 의원은 이날 논평을 내고 “오늘 오세훈 후보가 안철수 국민의당 대표와 함께 세빛섬 앞을 산책하며, 세빛섬을 자신의 치적으로 자랑하는 어처구니 없는 일이 벌어졌다”며 “세빛섬에 대해 오세훈 후보가 ‘셀프칭찬’을 하다니 뻔뻔함의 극치다. 세빛섬에 대한 올바른 태도는 반성과 사과”라고 오 후보를 공격했다. 박 의원은 △졸속 추진된 세빛섬은 자본잠식 상태에 빠졌고 △추진 과정에 시의회 의결을 무시하고 지방자치법도 어겼으며 △총체적 부실 계약으로 서울주택도시공사(SH) 임직원 등 15명이 징계를 받을 정도였다고 설명하기도 했다. 박 의원은 이런 내용을 담고 있는 서울시의 감사보고서도 이날 함께 공개했다.
세빛섬이 다시 도마에 오른 것은 이날 오 후보가 안철수 국민의당 대표와 손을 맞잡고 한강공원 반포지구를 걸으면서다. 그동안 국민의힘 열세 지역인 강북구를 중심으로 선거운동을 펼쳤던 오 후보는 전날에 이어 이틀째 ‘강남권 다지기’에 나서고 있다. 특히 서울시장 직을 중도에 사퇴했던 오 후보가 재임시절 역점 사업으로 추진했던 세빛섬을 방문한 것은 높은 지지율을 바탕으로 시장 시절의 성과를 재평가 받겠다는 의도로 받아들여졌다.
오 후보는 이날 기자들과 만나 “박원순 전 서울시장이 2년 동안 문을 닫아걸고 시민들의 이용을 제한하는 바람에 적자가 누적되기 시작했다”며 “한강 시민공원과 세빛섬을 만들며 오해도, 비판도 꽤 있었다. 그러나 지금 한강변을 이용하는 산책 인구가 10억명을 훨씬 넘을 것”이라고 말했다.
세빛섬은 그간 사업자 특혜, 안전성 논란 등으로 수년째 제대로 쓰임새를 찾지 못한 전시행정의 대표 사례로 지적돼 왔다. 특히 지난 2013년 대한변호사협회가 예산낭비의 책임을 물으며 오 후보 등을 업무상 배임 혐의로 수사의뢰를 하기도 했다.
앞서 두 후보는 지난달 29일과 30일 이틀 연속 진행된 티브이 토론에서도 세빛섬을 두고 논쟁을 벌였다. 박 후보가 오 후보의 서울시장 재임 시절 실정을 문제 삼으며 “세빛섬도 적자였다”고 지적하자, 오 후보는 “세빛섬은 민간사업”이라고 주장한 것이다. 하지만 서울주택도시공사(SH)는 세빛섬 사업에 128억원을 투자해 사업자인 ㈜플로섬의 지분을 29.9% 가진 2대 주주였다. 서울주택도시공사는 플로섬이 공사비를 마련하기 위해 대출을 받을 때 239억원에 대해 지급보증을 서기도 했다.",hankyoreh
