,Unnamed: 0,press,reporter,title,content,분석결과
0,27,머니투데이,이정혁,"이해찬, 이낙연과 오찬 회동...'정권 재창출' 시동거나 - 머니투데이","이낙연 전 더불어민주당 대표와 이해찬 전 대표. (왼쪽부터) 2020.6.10/뉴스1 (C) News1 신웅수 기자

이해찬 전 더불어민주당 대표와 이낙연 민주당 의원이 최근 만남을 갖고 정권 재창출 방안 등을 논의한 것으로 전해졌다.

30일 정치권에 따르면 이 전 대표와 이 의원은 지난 27일 여의도 63빌딩에서 오찬을 겸한 회동을 가졌다.

이날 만남은 이 전 대표 측의 요청에 따른 것으로, 4·7재보선 참패 관련 당 수습 방안 등을 논의한 것으로 알려졌다. 특히 이 의원이 여권 대선주자인 만큼 정권 재창출을 위한 다양한 의견을 교류한 것으로 민주당 안팎에서는 관측하고 있다.

이 의원 측 관계자는 ""두 분이 만난 것은 맞다""며 ""오래 전에 잡힌 일정으로 알고 있다""고 말했다.

이 전 대표는 최근 여러 대권 주자들과는 물론 당권 주자들과도 물밑 스킨십 행보를 보이며 보폭을 넓혀가고 있다. 문재인 대통령의 측근인 양정철 전 민주연구원장도 이 전 대표의 요청에 따라 최근 조기 귀국한 것으로 전해졌다.

4·7재보선 참패 이후 전국을 돌며 바닥 민심을 훑고 있는 이 의원은 5·2 전당대회 이후부터 공식 일정을 소화할 계획이다.",긍정
1,128,머니투데이,김태은,"이재명·이낙연·정세균, 5월 본격 대선 기지개…윤석열도 빨라진다 - 머니투데이","(수원=뉴스1) 조태형 기자 = 이낙연 더불어민주당 당대표 후보(오른쪽)가 30일 오전 경기도 수원시 팔달구 경기도청에서 이재명 경기도지사와 인사를 나누고 있다. 2020.7.30/뉴스1  

내년 3월 대선을 준비하는 잠룡들의 행보가 다음 달부터 본격화된다. 여권 대선주자들은 다음달 2일 지도부 선출을 위한 전당대회가 끝나면 대선을 위한 전국 조직을 가동시키는 등 대선 경쟁에 뛰어들 채비에 들어간다. 올초 검찰총장 사퇴 후 현안에 대한 메시지를 내는 것 외에 별다른 정치 활동을 하지 않았던 윤석열 전 검찰총장도 정치권과는 거리를 두고 있지만 최근 대선을 치른 경험이 있는 정치전문가와 선거 실무진들을 팀으로 꾸리는 등 정치 데뷔를 위한 준비가 빨라졌다는 관측이 나온다.

29일 정치권에 따르면 이재명 경기도지사의 전국 60여 지원단체를 한 데 모으는 플랫폼인 전국조직 '민주평화광장'이  다음달 12일  공식 출범한다.  '5선'의 조정식 더불어민주당 의원이 포럼장을 맡아 진두지휘하기로 한 이 포럼에는 발기인만 1만여명이 참여할 것으로 알려졌다. 

다음달 중에는 이재명계 의원들이 참여하는 '대한민국 성장과 공정 포럼(성공포럼)'도 발족할 예정이어서 이 지사가 사실상 대선 출마를 선언하는 행보로 해석되고 있다. 앞서 전날  경기도 주최로 열린 '2021 대한민국 기본소득 박람회'에서 이 지사의 트레이드마크로 자리잡은 '기본소득' 정책을 대대적으로 홍보했다. 이 자리에서 이 지사는 ""지역화폐형 기본소득이 4차 산업혁명 시대를 대비하는 유일하고도 가장 강력한 경제정책""이라고 평가했다. 

4·7 재보궐 선거 참패 책임을 지고 공개 일정을 삼갔던 이낙연 더불어민주당 전 대표도 다음달 초 열리는 '신복지2030' 광주포럼을 기점으로 공식 행보를 재개하는 동시에 대선 의제 띄우기에 집중한다는 계획이다. 특히 한자릿수대로 추락한 지지율 회복을 위해 분야별 정책을 가다듬고 있다. 이를 통해 집권전략을 선제적으로 제시함으로써 국무총리 출신의 안정감있는 집권여당 대선주자 이미지를 선점하겠다는 구상이다.
(광주=뉴스1) 정다움 기자 = 대권행보에 나선 정세균 전 국무총리가 29일 오후 광주 동구 금남로에서 시민들과 주먹 인사를 나누고 있다.  정 전 총리는 전날부터 광주를 찾아 호남 민심 사로잡기에 들어갔다. 2021.4.29/뉴스1   지난 16일 국무총리직에서 사퇴한 후 대선 도전 의지를 강하게 나타내고 있는 정세균 전 국무총리는 다음달 중 대선 도전을 공식화할 예정이다. 경남 김해와 부산, 대구, 광주 등 지역을 잇따라 방문하며 전국 선거조직 출범을 준비하는 한편 '포스트 코로나' 시대 위기관리 능력과 경제 재건을 위한 전문성을 부각하는 데 주력하겠다는 계획이다.

세대교체를 내세우고 있는 박용진 더불어민주당 의원은 다음달 9일 대선출마를 공식 선언하고 경제, 교육, 병역 등 분야별 공약을 통해 청년세대 등을 집중 공략할 예정이다.

김두관 더불어민주당 의원도 대선 출마를 선언하고 다음달부터 본격적인 행보에 들어간다. 이밖에 임종석 전 대통령비서실장과 양승조 충남도지사 등이 출마 선언을 고민 중이다. 당헌당규에 따르면 6월 예비경선에서 9월 본경선을 치를 6명 후보를 압축해야 한다. 대선 경선 룰 변경이 없는 한 다음달 중엔 여권 잠룡들의 윤곽이 드러나게 된다는 뜻이다.

여권 대선주자들의 행보가 속도를 내게 되면 정치권 바깥에 머물고 있는 윤 전 총장의 움직임 역시 빨라질 것으로 예상된다. 야권 후보일 것이란 추측만으로 차기 대선 지지율 선두를 달리고 있지만 결정의 시간이 머지 않았다는 게 정치권 관측이다.

윤 전 총장은 사퇴 후 공개 활동을 자제하며  대권 준비를 위해 경제, 외교·안보, 노동, 복지 등 다양한 분야에 대한 공부를 하고 있는 것으로 알려졌다. 그동안 정치 활동을 위한 별도의 팀이나 조직을 만들지 않고 정치권 인사들과의 만남도 극도로 자제해 정치 방향에 대한 의구심을 자아내기도 했다. 하지만 이달 중순들어 야권 출신 인사들을 중심으로 전략이나 기획, 여론동향, 메시지 등 실무 중심의 팀을 운영하기 시작한 것으로 전해졌다. 

정치 실무에 전혀 경험이 없는 검찰 출신 변호사 중심으로 실무에 대응해왔던 것과 달리 새로 꾸려진 팀에는 대선 네거티브팀 경력이 있는 인사와 신당 창당 관련 경험이 있는 정치전문가 등이 직간접적으로 연관돼 있는 것으로 알려졌다.

다만 윤 전 총장 측이 어떤 방식과 시기에 정치적 행보를 시작할 지에 대해선 여전히 신중한 입장이다.  최근 국민의힘 내부에서 적폐수사에 대한 사과 요구가 제기되고, 정권교체를 위해 대통합해야 한다는 반론이 나오는 등 윤 전 총장의 정치 행보에 대한 논의가 본격 시작됐다. 이에 따라 국민의힘 지도부 교체 과정을 지켜본 후 윤 전 총장이 움직일 수 있다는 관측도 나온다.
(서울=뉴스1) 신웅수 기자 = 윤석열 전 검찰총장의 부친 윤기중 연세대 명예교수가 2일 오전 서울 서대문구 남가좌1동주민센터에 마련된 사전투표소에서 투표를 하고 있다.  지난달 4일 사퇴 후 별다른 일정 없이 칩거하던 윤 전 총장은 최근 '101세 철학자'로 불리는 김형석 연세대 명예교수를 방문해 조언을 듣고 이철우 연세대 법학전문대학원 교수를 만나는 등 비공식 활동을 이어가며 외부 노출을 자제해왔다. 2021.4.2/뉴스1",긍정
2,152,머니투데이,김지영,'대선 지지율' 이재명 24%·윤석열 23% 양강 유지…이낙연 7% - 머니투데이,"차기 대선후보 적합도 조사에서 이재명 경기도지사와 윤석열 전 검찰총장이 4주 연속 오차범위 내 접전을 보이며 양강 구도를 유지했다. 

엠브레인퍼블릭·케이스탯리서치·코리아리서치·한국리서치 등 4개 여론조사 전문회사가 만 18세 이상 남녀 1001명을 대상으로 지난 26~28일 실시해 29일 발표한 4월 4주차 전국지표조사(NBS)에 따르면 대선후보 적합도에서 이재명 지사는 24%, 윤석열 전 총장은 23%를 기록했다. 이낙연 전 대표 7%로 집계됐고 '태도유보'는 29%다.

지난주 조사와 비교했을 때 이 지사의 지지율은 1%p 하락했고, 윤 전 총장의 지지율은 1%p 상승했다. 두 주자는 지난 3월11일 조사부터 엎치락뒤치락을 반복하며 양강구도를 형성하고 있다. 이 전 대표의 지지율은 4·7재보선 직후인 4월 2주차 조사에서 8%를 기록하며 한 자리수에 접어든 후 1%p 더 떨어졌다.

안철수 국민의당 대표와 홍준표 무소속 의원이 4%로 뒤를 이었다. 정세균 국무총리의 지지율은 3%, 유승민 전 의원 1%, 추미애 전 법무부 장관은 1%를 기록했다. 

대선 출마 의사를 밝힌 박용진 더불어민주당 의원도 이번 조사부터 이름을 올렸지만 지지율은 0%(1%미만)를 기록했다. 

진보진영 대선후보 적합도는 이 지사가 33% 지지율을 얻어 2위인 이 전 대표(10%)를 세 배수 앞섰다. 정세균 국무총리의 지지율은 4%로 였고  '모름' 또는 '무응답' 비율은 43%다.

이 지사는 진보진영 내 연령별조사에서 60대와 70대를 제외한 전 연령층에서 1위를 기록했다. 또한 지역별 조사에서는 광주·전라 지역을 포함한 전 지역에서 모두 지지율 1위를 차지했다.  

보수진영 대선후보 적합도는 윤 전 총장이 26%로 독보적으로 앞서는가운데 안철수 국민의당 대표가 9%로 2위를 차지했다. 홍준표 무소속 의원(8%), 유승민 전 국민의힘 의원(7%) 원희룡 제주도지사(3%), 황교안 전 미래통합당 대표(2%)가 뒤를 이었다.

보수진영 내 이념성향별 조사에서는 윤 전 총장은 전 연령대에서 1위를 차지했다. 윤 전 총장은 지역별 조사에서도 광주·전라 지역을 제외한 모든 지역에서 1위를 차지했다.

이번 조사의 표본 오차는 95% 신뢰수준에서 ±3.1%p다. 자세한 조사개요와 결과는 중앙선거여론조사심의위원회 홈페이지를 참고하면 된다.",긍정
3,196,머니투데이,김지영,"진중권 ""이낙연은 멍청하고 정세균은 매력없어…어차피 이재명"" - 머니투데이","진중권 전 동양대 교수 / 사진= 시사저널 TV 방송화면 캡처

진중권 전 동양대 교수는 4·7재보궐 선거 이후 여권의 변화 움직임에 대해 ""더불어민주당은 시스템상 쇄신은 불가능하다. 이제 완전히 맛이 갔다""고 혹평했다.

진 전 교수는 지난 28일 유튜브 채널 시사저널 TV에 출연해 ""(4·7재보궐선거 결과를 두고)개혁을 더 열심히 하라는 신호라며 오히려 거꾸로 이야기한다""며 이같이 밝혔다. 

이어 ""선거에서 진 건 편파적인 언론과 포털 때문이라고 개혁 드라이브를 걸고 있다""며 검찰개혁은 조국 지키기, 윤석열 �i아내기였고, 언론개혁은 김어준지키기가 될 것""이라고 꼬집었다. 또 ""초선의원들이 초선 5적이라고 진압을 당했다. 그런 상황에서 쇄신이란 건 있을 수 없다""고 했다. 

진 전 교수는 내년 대선을 진두지휘할 민주당의 새 지도부를 선출하는 5·2 전당대회에 대해 ""친문일색""이라며 ""선거 참패에서 책임져야 할 사람들이 물러나야 하는데 그 사람들이 원내대표가 되고 최고위원이 되고 더 높은 곳으로 올라가 버렸다. 쇄신이 아니라 더 강하게 나가겠다는 의미 밖에 안된다""고 지적했다.

민주당 내 유력대선 주자로 꼽히는 이재명 경기도지사, 이낙연 전 민주당 대표, 정세균 전 국무총리 등에 대해서도 부정적인 평가를 내놨다. 
진 전 교수는 이재명 지사에 대해 ""친문, 극렬 당원 지지 없이는 후보가 되기 힘들고 그들과 같이 가면 대선에서 승리할 수 없는 딜레마에 빠졌다. 쉽지 않은 게임이 될 것""이라고 내다봤다. 

이어 이낙연 전 대표에 대해서는 ""이미 보궐선거 참패로 아웃이다. 그때 후보를 내면 안됐다""며 ""올바른 결정을 내리는게 당 대표의 역할인데 오히려 후보 내서 심판받겠다고 했다. 그럼 심판받았으니 그럼 가셔야 한다""고 강조했다.

그러면서 ""정치적 윤리적 전략적으로 올바르지 않았다""며 ""전략적으로도 멍청하다. 이런 사람이 어떻게 대한민국을 이끌어가나""라고 비판했다. 

정세균 전 총리에 대해서는 ""가망이 없다고 본다""며 ""친문한테 절대적 지지 받는 메리트가 없고 이렇다 할 인간적인 매력이 하나도 없다""고 평가했다. 

아울러  ""어차피 이재명으로 가야 하는데 이재명과 (다른 후보를) 어떻게 붙이느냐 동상이몽에 빠져들 있다, 서로 딜레마""라고 했다.",긍정
4,413,머니투데이,변휘|,"윤석열 31.2%, 이재명 24.1% '동반 하락'…이낙연 11.1% - 머니투데이","윤석열 전 검찰총장(왼쪽)과 이재명 경기지사./사진제공=뉴스1

윤석열 전 검찰총장이 '대선후보 지지율 1위'가 계속되고 있다는 여론조사 결과가 26일 나왔다.

한국사회여론연구소(KSOI)가 TBS 의뢰로 지난 23∼24일 전국 성인남녀 1010명에게 차기 대선 후보 적합도를 물어본 결과, 윤 전 총장이 31.2%로 1위를 기록했다.

2위는 24.1%의 응답자가 선택한 이재명 경기지사였다. 두 후보 간 격차는 7.1%포인트(p)로, 오차범위(95% 신뢰수준에 ±3.1%p) 이상이었다. 이낙연 더불어민주당 전 대표는 11.1%로 3위였다.

KSOI의 지난주 조사 결과 대비 윤 전 총장과 이 지사의 지지율은 각각 2.5%p와 3.0%p 하락한 수치다. 이 전 대표는 0.1%p 올랐다.

무소속 홍준표 의원(5.6%), 안철수 국민의당 대표(4.9%), 오세훈 서울시장(4.7%), 정세균 전 국무총리(4.0%), 추미애 전 법무부 장관과 유승민 국민의힘 전 의원(2.5%) 순이었다.

'적합 후보가 없다'는 응답은 4.1%, '잘 모름'은 2.0%였다.

이번 여론조사의 자세한 내용은 중앙선거여론조사심의위원회 홈페이지를 참고하면 된다.",긍정
5,778,머니투데이,김성진,"'처진 이낙연, 변한 안철수'에 호남도 윤석열…국민의힘 가도? - 머니투데이","윤석열 전 검찰총장. 2021.4.2.//사진=이기범 기자 leekb@ 

윤석열 전 검찰총장이 차기 대선주자로 거론된 이래 한 번도 없던 일이 벌어졌다. 지난 19일 공개된 여론조사에서 광주·전라 지역 대선후보 지지율 1위 자리에 이름을 올렸다. '진보 텃밭' 호남이 범야권 후보인 윤 전 총장에 너그러워진 것은 대선을 1년도 남기지 않은 시점에 의미심장한 대목이다. 보수 텃밭 영남은 물론 부친의 고향인 충청에 이어 호남에서도 의미 있는 지지율을 얻으면 '대세론'이 확고해질 수 있다.

윤 전 총장의 호남 지지율이 높아진 건 그동안 호남 맹주였던 이낙연 전 더불어민주당 대표가 고전하고, 중도 표심을 흡수한 안철수 국민의당 대표가 국민의힘과 연대 움직임을 보이며 민심이 이반한 것으로 보인다. 그러나 훗날 국민의힘에 입당하면 호남 민심이 돌아설 수 있다는 점은 앞으로 윤 전 총장의 행보에 고민거리가 될 전망이다.
━뒤처진 이낙연, 변해버린 안철수…지지할 후보를 잃었다━이낙연 전 더불어민주당 대표와 안철수 국민의당 대표./사진=뉴스1리얼미터가 YTN 의뢰로 이달 16일 성인남녀 1011명을 조사한 결과, 윤 전 총장은 이재명 경기도지사·이낙연 전 대표와 가상 양자대결에서 모두 앞섰다. 특히 광주·전라 지역 우세가 눈에 띈다. 광주·전라에서 윤 전 총장은 이 지사와 대결 시 41.4% 대 40.8%, 전남도지사였던 이 전 대표 대결 시 37.5% 대 33.5%로 각각 오차범위(95% 신뢰수준에 ±3.1%p) 내 우위를 보였다.

그간 호남만큼은 여당 후보 지지율이 우세했다. 윤 전 총장이 지난달 4일 검찰총장직에서 사퇴한 직후(3월 6~7일) 리얼미터가 문화일보 의뢰로 성인남녀 1000명을 조사한 결과 윤 전 총장 지지율은 28.3%로 1위였다. 지역별로는 수도권·충청·영남에서 두루 지지율 1위였지만, 광주·전라 지역 지지율은 13.2%로 이 지사(31.8%)와 이 전 대표(24.0%)에 오차범위(95% 신뢰수준에 ±3.1%p) 이상 크게 뒤졌다.(인용된 여론조사의 자세한 내용은 중앙선거여론조사심의위원회 홈페이지 참조.)

그럼에도 호남이 윤 전 총장에 주목한 것은 지지할 후보를 잃었기 때문이다. 재보궐 선거 참패 후 여당은 '지도부 책임론'이 불거졌는데, 이 과정에서 상임선거대책위원장을 맡았던 이 전 대표의 타격이 컸다. 그렇다고 친문 주류와는 거리가 먼 이 지사가 갈 곳 잃은 표심을 온전히 끌어오지는 못했단 평가다. 

호남 중도 표심에 호소했던 안철수 대표가 국민의힘과 손잡은 것도 변수였다. 2017년 대선 당시 안 대표는 광주(30.08%)·전북(23.76%)·전남(30.68%)에서 상당한 득표율을 기록했다. 2016년 총선 때도 새정치민주연합을 나와 국민의당을 창당한 후 호남 의석 28석 중 23석을 얻었다. 그러나 2018년 바른미래당 합류에 이어 재보선 야권 단일화, 국민의힘 합당 논의까지 이어지며 호남 표심도 떠나는 모양새다.
━""국민의힘 입당 시, 호남 지지율 다시 떨어질 것""…윤석열 고민 깊어질까━2021.4.18./사진=정세균 페이스북.호남의 윤 전 총장 선택이 일시적일 것이란 전망도 있다. 최근 눈에 띄는 변수는 정세균 전 국무총리의 여권 '제3 대권주자' 도전이다. 김대중 전 대통령(DJ) 부름을 받아 정치에 입문했으며, 전북 진안 출신으로 지역 기반이 단단하다. 정 전 총리도 사퇴 후 첫 행보로 DJ 일산 사저를 찾았다. 여당 대권경쟁 양상에 따라 정 전 총리 존재감이 커지면, 윤 전 총장에 눈길을 줬던 호남 표심이 옮겨갈 수 있다.

야권 재편 과정에서 윤 전 총장이 국민의힘과 힘을 합칠 수 있는 점도 호남 장악력엔 부정적 변수가 될 수 있다. 세간에서는 윤 전 총장의 호남 지지율 상승세의 이유로 '국민의힘 딱지가 붙지 않아서'를 꼽는다. 여당의 독주는 껄끄럽고, 국민의힘 부활도 마뜩찮은 호남 유권자들로선 윤 전 총장이 대안이 될 수 있다는 것. 그러나 그가 국민의힘 대선주자가 될 경우 호남 민심의 반감은 피할 수 없을 것이란 평가다.

윤 전 총장의 행보에 눈이 쏠린다. 그간 정치권에선 윤 전 총장이 제3지대에서 대권 행보를 개시한 후 국민의힘에 입당하거나 신당 창당, 또는 대선 경선 국면의 합당 가능성이 제기됐다. 최근엔 금태섭 전 더불어민주당 의원이 ""정치할 생각이 있다면 (윤 전 총장이) 들어올 수 있는 정당을 만들어야 한다""며 제3지대 창당 가능성을 내비치기도 했다. 

금 전 의원과 만난 김종인 전 국민의힘 비상대책위원장은 ""제3지대는 없다""고 일축했다. 하지만 금 전 의원은 19일 조선일보 인터뷰에서 ""새로운 틀에 윤 전 총장이 됐건 김 전 비대위원장이 됐건 모일 수 있다고 생각한다""며 창당 의지를 이어갔다. 국민의힘도 입당을 적극 권유하는 모양새다. 주호영 당 대표 권한대행은 9일 KBS라디오 '최강시사' 인터뷰에서 ""대선후보를 뽑는 절차를 시작하기 전에는 결정돼야 하지 않겠느냐""고 했다.",긍정
6,834,머니투데이,김성진,호남서 이재명·이낙연 제친 윤석열…'대세론' 힘 받을까 - 머니투데이,"윤석열 전 검찰총장. 2021.4.2./사진=머니투데이 DB. /사진=이기범 기자 leekb@

윤석열 전 검찰총장이 전통적 '진보 표밭'으로 꼽히는 호남에서도 여당 대선주자들을 제치고 지지율 1위에 오른 것으로 나타났다. 

리얼미터가 YTN 의뢰를 받아 지난 16일 성인남녀 1011명에 조사한 결과, 가상 양자 대결에서 윤 전 총장(51.5%)이 이재명 경기도지사(32.3%)에 18.8%p 차이로 앞섰다(95% 신뢰수준에 오차범위 ±3.1%p).

특히 광주·전라에서도 윤 전 총장의 지지율은 41.4%로, 이 지사(40.8%)보다 많은 지지를 받았다. 

이낙연 전 더불어민주당 대표와 양자 가상 대결에서는 윤 전 총장 지지율이 51.6%로 이 전 대표(30.1%)에 21.5%p 앞섰다.

역시 이 전 대표의 정치 기반인 광주·전라에서도 윤 전 총장 지지율(37.5%)은 이 전 대표(33.5%)보다 오차범위 내 우세였다. 

호남 표심이 윤 전 총장에게 너그러워진 것은 차기 대선을 채 1년도 남지 않은 시점에서 의미심장한 대목이다. 윤 전 총장이 보수 텃밭인 영남은 물론 부친 고향인 충청권에서 주목받은 데 이어 호남에서도 의미있는 지지율을 얻으면 '대세론'이 확고해질 수 있어서다. 

다만 호남 지지세가 두터웠던 이 전 대표가 고전하고, 그 반사 효과를 이 지사가 충분히 흡수하지 못하면서 일시적으로 호남 표심이 갈 곳을 잃은 것이란 평가도 나온다. 전북 출신 정세균 전 국무총리의 여권 '제3 대권주자' 도전도 호남 표심의 변수가 될 수 있다. 

한편 윤 전 총장은 대선 주자들 간 다자구도에서 지지율이 37.2%로 가장 높았다. 그 뒤로는 이재명(21.0%), 이낙연(11.0%), 홍준표(5.9%), 안철수(5.0%), 유시민 3.2%, 추미애 2.4%, 정세균 2.4%, 유승민 2.2%, 심상정 1.7%, 원희룡 1.0%, 임종석 0.7% 순이었다.

여론조사에 관한 자세한 내용은 중앙선거여론조사심의위원회 홈페이지를 참조하면 된다.",긍정
