,Unnamed: 0,press,reporter,title,content,분석결과
7,859,머니투데이,박소연,"윤석열, 이재명·이낙연 누구와 맞붙든 51% 넘는 지지율 - 머니투데이","/사진제공=리얼미터

차기 대권주자 선호 후보에서 '윤석열'이 1위를 기록한 가운데 이재명·이낙연과 양자 가상대결에서도 '윤석열'에게 투표하겠다는 응답 비율이 51%를 넘은 것으로 나타났다. 

19일 YTN '더뉴스' 의뢰로 여론조사 전문기관 리얼미터가 차기 대선주자 선호 후보 등 후보 경쟁력을 조사한 결과, 윤석열이 37.2%로 1위를 기록했고 이재명이 21.0%로 2위를 기록했다. 이어 이낙연 11.0%, 홍준표 5.9%, 안철수 5.0%, 유시민 3.2%, 추미애 2.4%, 정세균 2.4%, 유승민 2.2%, 심상정 1.7%, 원희룡 1.0%, 임종석 0.7% 순이었다. 기타는 1.1% 부동층은 5.3%(없음 2.4%, 잘 모름 2.9%)였다. 

윤석열을 선호하는 응답자는 국민의힘 지지층(68.0%)과 보수성향자(54.6%)에서 많았고, 무당층 내 40.2%, 중도성향자 중 39.4%로 평균과 비슷한 분포를 보였다. 또한 대구/경북(42.1%) 거주자, 60세 이상(51.0%)에서도 평균 대비 윤석열을 차기 대선주자로 선호한다
는 응답이 높은 비율로 집계됐다. 

이재명을 선호하는 응답자는 민주당 지지층 내 45.8% 진보성향자 중 40.2%로 전체 평균 대비 높은 비율로 나타났다. 또 40대에서 35.0%로 다른 연령대 대비 높은 비율을 보였다. 

이낙연을 선호하는 응답은 민주당 지지자 중 26.2%로 전체 평균 대비 높은 비율을 보였다.

윤석열과 이재명의 양자 가상대결에서는 윤석열에게 투표하겠다는 응답이 51.5%로 이재명에게 투표하겠다는 응답(32.3%)보다 많아 18.8%포인트 격차를 보였다. 부동층은 16.6%(없음 11.9%, 잘 모름 4.7%)로 집계됐다.

광주/전라와 충청권을 제외한 모든 지역에서 윤석열에게 투표하겠다는 응답이 높은 비율을 보였다. 광주/전라에서는 '윤석열' 41.4% vs. '이재명' 40.8%로 대등하게 나타났다. 연령대별로 40대에서만 '이재명'에게 투표하겠다는 응답이 절반 정도인 49.9%로 나타났으며, 다른 연령대에서는 '윤석열'에게 투표하겠다는 응답이 절반 정도 혹은 과반으로 나타났다. 

20대에서는 윤석열 응답이 51.6%인 가운데 '없다'라는 응답이 20.4%로 전체 평균 대비 높은 비율을 기록했다. 다자 선호도에서 홍준표를 차기 대선주자로 선호한다는 응답자 중 75.2%는 '윤석열'에게 투표하겠고 응답했다. 반면, 이낙연을 차기 대선주자로 선호한다는 응답자 중에서는 37.3%만이 '이재명'에게 투표하겠다고 응답, 46.9%는 '없다'라고 응답해 주목됐다. 

윤석열에게 투표하겠다는 응답이 보수성향자에서 75.4%, 이재명에게 투표하겠다는 응답이 진보성향자에서 61.3%인 가운데, 중도성향자에서는 '윤석열' 52.4% vs. '이재명' 32.8%로 나타났다.

윤석열과 이낙연의 양자 가상대결에서는 윤석열에게 투표하겠다는 응답이 51.6%로 이낙연에게 투표하겠다는 응답 30.1%과 21.5%포인트 격차를 보였다. 부동층은 18.4%(없음 13.0%, 잘 모름 5.4%)로 나타났다.

광주/전라와 충청권을 제외한 모든 지역에서 윤석열에게 투표하겠다는 응답이 높은 비율을 보였으며, 특히 대구/경북에서는 거주자 10명 중 6명 이상인 66.4%는 윤석열에게 투표하겠다고 응답했다. 광주/전라에서는 '윤석열' 37.5% vs. '이낙연' 33.5%로 대등하게 나타났으며, '없다'라는 응답이 24.9%로 전체 평균 대비 높은 비율을 보였다. 40대를 제외한 모든 연령대에서는 '윤석열'에게 투표하겠다는 응답이 높은 비율을 보였다. 40대에서는 이낙연에게 투표하겠다는 응답이 42.1%인 가운데, '없다'라는 응답이 21.0%로 전체 평균 대비 높은 비율을 보였다. 

다자 선호도에서 홍준표를 차기 대선주자로 선호한다는 응답자 중 83.5%는 '윤석열'에게 투표하겠고 응답했지만, 이재명을 차기 대선주자로 선호한다는 응답자 중 53.7%만이 '이낙연'에게 투표하겠다고 응답하고 31.5%는 '없다'라고 응답해 다른 양상을 보였다. 

윤석열에게 투표하겠다는 응답은 보수성향자에서 77.1%로 전체 평균 대비 많았다. 반면 이낙연에게 투표하겠다는 응답이 진보성향자에서 52.3%였으며, '없다'라는 응답이 19.8%로 전체 평균 대비 높은 비율을 보였다. 중도성향자에서는 '윤석열' 52.2% vs. '이낙연' 32.1%로 평균과 비슷한 분포로 집계됐다.

이번 조사는 지난 16일 전국 만 18세 이상 2만8750명에게 접촉해 최종 1011명이 응답을 완료해 3.5%의 응답률을 나타냈고 무선(90%)·유선(10%) 무작위 생성 표집틀을 통한 임의 전화걸기(RDD) 자동응답 방식으로 실시했다. 통계보정은 2021년 3월 말 행정안전부 주민등록 인구통계 기준 성별, 연령대별, 권역별 가중치 부여 방식으로 이루어졌고, 표본오차는 95% 신뢰수준에서 ±3.1%포인트다. 자세한 조사개요와 결과는 리얼미터 홈페이지 또는 중앙선거여론조사심의위원회 홈페이지를 참조하면 된다.",긍정
8,943,머니투데이,김소영,"[30초 뉴스]이낙연·홍영표 '쪼개기 식사'논란…""우연히 모인 것"" - 머니투데이","이낙연 전 더불어민주당 대표(오른쪽 두번째)와 홍영표 더불어민주당 의원. /사진=뉴스1

1. 쪼개기 식사
더불어민주당 이낙연 전 대표와 홍영표 의원을 향해 '쪼개기 식사' 의혹이 제기된 가운데, 강남구는 방역수칙 위반이 아니라고 결론냈다. 16명이 한 식당에 갔고 식사비용도 한 번에 결제됐지만, 사전에 계획된 일정이 아닌 우연이었기 때문에 문제가 없다는 것이다.

2. 국정쇄신
문재인 대통령이 신임 국무총리에 김부겸 전 행정안전부 장관을 지명하고, 5개 부처 장관을 바꾸는 개각에 이어 청와대 참모진까지 개편하는 대대적인 인적쇄신을 단행했다.

3. 국민의힘·국민의당 합당
국민의힘 의원들이 국민의당과 합당에 찬성한다는 의견을 모았다. 주호영 대표 권한대행이 사의를 표명하면서 차기 원내대표 선출 일정에 돌입한다.

4. 고덕동 아파트
전국택배노동조합이 '택배 갑질' 논란을 빚은 서울 강동구 고덕동의 한 아파트의 '집 앞 배송'을 재개한다고 밝혔다. 그 대신 노조는 매일 밤 촛불집회를 시작한다.

5. 세월호 7주기
세월호 7주기인 이날 전남 진도군 조도면 사고해역 인근에서 선상추모식이 열렸다.",긍정
9,976,머니투데이,이사민,"이낙연 '쪼개기 식사'는 ""우연""…한번에 결제했지만 ""방역위반 아냐"" - 머니투데이","이낙연 더불어민주당 전 대표와 홍영표 더불어민주당 의원 2018.9.5/뉴스1  

더불어민주당 이낙연 전 대표와 홍영표 의원을 향한 '쪼개기 식사' 의혹이 제기됐지만, 강남구는 방역수칙 위반이 아니라고 결론냈다. 16명이 한 식당에 갔고 식사비용도 한 번에 결제됐지만, 사전에 계획된 일정이 아닌 우연이었기 때문에 문제 없다는 판단이다.

16일 강남구청은 이 전 대표와 홍 의원 등의 식사가 사전에 약속한 일정이 아니었던 것으로 확인된 만큼 '방역수칙 위반에 해당하지 않는다'고 설명했다.

앞서 이 전 대표와 홍 의원을 포함한 정치권 인사 16명은 지난달 23일 서울 강남구의 한 호텔 내 식당을 찾아 각각 분리된 방에서 4명씩 점심 식사를 했다. 이들은 해당 호텔에서 재경전북도민회가 주최한 '2021년 정기총회' 행사에 참석한 뒤 식당을 방문한 것으로 알려졌다.

강남구청 관계자는 머니투데이와의 통화에서 ""행사가 해산된 뒤 참석자들이 각자 모이다 보니 한 식당에 16명이 가게 된 것""이라며 ""이날 열린 행사에 애초 식사는 계획돼 있지 않았다""고 말했다.

또 당시 16명분의 식사 결제는 한 번에 된 것으로 확인됐다. 그럼에도 강남구청 측은 ""결제를 누가 했는지는 확인되지 않는다""며 ""결제 여부와 상관없이 방역수칙 위반은 아니다""라고 밝혔다.

해당 호텔에서 열린 행사 후 △우연히 네 명씩 식사를 하기로 했고 △마침 한 식당에 네 팀이 모였으며 △우연히 한 사람이 밥값을 대신 냈다. 그러나 5인 이상 집합금지 방역수칙 위반의 근거가 되는 '사전에 합의한 일정'이라는 점은 증명되지 않았다는 설명이다.

한편 우상호 민주당 의원도 4·7 재·보궐선거 직후인 지난 8일 '6인 술자리'에 참석했다는 민원으로 논란이 된 바 있다. 이에 대해 우 의원 측은 ""일행이 아닌데 팬이라고 해 (동석 제안을) 뿌리칠 수 없었다""며 ""5분 정도 앉았다가 일어난 게 전부""라고 해명했다.",긍정
10,1012,머니투데이,최경민,"이낙연 등 4명씩 16명 '쪼개기 식사' 논란…""방역수칙 위반 아냐"" - 머니투데이","(서울=뉴스1) 국회사진취재단 =이낙연 전 더불어민주당 대표. 2021.4.15/뉴스1    

식당에서 4명씩 총 16명이 '쪼개기 식사'를 한 더불어민주당의 이낙연 전 대표, 홍영표 의원 등에 대해 서울 강남구가 방역수칙 위반이 아니라고 16일 판단했다.

지난달 23일 이 전 대표와 홍 의원 등은 강남구 한 호텔에서 열린 행사에 참석한 뒤 같은 식당의 분리된 방에서 4명씩 식사한 바 있다.  해당 보도가 나온 이후 방역수칙 위반 논란이 일었다.

강남구 측은 이 전 대표 등의 식사가 사전에 약속한 일정이 아니었기에 방역수칙 위반에 해당하지 않는다고 설명했다. 5인 이상 집합금지 방역수칙 위반에 해당하려면, 사전에 합의한 일정이어야 한다는 것이다.",긍정
11,1023,머니투데이,변휘|,"윤석열 25%, 이재명 24%…'군소후보' 된 이낙연 5% - 머니투데이","윤석열 전 검찰총장(왼쪽)과 이재명 경기지사./사진=머니투데이DB

윤석열 전 검찰총장과 이재명 경기도지사가 차기 대선주자 선호도 조사에서 초박빙 '2강' 경쟁을 이어가고 있다. 이낙연 전 더불어민주당 대표는 거듭된 내림세로 '군소후보' 중 한 명이 됐다.

16일 여론조사업체 한국갤럽이 발표한 4월3주차(13~15일) 대선주자 선호도 조사 결과에 따르면, 윤 총장과 이 지사는 각각 25%의 지지율을 기록했다. 또 이 전 지사는 24%의 지지율로, 두 사람은 오차범위(95% 신뢰수준에서 ±3.1%포인트)) 초박빙 접전 양상을 보였다. 

이 전 대표는 직전 조사(4월1주) 대비 2%p 하락한 5%의 지지율에 그쳤다. 1년 전 이맘때 유일한 20%대 지지율의 '1강' 대권주자였지만, 1년 새 빠르게 주저앉았다. 

이 전 대표는 오히려 안철수 국민의당 대표(4%), 홍준표 무소속 의원(2%), 오세훈 서울시장(2%) 등 군소후보들과 오차범위 내 접전을 펼치게 됐다. 

이 밖에 기타 인물을 지목한 유권자는 5%, 특정 인물을 꼽지 않은 유보층은 33%에 달했다

국민의힘 지지자 중 56%가 윤 전 총장을 꼽았다. 특히 국민의당 지지자 중에서도 43%가 윤 전 총장을 선택, 안 대표(23%)를 크게 앞질렀다. 보수성향, 대통령 부정 평가자 등에서도 40% 안팎의 선호도를 기록했다. 연령대는 60대 이상(43%), 50대(32%) 선호도가 높았다.

이 지사의 경우 민주당의 51%, 정의당의 43% 지지자로부터 선택받았다. 진보성향과 대통령 긍정 평가자로부터 각각 48%의 선호도를 기록했고,  인천·경기와 광주·전라 지역에서 30% 안팎의 선호도를 기록했다. 연령대는 40대(37%), 30대(26%)에서 윤 전 총장에 앞섰다. 

윤 전 총장 선호도가 3월 2주 20%대에 진입하며 한 달 이상 두 사람의 접전이 이어지는 추세다. 그간 윤 총장의 지지율은 16%p 올랐고, 이 지사는 지지율을 그대로 유지하고 있다. 

다만 내년 대선에서 '정권 교체를 위해 야당 후보가 당선되는 것이 좋다'는 응답은 55%로, '정권 유지를 위한 여당 후보 당선' 응답(34%)을 크게 앞섰다. 작년 12월 조사에서 정권교체가 44%, 정권유지가 41%로 역전된 이후 격차가 점점 더 벌어지는 흐름이다. 

한편 이번 조사는 전국 만 18세 이상 5954명에게 통화를 시도해 1005명이 응답했다. 응답률은 17%다. 휴대전화 RDD 표본 프레임에서 무작위 추출(집전화 RDD 15% 포함) 방식으로 실시했다. 자세한 조사개요와 결과는 한국갤럽과 중앙선거여론조사심의위원회 홈페이지를 참조하면 된다.",긍정
12,1031,머니투데이,김지영,"이낙연 ""세월호 7주기, 슬픔은 그대로…완전한 진상규명 다짐"" - 머니투데이","세월호참사가족협의회가 22일 서울 종로구 청와대 사랑채 앞에서 세월호참사 7주기 '기억과 약속의 달 선포 기자회견'을 하고 있다. /사진=이기범 기자 leekb@

이낙연 더불어민주당 전 대표가""세월호 7주기, 완전한 진상규명을 다짐한다""고 밝혔다.

이 전 대표는 16일 페이스북에 ""세월호 7주기다. 세월은 흘러도 슬픔은 그대로고, 엄마는 아직 아들의 신을 신고 다니고 아빠는 거인이 돼서 배를 끌어 올리는 꿈을 꾼다""라고 했다.

이어 ""그날의 충격과 무력감은 아직 해소되지 않았다""며 ""지난해 12월 세월호 참사 특조위 조사 기간이 2022년 6월까지로 연장됐다""고 설명했다.

또 ""우리가 기억하고 노력하는 한, 세월호의 진실은 결국 밝혀질 것""이라며 ""유가족들과 국민께 완전한 진상 규명을 거듭 다짐한다""고 강조했다.

이 전 대표는 ""그런 불행이 다시는 없도록 '안전 대한민국'을 꼭 건설하겠다는 약속도 드린다""고 덧붙였다.

이와 함께 ""아이들과 선생님들, 숨지신 모든 분들의 명복을 빈다.유족들의 슬픔에 다시 한 번 위로를 드린다""며 ""제가 전남지사로 일하던 기간에 팽목항과 목포신항에서 모셨던 미수습자 가족들께 각별한 인사를 올린다""고 했다. 

민주당 대선 주자로 꼽히는 이 전 대표는 이날 오전 참사 당시 단원고등학교 학생들을 구조하다 유명을 달리한 고(故) 김초원 교사를 추모하기 위해 대전현충원을 찾는다.",긍정
13,1042,머니투데이,김성진,"""죽어도 文"" 이낙연에…이준석 ""'죽어도 朴' 태극기 같아"" - 머니투데이","이준석 전 미래통합당(국민의힘) 최고위원. 2020.4.29/사진제공=뉴스1

이준석 국민의힘 최고위원이 '죽음도 불사하고 문재인 대통령을 지키겠다'는 이낙연 전 더불어민주당 대표의 발언에 대해 ""민주당은 절대 진보적 자유주의자가 될 수 없고, 말그대로 '애국보수' 대척점에 있는 '애국진보' 정도가 이념적 지향""이라 평가했다.

이 전 최고위원은 16일 페이스북에 ""원래 진보적 자유주의자들은 '충성'의 대상을 두지 않는다""고 적었다.

이어 ""그러다 보니 국기에 대한 경례도 '조국과 민족의 무궁한 영광을 위하여 몸과 마음을 바쳐' 충성을 다할 것을 맹세하는 것을 거부했던 것이고, '자유롭고 정의로운 대한민국'의 무궁한 영광 정도에 충성하는 것으로 타협한 것""이라 설명했다.

그는 ""이제 민주당은 태극기 부대 비판할 자격이 없다""면서 ""'죽어도 文(문 대통령) 지킬 것'이라 하는 상황에 '죽어도 朴(박근혜 전 대통령) 지킬 것'이란 태극기 부대를 누가 비판할 수 있나""라 물었다.

그러면서 ""무엇이라 이름 붙일 일만 남았고, 태극기를 들고나오지는 않을 테니 들고나오는 것에 '부대' 붙이면 된다""며 '애국진보' 명칭을 꼽았다.

이날 뉴스1은 이 전 대표가 ""내가 죽는 한이 있더라도 문재인 대통령을 지키고 가겠다""는 입장을 밝혔다고 보도했다. 내년 대선에 이기려면 문 대통령과 차별화해야 한다는 정치권 일각의 주장에 대한 답변이었다.",긍정
14,1051,머니투데이,김지영,"이낙연 ""대통령 안하지 文대통령과 차별화는 못한다…배신 없다"" - 머니투데이","코로나19 자가격리에서 해제된 이낙연 더불어민주당 전 대표가 15일 오후 서울 종로구 자택을 나서며 취재진의 질의에 답변하고 있다. /사진=뉴스1   

이낙연 더불어민주당 전 대표는 대선주자로서  문재인 대통령과 차별화가 필요하다는 주장이 나오자 ""내가 죽는 한이 있더라도 대통령을 지키고 가겠다""고 말한 것으로 알려졌다.

지난 15일 뉴스1은 이 전 대표가 이낙연계 의원 약 25명과 연이어  만나 난상 토론을 벌였다고 단독 보도했다.

해당 보도에 따르면 최근 당 안팎에선 이 전 대표가 차기 대선 주자로서 위기 국면을 타개하기 위해 대통령과 차별화해야만 한다는 목소리가 나왔다. 이에 25명의 이낙연계 의원들과 토론에서도 이 의견이 화두에 올랐던 것으로 전해진다.

이에 대해 이 전 대표는 ""정권 재창출이 문 대통령을 지키는 길""이라며 차별화 문제에 대해 분명하게 선을 그었다. 그는 ""문재인 정부에서 절반 이상 2인자(국무총리)를 했는데 내가 다른 소리를 하는 것은 '사기'""라며 ""(대통령을) 안 했으면 안 했지, 그 짓(차별화)은 못 한다. 나는 오늘 이 자리에서 여러분 앞에서 분명히 말한다. 문 대통령을 배신할 수 없다""고 강조했다.

또 ""그것(대통령과 차별화)은 이낙연답지 않다""며 ""다만, 정권 재창출이 문 대통령을 지키는 길이기 때문에 포지티브(positive·긍정적)한 측면에서 정책을 보강하고 수정하고 재검토할 수 있다. 포지티브 차별화는 하겠다""고 강조했다. 

이날 이 전 대표는 지지율이 한 자릿수로 내려가면서 최저치로 떨어졌다는 여론조사 결과가 나왔다. 엠브레인퍼블릭·케이스탯리서치·코리아리서치·한국리서치 4개 여론조사 전문회사가 지난 12~14일 전국 성인남녀 1010명을 대상으로 4월2주차 전국지표조사(NBS)를 실시한 결과, '대선후보 적합도'에서 이재명 지사는 26%, 윤석열 전 총장은 23%,이 전 대표 8%로 집계됐으며 '태도유보'는 29%다(표본 오차는 95% 신뢰수준에서 ±3.1%p, 중앙선거여론조사심의위원회 홈페이지 참조).

이 전 대표 지지율은 전주 대비 2%p 감소했다. 이 전 대표의 지지율이 한 자릿수로 떨어진 것은 지난해 7월 조사 이후 처음이다.",긍정
15,1101,머니투데이,이사민,"이낙연 ""민주당, 숱한 패배 뒤 끝내 승리한 정당…재신임 받을 것"" - 머니투데이","(서울=뉴스1) 이낙연 전 더불어민주당 대표 2021.4.7/뉴스1  

이낙연 전 더불어민주당 대표가 자가격리를 마친 15일 ""당원의 한 사람으로서 민주당이 반성과 쇄신을 통해 국민 신임을 다시 받는 일에 제 모든 힘을 보태겠다""고 말했다.

이 전 대표는 이날 페이스북에 ""더 넓게 뛰고 더 많은 분을 만나 말씀을 듣겠다""며 이같이 말했다.

이 전 대표는 ""집에 머물며 4·7 재보선을 함께 뛰어주신 의원과 당원들께 전화로 감사와 사과를 드렸다""라며 ""기대와 도움에 부응하지 못한 터에 그런 전화를 드리자니 면목이 없었다. 그러나 많은 분이 오히려 민주당과 저를 위로하고 격려해 주셨다""고 했다.

이어 ""특히 국민을 향한 정책을 더욱 세심하게 정돈하고, 민생을 살려 우리 정부를 성공시켜야 한다는 말씀을 많이 해 주셨다""며 ""선거 결과로 나타난 국민 마음을 더 잘 헤아리라고 충고해 주셨다""고 전했다.

이 전 대표는 ""민주당의 역사는 대한민국 민주주의의 역사""라며 ""무수한 선배들의 희생과 숱한 패배 위에서 끝내 승리한 정당이자 자랑스러운 세 분의 대통령을 배출했다. 지금은 코로나 국난을 극복하기 위해 당·정·청이 한마음으로 대처하고 있다""고 설명했다.

그러면서 ""재보선 패배는 아프고 민주당이 직면한 과제들은 무겁지만 그래도 민주당은 국민께서 주신 뜻을 살피고 국민의 신뢰를 회복할 역량과 각오를 갖고 있다고 저는 믿는다""고 말했다.

그는 ""더 낮은 자세로 국민의 삶에 더 깊이 들어가겠다""며 ""국민 삶에서의 행복이 저희가 추구해야 할 가치이기 때문""이라고 덧붙였다.",긍정
16,1103,머니투데이,김태은,"'자가격리 해제' 이낙연, 첫 일정 세월호 참배…""문자폭탄 한방향 아냐"" - 머니투데이","(서울=뉴스1) 국회사진취재단 = 코로나19 자가격리에서 해제된 이낙연 더불어민주당 전 대표가 15일 오후 서울 종로구 자택을 나서고 있다. 2021.4.15/뉴스1   

이낙연 전 더불어민주당 대표가 일주일 간 자가격리를 마치고 오는 16일 세월호 희생자 묘소 참배로 첫 일정을 시작한다. 국립대전현충원에 안장된 '세월호 순직' 단원고 교사들의 묘를 찾아 이들의 희생을 기릴 것으로 알려졌다.

이낙연 전 대표 측 관계자는 15일 ""이 전 대표가 비공개 일정으로 대전현충원을 찾아 세월호 희생자들을 추모할 예정""이라며 ""재보궐 선거 이후 대외 행보를 재개한다거나 공식적으로 대선주자로서 활동할 계획은 아직 없다""고 말했다.

이 전 대표는 이날 페이스북을 통해 ""저는 당원의 한 사람으로서 민주당이 반성과 쇄신을 통해 국민의 신임을 다시 받는 일에 저의 모든 힘을 보태겠다""며 ""더 넓게 뛰고, 더 많은 분들을 만나 말씀을 듣겠다""고 적었다.

그는 앞서 지난 7일 부인이 코로나19(COVID-19) 확진자와 접촉하면서 자가격리에 들어간 바 있다. 자가격리 기간이 끝난 이날 서울 종로구 소재 자택에서 기자들과 만나  재보선 결과에 대해 ""저희가 해왔던 일들을 전면적으로 되돌아보고 쇄신할 건 쇄신하겠다. 당의 쇄신 노력에 힘을 보태겠다""고 말했다.

일부 강성 친문(親 문재인) 당원에 대해서는 ""그런 당원들의 의견은 존중돼야 한다고 생각한다""면서도 ""당심도 여러갈래로 나타나고 있는데 그것을 표현할 때는 사실에 입각하고 절제있게 표현하는 것이 당을 위해서 좋겠다고 판단한다""고 했다.

이 전 대표는 ""당심이 하나가 아니다""며 ""당심과 민심이 크게 다르다고 보지 않는다""고 지적했다.  '조국 사태'를 선거 패배 원인으로 지목한 초선 의원들에게 강성 당원들이 '문자 폭탄'을 보내는 것에 대해선 ""절제의 범위를 지키도록 노력하는 것이 설득력을 얻는 데 도움이 될 거라고 생각한다""고 당부했다. 다만 그는 문자 폭탄 내용에 대해 ""그 문자는 어느 한방향이 아니다""고 강조했다.

당내에서 선거 패인으로 조국 사태와 후보 공천, 부동산 문제 등이 제기되는 것에 대해서는 ""다양한 원인 분석이 있고 그것을 우리는 경청해야 한다""며 ""혁신 방안은 시간이 걸려도 제대로 된 혁신 방안을 내놔야 한다""고 했다.

이 전 대표는 부동산 정책과 관련해서는 ""기본적으로 주택 공급이 지속적으로 이뤄져야 한다""며 ""생애 최초 주택 구입자에 대한 금융 제재는 대폭 완화할 필요가 있다""고 대안을 제시했다.

그러면서 자신이 제안한 50년 만기 모기지 국가보증과 박영선 전 중소벤처기업부 장관이 후보 당시 공약한 반값아파트 정책도 계속 추진해야 한다는 입장을 밝혔다.",긍정
